Version,Set,Old_Set_ID,CID,QID,Sub-ID,Wording,Response,Comment,Respondent,Dom,DomOrder,DataType,Answer1,Answer2,Answer3,Answer4,Answer5,Answer6,Answer7,Answer8,Surname,[q2o1answer],FLang,F_ISO,F_Glottocode,[q2o2answer],NLang,N_ISO,N_Glottocode,ContactPair,ContactPair_ISO,ContactPair_Glottocode,AArea,Reviewer
1.0.0,set03,set04,OT1,OT1,,1. How long have [q2o1answer] and [q2o2answer] people been in contact overall?,At least since the mid of the 19th century. ,cf. map in Braukämper 1983: 60,Yvonne Treis & Deginet Wotango Doyiso,OV,6,Comment,NA,NA,NA,NA,NA,NA,NA,NA,Treis1Doyiso2,Kambaata,Kambaata,ktb,kamb1316,Wolaytta,Wolaytta,wal,wola1242,Kambaata - Wolaytta,ktb-wal,kamb1316–wola1242,Greater Abyssinia,"FDG, OR"
1.0.0,set03,set04,OT1N,OT1N,,"Coarse time range, numerical",1850-2020,NA,Yvonne Treis & Deginet Wotango Doyiso,OV,6,Value,NA,NA,NA,NA,NA,NA,NA,NA,Treis1Doyiso2,Kambaata,Kambaata,ktb,kamb1316,Wolaytta,Wolaytta,wal,wola1242,Kambaata - Wolaytta,ktb-wal,kamb1316–wola1242,Greater Abyssinia,"FDG, OR"
1.0.0,set03,set04,OT2,OT2,,2. What is the overall time frame when the largest number of people had the most opportunities for interaction?,We don't know,,Yvonne Treis & Deginet Wotango Doyiso,OV,6,Comment,NA,NA,NA,NA,NA,NA,NA,NA,Treis1Doyiso2,Kambaata,Kambaata,ktb,kamb1316,Wolaytta,Wolaytta,wal,wola1242,Kambaata - Wolaytta,ktb-wal,kamb1316–wola1242,Greater Abyssinia,"FDG, OR"
1.0.0,set03,set04,OT2N,OT2N,,"Coarse time range, numerical",0000-0000,NA,Yvonne Treis & Deginet Wotango Doyiso,OV,6,Value,NA,NA,NA,NA,NA,NA,NA,NA,Treis1Doyiso2,Kambaata,Kambaata,ktb,kamb1316,Wolaytta,Wolaytta,wal,wola1242,Kambaata - Wolaytta,ktb-wal,kamb1316–wola1242,Greater Abyssinia,"FDG, OR"
1.0.0,set03,set04,OD1,OD1,,1. What is the total number of native-like speakers of [q2o1answer]?,"100,000-999,999 speakers","Last Ethiopian census 2007: ~ 600,000",Yvonne Treis & Deginet Wotango Doyiso,OV,6,Types,10-99 speakers,100-999 speakers,"1,000-9,999 speakers","10,000-99,999 speakers","100,000-999,999 speakers","1,000,000-9,999,999 speakers","10,000,000-99,999,999 speakers","100,000,000-999,999,999 speakers",Treis1Doyiso2,Kambaata,Kambaata,ktb,kamb1316,Wolaytta,Wolaytta,wal,wola1242,Kambaata - Wolaytta,ktb-wal,kamb1316–wola1242,Greater Abyssinia,"FDG, OR"
1.0.0,set03,set04,OD3,OD3,,2. What is the total number of native-like speakers of [q2o2answer]?,"1,000,000-9,999,999 speakers","Last Ethiopian census 2007: ~ 1.600,000",Yvonne Treis & Deginet Wotango Doyiso,OV,6,Types,10-99 speakers,100-999 speakers,"1,000-9,999 speakers","10,000-99,999 speakers","100,000-999,999 speakers","1,000,000-9,999,999 speakers","10,000,000-99,999,999 speakers","100,000,000-999,999,999 speakers",Treis1Doyiso2,Kambaata,Kambaata,ktb,kamb1316,Wolaytta,Wolaytta,wal,wola1242,Kambaata - Wolaytta,ktb-wal,kamb1316–wola1242,Greater Abyssinia,"FDG, OR"
1.0.0,set03,set04,OD4,OD4,,3. What is the approximate proportion of native-like speakers in the total population of all speakers of [q2o1answer]?,High proportion,,Yvonne Treis & Deginet Wotango Doyiso,OV,6,Scalar,High proportion,Fairly high proportion,Intermediate proportion,Fairly low proportion,Low proportion,NA,NA,NA,Treis1Doyiso2,Kambaata,Kambaata,ktb,kamb1316,Wolaytta,Wolaytta,wal,wola1242,Kambaata - Wolaytta,ktb-wal,kamb1316–wola1242,Greater Abyssinia,"FDG, OR"
1.0.0,set03,set04,OD5,OD5,,4. What is the approximate proportion of native-like speakers in the total population of all speakers of [q2o2answer]?,High proportion,,Yvonne Treis & Deginet Wotango Doyiso,OV,6,Scalar,High proportion,Fairly high proportion,Intermediate proportion,Fairly low proportion,Low proportion,NA,NA,NA,Treis1Doyiso2,Kambaata,Kambaata,ktb,kamb1316,Wolaytta,Wolaytta,wal,wola1242,Kambaata - Wolaytta,ktb-wal,kamb1316–wola1242,Greater Abyssinia,"FDG, OR"
1.0.0,set03,set04,OG1,OG1,,5. What is the population density within the area where [q2o1answer] is spoken?,5–19 persons per 10 sq. km,502 per sq. km2,Yvonne Treis & Deginet Wotango Doyiso,OV,6,Types,Less than 2 persons per 10 sq. km,2–4 persons per 10 sq. km,5–19 persons per 10 sq. km,20–99 persons per 10 sq. km,100–399 persons per 10 sq. km,NA,NA,NA,Treis1Doyiso2,Kambaata,Kambaata,ktb,kamb1316,Wolaytta,Wolaytta,wal,wola1242,Kambaata - Wolaytta,ktb-wal,kamb1316–wola1242,Greater Abyssinia,"FDG, OR"
1.0.0,set03,set04,OS7,OS7,,6. What is the mean size of the [q2o1answer] speaking communities at the local level?,"More than 1,000 persons in the absence of indigenous urban aggregations",,Yvonne Treis & Deginet Wotango Doyiso,OV,6,Types,Fewer than 50 persons,From 50 to 99 persons,From 100 to 199 persons,From 200 to 399 persons,"From 400 to 1,000 persons","More than 1,000 persons in the absence of indigenous urban aggregations","One or more indigenous towns of more than 5,000 inhabitants but none of more than 50,000",NA,Treis1Doyiso2,Kambaata,Kambaata,ktb,kamb1316,Wolaytta,Wolaytta,wal,wola1242,Kambaata - Wolaytta,ktb-wal,kamb1316–wola1242,Greater Abyssinia,"FDG, OR"
1.0.0,set03,set04,OS9,OS9,,7. How frequently do [q2o1answer] people generally interact with out-group people? ,Infrequently,,Yvonne Treis & Deginet Wotango Doyiso,OV,6,Scalar,Very Frequently,Frequently,Neither frequently nor infrequently,Infrequently,Very infrequently,NA,NA,NA,Treis1Doyiso2,Kambaata,Kambaata,ktb,kamb1316,Wolaytta,Wolaytta,wal,wola1242,Kambaata - Wolaytta,ktb-wal,kamb1316–wola1242,Greater Abyssinia,"FDG, OR"
1.0.0,set03,set04,OI1,OI1,OI1-1,"8. Is [q2o1answer] stated as an expression of identity of any of the following? Group centered around shared descent, such as clan, house, lineage group, kinship group",No,,Yvonne Treis & Deginet Wotango Doyiso,OV,6,Binary-YesNo,Yes,No,NA,NA,NA,NA,NA,NA,Treis1Doyiso2,Kambaata,Kambaata,ktb,kamb1316,Wolaytta,Wolaytta,wal,wola1242,Kambaata - Wolaytta,ktb-wal,kamb1316–wola1242,Greater Abyssinia,"FDG, OR"
1.0.0,set03,set04,OI1,OI1,OI1-2,"8. Is [q2o1answer] stated as an expression of identity of any of the following? Race, ethnicity, or some other similar grouping",Yes,,Yvonne Treis & Deginet Wotango Doyiso,OV,6,Binary-YesNo,Yes,No,NA,NA,NA,NA,NA,NA,Treis1Doyiso2,Kambaata,Kambaata,ktb,kamb1316,Wolaytta,Wolaytta,wal,wola1242,Kambaata - Wolaytta,ktb-wal,kamb1316–wola1242,Greater Abyssinia,"FDG, OR"
1.0.0,set03,set04,OI1,OI1,OI1-3,"8. Is [q2o1answer] stated as an expression of identity of any of the following? Micro-level (politico-)territorial group, including regional or areal groups, clans, bands, tribes",Yes,,Yvonne Treis & Deginet Wotango Doyiso,OV,6,Binary-YesNo,Yes,No,NA,NA,NA,NA,NA,NA,Treis1Doyiso2,Kambaata,Kambaata,ktb,kamb1316,Wolaytta,Wolaytta,wal,wola1242,Kambaata - Wolaytta,ktb-wal,kamb1316–wola1242,Greater Abyssinia,"FDG, OR"
1.0.0,set03,set04,OI1,OI1,OI1-4,"8. Is [q2o1answer] stated as an expression of identity of any of the following? Macro-level (politico-)territorial group, such as nation, tribe, state",No,,Yvonne Treis & Deginet Wotango Doyiso,OV,6,Binary-YesNo,Yes,No,NA,NA,NA,NA,NA,NA,Treis1Doyiso2,Kambaata,Kambaata,ktb,kamb1316,Wolaytta,Wolaytta,wal,wola1242,Kambaata - Wolaytta,ktb-wal,kamb1316–wola1242,Greater Abyssinia,"FDG, OR"
1.0.0,set03,set04,OI1,OI1,OI1-5,"8. Is [q2o1answer] stated as an expression of identity of any of the following? Formal or informal relationships between non-kin, such as alliances, sodality membership, ad-hoc relationships between families or individuals",No,,Yvonne Treis & Deginet Wotango Doyiso,OV,6,Binary-YesNo,Yes,No,NA,NA,NA,NA,NA,NA,Treis1Doyiso2,Kambaata,Kambaata,ktb,kamb1316,Wolaytta,Wolaytta,wal,wola1242,Kambaata - Wolaytta,ktb-wal,kamb1316–wola1242,Greater Abyssinia,"FDG, OR"
1.0.0,set03,set04,OI3,OI3,,9. Is there a codified standard variety for [q2o1answer]?,Yes,,Yvonne Treis & Deginet Wotango Doyiso,OV,6,Binary-YesNo,Yes,No,NA,NA,NA,NA,NA,NA,Treis1Doyiso2,Kambaata,Kambaata,ktb,kamb1316,Wolaytta,Wolaytta,wal,wola1242,Kambaata - Wolaytta,ktb-wal,kamb1316–wola1242,Greater Abyssinia,"FDG, OR"
1.0.0,set03,set04,OI6,OI6,,"10. What are the [q2o1answer] speakers' attitudes towards linguistic transfers from [q2o2answer], such as lexical or grammatical borrowing?",Neither positive nor negative,,Yvonne Treis & Deginet Wotango Doyiso,OV,6,Scalar,Very positive,Positive,Neither positive nor negative,Negative,Very negative,NA,NA,NA,Treis1Doyiso2,Kambaata,Kambaata,ktb,kamb1316,Wolaytta,Wolaytta,wal,wola1242,Kambaata - Wolaytta,ktb-wal,kamb1316–wola1242,Greater Abyssinia,"FDG, OR"
1.0.0,set03,set04,OI7,OI7,,"11. What are the [q2o1answer] speakers' general attitudes towards linguistic transfer, such as lexical or grammatical borrowing, from any other language than [q2o2answer]?",Positive,,Yvonne Treis & Deginet Wotango Doyiso,OV,6,Scalar,Very positive,Positive,Neither positive nor negative,Negative,Very negative,NA,NA,NA,Treis1Doyiso2,Kambaata,Kambaata,ktb,kamb1316,Wolaytta,Wolaytta,wal,wola1242,Kambaata - Wolaytta,ktb-wal,kamb1316–wola1242,Greater Abyssinia,"FDG, OR"
1.0.0,set03,set04,OI9,OI9,,12. What are the [q2o1answer] speakers' attitudes towards lectal differences within [q2o1answer]?,Neither positive nor negative,,Yvonne Treis & Deginet Wotango Doyiso,OV,6,Scalar,Very positive,Positive,Neither positive nor negative,Negative,Very negative,NA,NA,NA,Treis1Doyiso2,Kambaata,Kambaata,ktb,kamb1316,Wolaytta,Wolaytta,wal,wola1242,Kambaata - Wolaytta,ktb-wal,kamb1316–wola1242,Greater Abyssinia,"FDG, OR"
1.0.0,set03,set04,OI8,OI8,,13. How significant is language as part of group identity for the speakers of [q2o1answer]?,Very significant,,Yvonne Treis & Deginet Wotango Doyiso,OV,6,Scalar,Very significant,Significant,Neither significant nor insignificant,Insignificant,Very insignificant,NA,NA,NA,Treis1Doyiso2,Kambaata,Kambaata,ktb,kamb1316,Wolaytta,Wolaytta,wal,wola1242,Kambaata - Wolaytta,ktb-wal,kamb1316–wola1242,Greater Abyssinia,"FDG, OR"
1.0.0,set03,set04,OB1,OB1,,14. There is an emic conception of [q2o1answer] as “a language” or some other categorical or objective thing?,Yes,,Yvonne Treis & Deginet Wotango Doyiso,OV,6,Binary-YesNo,Yes,No,NA,NA,NA,NA,NA,NA,Treis1Doyiso2,Kambaata,Kambaata,ktb,kamb1316,Wolaytta,Wolaytta,wal,wola1242,Kambaata - Wolaytta,ktb-wal,kamb1316–wola1242,Greater Abyssinia,"FDG, OR"
1.0.0,set03,set04,O10,O10,,[q2o1answer] peoples’ language loyalty towards [q2o1answer] can be characterised as:,Very Low,"Kambaata shift to Amharic immediately (1) when outside their territory, (2) in the presence of a non-Kambaata person, and (3) in any kind of public setting (political meetings, religious gatherings, school, courts ...) in the Kambaata zone itself.",Yvonne Treis & Deginet Wotango Doyiso,OV,6,Scalar,Very high,High,Neither low nor high,Low,Very low,NA,NA,NA,Treis1Doyiso2,Kambaata,Kambaata,ktb,kamb1316,Wolaytta,Wolaytta,wal,wola1242,Kambaata - Wolaytta,ktb-wal,kamb1316–wola1242,Greater Abyssinia,"FDG, OR"
1.0.0,set03,set04,OL3,OL3,,15. Do the [q2o1answer] speaking people use some orthography in writing their language?,"Yes, in a standardised way*",The standard is mastered by hardly anybody and there is a huge variation.,Yvonne Treis & Deginet Wotango Doyiso,OV,6,Types,"Yes, in a non-standardised way","Yes, in a standardised way","No, the Focus Group language is not written",NA,NA,NA,NA,NA,Treis1Doyiso2,Kambaata,Kambaata,ktb,kamb1316,Wolaytta,Wolaytta,wal,wola1242,Kambaata - Wolaytta,ktb-wal,kamb1316–wola1242,Greater Abyssinia,"FDG, OR"
1.0.0,set03,set04,OL1,OL1,,16. What is the approximate rate of formal literacy in the [q2o1answer] speaking community?,Low,"We answer this question having formal literacy of *Kambaata* (not Amharic) in mind. Formal literacy in Amharic is much higher and can be estimated to be at least ""intermediate"".",Yvonne Treis & Deginet Wotango Doyiso,OV,6,Scalar,High,Fairly high,Intermediate,Fairly low,Low,NA,NA,NA,Treis1Doyiso2,Kambaata,Kambaata,ktb,kamb1316,Wolaytta,Wolaytta,wal,wola1242,Kambaata - Wolaytta,ktb-wal,kamb1316–wola1242,Greater Abyssinia,"FDG, OR"
1.0.0,set03,set04,OL2,OL2,OL2-1,"17. Restrictions in access to literacy in terms of social categories. Is the ability to read and write restricted, in practice, to people of certain hierarchy groups associated with profession or wealth (such as class and caste)?",Yes,,Yvonne Treis & Deginet Wotango Doyiso,OV,6,Binary-YesNo,Yes,No,NA,NA,NA,NA,NA,NA,Treis1Doyiso2,Kambaata,Kambaata,ktb,kamb1316,Wolaytta,Wolaytta,wal,wola1242,Kambaata - Wolaytta,ktb-wal,kamb1316–wola1242,Greater Abyssinia,"FDG, OR"
1.0.0,set03,set04,OL2,OL2,OL2-2,"17. Restrictions in access to literacy in terms of social categories. Is the ability to read and write restricted, in practice, to people of certain magico-religiously sanctioned groups (such as religious denomination)?",No,,Yvonne Treis & Deginet Wotango Doyiso,OV,6,Binary-YesNo,Yes,No,NA,NA,NA,NA,NA,NA,Treis1Doyiso2,Kambaata,Kambaata,ktb,kamb1316,Wolaytta,Wolaytta,wal,wola1242,Kambaata - Wolaytta,ktb-wal,kamb1316–wola1242,Greater Abyssinia,"FDG, OR"
1.0.0,set03,set04,OL2,OL2,OL2-3,"17. Restrictions in access to literacy in terms of social categories. Is the ability to read and write restricted, in practice, to people of certain descent groups, such as clan, house, lineage group, kinship group)?",No,,Yvonne Treis & Deginet Wotango Doyiso,OV,6,Binary-YesNo,Yes,No,NA,NA,NA,NA,NA,NA,Treis1Doyiso2,Kambaata,Kambaata,ktb,kamb1316,Wolaytta,Wolaytta,wal,wola1242,Kambaata - Wolaytta,ktb-wal,kamb1316–wola1242,Greater Abyssinia,"FDG, OR"
1.0.0,set03,set04,OL2,OL2,OL2-4,"17. Restrictions in access to literacy in terms of social categories. Is the ability to read and write restricted, in practice, to people of certain races, ethnicities, or some other similar grouping?",No,,Yvonne Treis & Deginet Wotango Doyiso,OV,6,Binary-YesNo,Yes,No,NA,NA,NA,NA,NA,NA,Treis1Doyiso2,Kambaata,Kambaata,ktb,kamb1316,Wolaytta,Wolaytta,wal,wola1242,Kambaata - Wolaytta,ktb-wal,kamb1316–wola1242,Greater Abyssinia,"FDG, OR"
1.0.0,set03,set04,OL2,OL2,OL2-5,"17. Restrictions in access to literacy in terms of social categories. Is the ability to read and write restricted, in practice, to people of certain age cohorts or life stages?",No,,Yvonne Treis & Deginet Wotango Doyiso,OV,6,Binary-YesNo,Yes,No,NA,NA,NA,NA,NA,NA,Treis1Doyiso2,Kambaata,Kambaata,ktb,kamb1316,Wolaytta,Wolaytta,wal,wola1242,Kambaata - Wolaytta,ktb-wal,kamb1316–wola1242,Greater Abyssinia,"FDG, OR"
1.0.0,set03,set04,OL2,OL2,OL2-6,"17. Restrictions in access to literacy in terms of social categories. Is the ability to read and write restricted, in practice, to a certain sex or genders?",No,,Yvonne Treis & Deginet Wotango Doyiso,OV,6,Binary-YesNo,Yes,No,NA,NA,NA,NA,NA,NA,Treis1Doyiso2,Kambaata,Kambaata,ktb,kamb1316,Wolaytta,Wolaytta,wal,wola1242,Kambaata - Wolaytta,ktb-wal,kamb1316–wola1242,Greater Abyssinia,"FDG, OR"
1.0.0,set03,set04,OL2,OL2,OL2-7,"17. Restrictions in access to literacy in terms of social categories. Is the ability to read and write restricted, in practice, to other communities of practice not mentioned above?",No,,Yvonne Treis & Deginet Wotango Doyiso,OV,6,Binary-YesNo,Yes,No,NA,NA,NA,NA,NA,NA,Treis1Doyiso2,Kambaata,Kambaata,ktb,kamb1316,Wolaytta,Wolaytta,wal,wola1242,Kambaata - Wolaytta,ktb-wal,kamb1316–wola1242,Greater Abyssinia,"FDG, OR"
1.0.0,set03,set04,OS1,OS1,,"18. Typically, how many levels of jurisdictional hierarchy are there in the [q2o1answer] speaking society, beyond the local community?",Three levels,,Yvonne Treis & Deginet Wotango Doyiso,OV,6,Scalar,Four levels,Three levels,Two levels,One level,No levels,NA,NA,NA,Treis1Doyiso2,Kambaata,Kambaata,ktb,kamb1316,Wolaytta,Wolaytta,wal,wola1242,Kambaata - Wolaytta,ktb-wal,kamb1316–wola1242,Greater Abyssinia,"FDG, OR"
1.0.0,set03,set04,OS2,OS2,,"19. Typically, how many levels of jurisdictional hierarchy are there in [q2o2answer] society, beyond the local community?",Three levels,,Yvonne Treis & Deginet Wotango Doyiso,OV,6,Scalar,Four levels,Three levels,Two levels,One level,No levels,NA,NA,NA,Treis1Doyiso2,Kambaata,Kambaata,ktb,kamb1316,Wolaytta,Wolaytta,wal,wola1242,Kambaata - Wolaytta,ktb-wal,kamb1316–wola1242,Greater Abyssinia,"FDG, OR"
1.0.0,set03,set04,OS4,OS4,,"20. Which of the following best characterises the dominant form of the [q2o1answer] speaking group's mobility and sedentism, in regards to subsistence?",Sedentary,,Yvonne Treis & Deginet Wotango Doyiso,OV,6,Types,Sedentary,Mobile,Mixed,NA,NA,NA,NA,NA,Treis1Doyiso2,Kambaata,Kambaata,ktb,kamb1316,Wolaytta,Wolaytta,wal,wola1242,Kambaata - Wolaytta,ktb-wal,kamb1316–wola1242,Greater Abyssinia,"FDG, OR"
1.0.0,set03,set04,OS5,OS5,,"21. Which of the following best characterises the dominant form of the [q2o2answer] speaking group's mobility and sedentism, in regards to subsistence?",Sedentary,,Yvonne Treis & Deginet Wotango Doyiso,OV,6,Types,Sedentary,Mobile,Mixed,NA,NA,NA,NA,NA,Treis1Doyiso2,Kambaata,Kambaata,ktb,kamb1316,Wolaytta,Wolaytta,wal,wola1242,Kambaata - Wolaytta,ktb-wal,kamb1316–wola1242,Greater Abyssinia,"FDG, OR"
1.0.0,set03,set04,OS6,OS6,,22. The [q2o1answer] speaking society's subsistence pattern can be broadly characterised as... ,"Agricultural, Permanent",,Yvonne Treis & Deginet Wotango Doyiso,OV,6,Types,Hunter-gatherer,Fishing,Animal Husbadry,"Agricultural, casual","Agricultural, shifting","Agricultural, permanent",Highly Mixed,NA,Treis1Doyiso2,Kambaata,Kambaata,ktb,kamb1316,Wolaytta,Wolaytta,wal,wola1242,Kambaata - Wolaytta,ktb-wal,kamb1316–wola1242,Greater Abyssinia,"FDG, OR"
1.0.0,set03,set04,OH1,OH1,,"23. Have there been any natural disasters or major societal upheaval during the densest period of contact between the [q2o1answer] speaking and [q2o2answer] speaking people, such it impacted people's mobility, and [q2o1answer] speaking people talk about it?",No,,Yvonne Treis & Deginet Wotango Doyiso,OV,6,Binary-YesNo,Yes,No,NA,NA,NA,NA,NA,NA,Treis1Doyiso2,Kambaata,Kambaata,ktb,kamb1316,Wolaytta,Wolaytta,wal,wola1242,Kambaata - Wolaytta,ktb-wal,kamb1316–wola1242,Greater Abyssinia,"FDG, OR"
1.0.0,set03,set04,OE1,OE1,,24. How long time have you spent working with this community?,"Yvonne: since 2002
Deginet is a member of the community",NA,Yvonne Treis & Deginet Wotango Doyiso,OV,6,Comment,NA,NA,NA,NA,NA,NA,NA,NA,Treis1Doyiso2,Kambaata,Kambaata,ktb,kamb1316,Wolaytta,Wolaytta,wal,wola1242,Kambaata - Wolaytta,ktb-wal,kamb1316–wola1242,Greater Abyssinia,"FDG, OR"
1.0.0,set03,set04,OE2,OE2,,25. Whom did you mostly interact with during your stay and through community-based research?,"Yvonne: teachers, students, personnel of the educational departments, intensive contact with two families in two different areas",NA,Yvonne Treis & Deginet Wotango Doyiso,OV,6,Comment,NA,NA,NA,NA,NA,NA,NA,NA,Treis1Doyiso2,Kambaata,Kambaata,ktb,kamb1316,Wolaytta,Wolaytta,wal,wola1242,Kambaata - Wolaytta,ktb-wal,kamb1316–wola1242,Greater Abyssinia,"FDG, OR"
1.0.0,set03,set04,OE3,OE3,,26. Was your interaction with members of the community typically mediated by one/a few person(s)? Who were they?,no,NA,Yvonne Treis & Deginet Wotango Doyiso,OV,6,Comment,NA,NA,NA,NA,NA,NA,NA,NA,Treis1Doyiso2,Kambaata,Kambaata,ktb,kamb1316,Wolaytta,Wolaytta,wal,wola1242,Kambaata - Wolaytta,ktb-wal,kamb1316–wola1242,Greater Abyssinia,"FDG, OR"
1.0.0,set03,set04,OC1,OC1,,27. How certain are you in your responses to the set of questions about each domain?,Somewhat certain,,Yvonne Treis & Deginet Wotango Doyiso,OV,6,Scalar,Very certain,Certain,Somewhat certain,Uncertain,Very uncertain,NA,NA,NA,Treis1Doyiso2,Kambaata,Kambaata,ktb,kamb1316,Wolaytta,Wolaytta,wal,wola1242,Kambaata - Wolaytta,ktb-wal,kamb1316–wola1242,Greater Abyssinia,"FDG, OR"
1.0.0,set03,set04,OC2,OC2,,28. How certain are you in your responses to the set of questions about social networks (The S-Set of questions)?,Somewhat certain,,Yvonne Treis & Deginet Wotango Doyiso,OV,6,Scalar,Very certain,Certain,Somewhat certain,Uncertain,Very uncertain,NA,NA,NA,Treis1Doyiso2,Kambaata,Kambaata,ktb,kamb1316,Wolaytta,Wolaytta,wal,wola1242,Kambaata - Wolaytta,ktb-wal,kamb1316–wola1242,Greater Abyssinia,"FDG, OR"
1.0.0,set03,set04,OC3,OC3,,29. How certain are you in your responses to the set of questions about attitudes and ideologies (The B-Set of questions)?,Certain,,Yvonne Treis & Deginet Wotango Doyiso,OV,6,Scalar,Very certain,Certain,Somewhat certain,Uncertain,Very uncertain,NA,NA,NA,Treis1Doyiso2,Kambaata,Kambaata,ktb,kamb1316,Wolaytta,Wolaytta,wal,wola1242,Kambaata - Wolaytta,ktb-wal,kamb1316–wola1242,Greater Abyssinia,"FDG, OR"
1.0.0,set03,set04,OC4,OC4,,30. How certain are you in your responses to the set of questions about language production (The O-Set of questions)?,Certain,,Yvonne Treis & Deginet Wotango Doyiso,OV,6,Scalar,Very certain,Certain,Somewhat certain,Uncertain,Very uncertain,NA,NA,NA,Treis1Doyiso2,Kambaata,Kambaata,ktb,kamb1316,Wolaytta,Wolaytta,wal,wola1242,Kambaata - Wolaytta,ktb-wal,kamb1316–wola1242,Greater Abyssinia,"FDG, OR"
1.0.0,set03,set04,OC5,OC5,,31. How certain are you in your responses to the set of questions about the languages spoken to the [q2o1answer] people (The I-Set of questions)?,Uncertain,,Yvonne Treis & Deginet Wotango Doyiso,OV,6,Scalar,Very certain,Certain,Somewhat certain,Uncertain,Very uncertain,NA,NA,NA,Treis1Doyiso2,Kambaata,Kambaata,ktb,kamb1316,Wolaytta,Wolaytta,wal,wola1242,Kambaata - Wolaytta,ktb-wal,kamb1316–wola1242,Greater Abyssinia,"FDG, OR"
1.0.0,set03,set04,OC6,OC6,,32. How certain are you in your responses to the set of questions about children (The T-Set of questions)?,Somewhat certain,,Yvonne Treis & Deginet Wotango Doyiso,OV,6,Scalar,Very certain,Certain,Somewhat certain,Uncertain,Very uncertain,NA,NA,NA,Treis1Doyiso2,Kambaata,Kambaata,ktb,kamb1316,Wolaytta,Wolaytta,wal,wola1242,Kambaata - Wolaytta,ktb-wal,kamb1316–wola1242,Greater Abyssinia,"FDG, OR"
1.0.0,set03,set04,P1,DEM00,,1. Has exchange ever been a relevant domain of contact between [q2o1answer] and [q2o2answer]?,No,,Yvonne Treis & Deginet Wotango Doyiso,DEM,5,Binary-YesNo,Yes,No,NA,NA,NA,NA,NA,NA,Treis1Doyiso2,Kambaata,Kambaata,ktb,kamb1316,Wolaytta,Wolaytta,wal,wola1242,Kambaata - Wolaytta,ktb-wal,kamb1316–wola1242,Greater Abyssinia,"FDG, OR"
1.0.0,set03,set04,P2,DEM0a,,3. How long have [q2o1answer] and [q2o2answer] people practised exchange for? ,NA,NA,Yvonne Treis & Deginet Wotango Doyiso,DEM,5,Comment,NA,NA,NA,NA,NA,NA,NA,NA,Treis1Doyiso2,Kambaata,Kambaata,ktb,kamb1316,Wolaytta,Wolaytta,wal,wola1242,Kambaata - Wolaytta,ktb-wal,kamb1316–wola1242,Greater Abyssinia,"FDG, OR"
1.0.0,set03,set04,P2N,DEM0aN,,"Coarse time range, numerical",NA,NA,Yvonne Treis & Deginet Wotango Doyiso,DEM,5,Value,NA,NA,NA,NA,NA,NA,NA,NA,Treis1Doyiso2,Kambaata,Kambaata,ktb,kamb1316,Wolaytta,Wolaytta,wal,wola1242,Kambaata - Wolaytta,ktb-wal,kamb1316–wola1242,Greater Abyssinia,"FDG, OR"
1.0.0,set03,set04,P3,DEM0b,,4. What is the time frame when the largest number of people had the most opportunities for interaction in exchange?,NA,NA,Yvonne Treis & Deginet Wotango Doyiso,DEM,5,Comment,NA,NA,NA,NA,NA,NA,NA,NA,Treis1Doyiso2,Kambaata,Kambaata,ktb,kamb1316,Wolaytta,Wolaytta,wal,wola1242,Kambaata - Wolaytta,ktb-wal,kamb1316–wola1242,Greater Abyssinia,"FDG, OR"
1.0.0,set03,set04,P3,DEM0bN,,"Coarse time range, numerical",NA,NA,Yvonne Treis & Deginet Wotango Doyiso,DEM,5,Value,NA,NA,NA,NA,NA,NA,NA,NA,Treis1Doyiso2,Kambaata,Kambaata,ktb,kamb1316,Wolaytta,Wolaytta,wal,wola1242,Kambaata - Wolaytta,ktb-wal,kamb1316–wola1242,Greater Abyssinia,"FDG, OR"
1.0.0,set03,set04,P4,DEM01,,"5. What other languages, if any, are spoken in this domain?",NA,NA,Yvonne Treis & Deginet Wotango Doyiso,DEM,5,Comment,NA,NA,NA,NA,NA,NA,NA,NA,Treis1Doyiso2,Kambaata,Kambaata,ktb,kamb1316,Wolaytta,Wolaytta,wal,wola1242,Kambaata - Wolaytta,ktb-wal,kamb1316–wola1242,Greater Abyssinia,"FDG, OR"
1.0.0,set03,set04,D1,DEM02,DEM02-1,6. Characteristic of the domain of Exchange. Is Exchange between [q2o1answer] and [q2o2answer] the individual’s initiative?,NA,NA,Yvonne Treis & Deginet Wotango Doyiso,DEM,5,Binary-YesNo,Yes,No,NA,NA,NA,NA,NA,NA,Treis1Doyiso2,Kambaata,Kambaata,ktb,kamb1316,Wolaytta,Wolaytta,wal,wola1242,Kambaata - Wolaytta,ktb-wal,kamb1316–wola1242,Greater Abyssinia,"FDG, OR"
1.0.0,set03,set04,D1,DEM02,DEM02-2,6. Characteristic of the domain of Exchange. Is Exchange between [q2o1answer] and [q2o2answer] an institutionalised procedure?,NA,NA,Yvonne Treis & Deginet Wotango Doyiso,DEM,5,Binary-YesNo,Yes,No,NA,NA,NA,NA,NA,NA,Treis1Doyiso2,Kambaata,Kambaata,ktb,kamb1316,Wolaytta,Wolaytta,wal,wola1242,Kambaata - Wolaytta,ktb-wal,kamb1316–wola1242,Greater Abyssinia,"FDG, OR"
1.0.0,set03,set04,D1,DEM02,DEM02-3,6. Characteristic of the domain of Exchange. Is Exchange between [q2o1answer] and [q2o2answer] part of a ceremonial event to which both communities participate?,NA,NA,Yvonne Treis & Deginet Wotango Doyiso,DEM,5,Binary-YesNo,Yes,No,NA,NA,NA,NA,NA,NA,Treis1Doyiso2,Kambaata,Kambaata,ktb,kamb1316,Wolaytta,Wolaytta,wal,wola1242,Kambaata - Wolaytta,ktb-wal,kamb1316–wola1242,Greater Abyssinia,"FDG, OR"
1.0.0,set03,set04,D6,DEM04,,7. Where does exchange between [q2o1answer] and [q2o2answer] people typically take place?,NA,NA,Yvonne Treis & Deginet Wotango Doyiso,DEM,5,Types,At places which belong to the [q2o1answer],At places which belong to the [q2o2answer],At places which belong to some other group,This is highly contextual,NA,NA,NA,NA,Treis1Doyiso2,Kambaata,Kambaata,ktb,kamb1316,Wolaytta,Wolaytta,wal,wola1242,Kambaata - Wolaytta,ktb-wal,kamb1316–wola1242,Greater Abyssinia,"FDG, OR"
