Version,Set,Old_Set_ID,CID,QID,Sub-ID,Wording,Response,Comment,Respondent,Dom,DomOrder,DataType,Answer1,Answer2,Answer3,Answer4,Answer5,Answer6,Answer7,Answer8,Surname,[q2o1answer],FLang,F_ISO,F_Glottocode,[q2o2answer],NLang,N_ISO,N_Glottocode,ContactPair,ContactPair_ISO,ContactPair_Glottocode,AArea,Reviewer
1.0.0,set03,set04,O3,DFK32,,"34. Typically, how fluently does a [q2o1answer] person speak the [q2o2answer] language when speaking to their [q2o2answer] in-laws?",NA,NA,Yvonne Treis & Deginet Wotango Doyiso,DFK,5,Scalar,Very fluently,Fluently,Somewhat fluently,A little fluently,Not fluently at all,NA,NA,NA,Treis1Doyiso2,Kambaata,Kambaata,ktb,kamb1316,Wolaytta,Wolaytta,wal,wola1242,Kambaata - Wolaytta,ktb-wal,kamb1316–wola1242,Greater Abyssinia,"FDG, OR"
1.0.0,set03,set04,I1,DFK28,,"35. Your child has married a [q2o2answer] person. What language does your child’s spouse typically speak to you, a [q2o1answer] person?",Some other language,,Yvonne Treis & Deginet Wotango Doyiso,DFK,5,Types,The [q2o1answer] language,The [q2o2answer] language,Some other language,This is highly contextual,NA,NA,NA,NA,Treis1Doyiso2,Kambaata,Kambaata,ktb,kamb1316,Wolaytta,Wolaytta,wal,wola1242,Kambaata - Wolaytta,ktb-wal,kamb1316–wola1242,Greater Abyssinia,"FDG, OR"
1.0.0,set03,set04,I2,DFK29,,"36. Typically, how well does a [q2o1answer] person understand the [q2o2answer] in-law’s language?",NA,NA,Yvonne Treis & Deginet Wotango Doyiso,DFK,5,Scalar,Very well,Well,Somewhat,Poorly,Very poorly,NA,NA,NA,Treis1Doyiso2,Kambaata,Kambaata,ktb,kamb1316,Wolaytta,Wolaytta,wal,wola1242,Kambaata - Wolaytta,ktb-wal,kamb1316–wola1242,Greater Abyssinia,"FDG, OR"
1.0.0,set03,set04,I1,DFK34,,37. You have married a [q2o2answer] person. What language do you typically speak to your [q2o2answer] in-laws (your spouse’s parents and siblings)?,This is highly contextual,"It depends on where I have settled after marriage (in Wolaytta or not). If in Wolaytta, then there is a chance that I speak Wolaytta to them.",Yvonne Treis & Deginet Wotango Doyiso,DFK,5,Types,The [q2o1answer] language,The [q2o2answer] language,Some other language,This is highly contextual,NA,NA,NA,NA,Treis1Doyiso2,Kambaata,Kambaata,ktb,kamb1316,Wolaytta,Wolaytta,wal,wola1242,Kambaata - Wolaytta,ktb-wal,kamb1316–wola1242,Greater Abyssinia,"FDG, OR"
1.0.0,set03,set04,I2,DFKXX,,"37b. Typically, how well does a [q2o1answer] person understand the [q2o2answer] in-law’s language?",Poorly,,Yvonne Treis & Deginet Wotango Doyiso,DFK,5,Scalar,Very well,Well,Somewhat,Poorly,Very poorly,NA,NA,NA,Treis1Doyiso2,Kambaata,Kambaata,ktb,kamb1316,Wolaytta,Wolaytta,wal,wola1242,Kambaata - Wolaytta,ktb-wal,kamb1316–wola1242,Greater Abyssinia,"FDG, OR"
1.0.0,set03,set04,E1,DFK96,,38. Who do [q2o1answer] people typically form families with besides [q2o2answer] people?,Other [q2o1answer] people,NA,Yvonne Treis & Deginet Wotango Doyiso,DFK,5,Types,Other [q2o1answer] people,People from other groups,NA,NA,NA,NA,NA,NA,Treis1Doyiso2,Kambaata,Kambaata,ktb,kamb1316,Wolaytta,Wolaytta,wal,wola1242,Kambaata - Wolaytta,ktb-wal,kamb1316–wola1242,Greater Abyssinia,"FDG, OR"
1.0.0,set03,set04,E4,DFK97,,"39. What type of data informed your answers to the questions in the domain of family and kin, overall?",Impressions from my own fieldwork with the exact or related community Other,NA,Yvonne Treis & Deginet Wotango Doyiso,DFK,5,TypesMultiple,Impressions from my own fieldwork with the exact or related community,Reports from language consultants,Published or ongoing research project of my own on topics covered in this questionnaire,Published material by linguists,Published materials by other researchers in other fields,Other,NA,NA,Treis1Doyiso2,Kambaata,Kambaata,ktb,kamb1316,Wolaytta,Wolaytta,wal,wola1242,Kambaata - Wolaytta,ktb-wal,kamb1316–wola1242,Greater Abyssinia,"FDG, OR"
1.0.0,set03,set04,E5,DFK98,,40. How certain are you in your responses for the domain of family and kin?,Somewhat certain,NA,Yvonne Treis & Deginet Wotango Doyiso,DFK,5,Scalar,Very certain,Certain,Somewhat certain,Uncertain,Very uncertain,NA,NA,NA,Treis1Doyiso2,Kambaata,Kambaata,ktb,kamb1316,Wolaytta,Wolaytta,wal,wola1242,Kambaata - Wolaytta,ktb-wal,kamb1316–wola1242,Greater Abyssinia,"FDG, OR"
1.0.0,set03,set04,E6,DFK99,,41. List any comments or notes that you feel are relevant to this section of the questionnaire.,,NA,Yvonne Treis & Deginet Wotango Doyiso,DFK,5,Comment,NA,NA,NA,NA,NA,NA,NA,NA,Treis1Doyiso2,Kambaata,Kambaata,ktb,kamb1316,Wolaytta,Wolaytta,wal,wola1242,Kambaata - Wolaytta,ktb-wal,kamb1316–wola1242,Greater Abyssinia,"FDG, OR"
1.0.0,set03,set04,P1,DLB00,,1. Has work ever been a relevant domain of contact between [q2o1answer] and [q2o2answer]?,Yes,"Wolaytta women are employed for domestic work  in private households of townspeople and for work in hotels in Kambaata, Wolaytta men work at construction sites (buildings, roads) in Kambaata and they produce bamboo products (fences, floorings, walls etc.) in Kambaata.",Yvonne Treis & Deginet Wotango Doyiso,DLB,2,Binary-YesNo,Yes,No,NA,NA,NA,NA,NA,NA,Treis1Doyiso2,Kambaata,Kambaata,ktb,kamb1316,Wolaytta,Wolaytta,wal,wola1242,Kambaata - Wolaytta,ktb-wal,kamb1316–wola1242,Greater Abyssinia,"FDG, OR"
1.0.0,set03,set04,P2,DLB0a,,2. How long have [q2o1answer] people and [q2o2answer] people worked together for?,The current work-related contact probably started after the mid-nineties.,"The towns started to develop in Kambaata in the mid-nineties, first hotels were built, the economy diversified and this enabled the employment of labourers.",Yvonne Treis & Deginet Wotango Doyiso,DLB,2,Comment,NA,NA,NA,NA,NA,NA,NA,NA,Treis1Doyiso2,Kambaata,Kambaata,ktb,kamb1316,Wolaytta,Wolaytta,wal,wola1242,Kambaata - Wolaytta,ktb-wal,kamb1316–wola1242,Greater Abyssinia,"FDG, OR"
1.0.0,set03,set04,P2N,DLB0aN,,"Coarse time range, numerical",1995-2020,NA,Yvonne Treis & Deginet Wotango Doyiso,DLB,2,Value,NA,NA,NA,NA,NA,NA,NA,NA,Treis1Doyiso2,Kambaata,Kambaata,ktb,kamb1316,Wolaytta,Wolaytta,wal,wola1242,Kambaata - Wolaytta,ktb-wal,kamb1316–wola1242,Greater Abyssinia,"FDG, OR"
1.0.0,set03,set04,P3,DLB0b,,3. What is the time frame when the largest number of people had the most opportunities for interaction in the labour domain?,Steadily increasing since the mid-nineties. ,The demand of domestic and construction worker is steadily is steadily increasing. Since the population is growing there is also a growing supply of labourers.,Yvonne Treis & Deginet Wotango Doyiso,DLB,2,Comment,NA,NA,NA,NA,NA,NA,NA,NA,Treis1Doyiso2,Kambaata,Kambaata,ktb,kamb1316,Wolaytta,Wolaytta,wal,wola1242,Kambaata - Wolaytta,ktb-wal,kamb1316–wola1242,Greater Abyssinia,"FDG, OR"
1.0.0,set03,set04,P3N,DLB0bN,,"Coarse time range, numerical",1995-2020,NA,Yvonne Treis & Deginet Wotango Doyiso,DLB,2,Value,NA,NA,NA,NA,NA,NA,NA,NA,Treis1Doyiso2,Kambaata,Kambaata,ktb,kamb1316,Wolaytta,Wolaytta,wal,wola1242,Kambaata - Wolaytta,ktb-wal,kamb1316–wola1242,Greater Abyssinia,"FDG, OR"
1.0.0,set03,set04,P4,DLB01,,"4. What other languages, if any, are spoken in the labour domain?",Amharic,We believe that we only find people speaking both Kambaata and Wolaytta at the linguistic boundary. So communication between Kambaata and Wolaytta labourers is virtually always in Amharic.,Yvonne Treis & Deginet Wotango Doyiso,DLB,2,Comment,NA,NA,NA,NA,NA,NA,NA,NA,Treis1Doyiso2,Kambaata,Kambaata,ktb,kamb1316,Wolaytta,Wolaytta,wal,wola1242,Kambaata - Wolaytta,ktb-wal,kamb1316–wola1242,Greater Abyssinia,"FDG, OR"
1.0.0,set03,set04,D1,DLB02,,5. How commonly are [q2o1answer] people and [q2o2answer] people involved in public modes of production?,Uncommonly,,Yvonne Treis & Deginet Wotango Doyiso,DLB,2,Scalar,Very commonly,Commonly,Somewhat commonly,Uncommonly,Very uncommonly,NA,NA,NA,Treis1Doyiso2,Kambaata,Kambaata,ktb,kamb1316,Wolaytta,Wolaytta,wal,wola1242,Kambaata - Wolaytta,ktb-wal,kamb1316–wola1242,Greater Abyssinia,"FDG, OR"
1.0.0,set03,set04,D4,DLB04,,6. Is there hierarchy involved in work?,Yes,,Yvonne Treis & Deginet Wotango Doyiso,DLB,2,Binary-YesNo,Yes,No,NA,NA,NA,NA,NA,NA,Treis1Doyiso2,Kambaata,Kambaata,ktb,kamb1316,Wolaytta,Wolaytta,wal,wola1242,Kambaata - Wolaytta,ktb-wal,kamb1316–wola1242,Greater Abyssinia,"FDG, OR"
1.0.0,set03,set04,D6,DLB05,,7. Where do [q2o1answer] people and [q2o2answer] people typically work together?,At places which belong to the [q2o1answer],"Hotels and cafés in Kambaata, building sites in Kambaata, households in Kambaata; but also productions sites outside of Kambaata and Wolaytta (e.g. flower factories in Zway). We have difficulties in deciding between ""At places which belong to the Kambaata"" and ""At places which belong to some other group"". However, we can fairly safely say that less Kambaata do labour jobs in Wolaytta than Wolaytta doing these jobs in Kambaata.",Yvonne Treis & Deginet Wotango Doyiso,DLB,2,Types,At places which belong to the [q2o1answer],At places which belong to the [q2o2answer],At places which belong to some other group,This is highly contextual,NA,NA,NA,NA,Treis1Doyiso2,Kambaata,Kambaata,ktb,kamb1316,Wolaytta,Wolaytta,wal,wola1242,Kambaata - Wolaytta,ktb-wal,kamb1316–wola1242,Greater Abyssinia,"FDG, OR"
1.0.0,set03,set04,D11,DLB29,,8. How much influence can the [q2o1answer] exert over the terms of work?,Influence is very much exerted,,Yvonne Treis & Deginet Wotango Doyiso,DLB,2,Scalar,Influence is practically always exerted,Influence is very much exerted,Influence is somewhat exerted,Influence is exerted very little,Influence is practically never exerted,NA,NA,NA,Treis1Doyiso2,Kambaata,Kambaata,ktb,kamb1316,Wolaytta,Wolaytta,wal,wola1242,Kambaata - Wolaytta,ktb-wal,kamb1316–wola1242,Greater Abyssinia,"FDG, OR"
1.0.0,set03,set04,D9,DLB06,,9. Are there any speech styles used during work?,No,"K. and W. communicate through a third language, Amharic. We have decided to tick ""no"" because we think Amharic cannot be called a ""high variety"" of K. or W. In addition, the Amharic that both use can probably called a low variety, namely a regionally tainted southwestern variety of Amharic.",Yvonne Treis & Deginet Wotango Doyiso,DLB,2,Binary-YesNo,Yes,No,NA,NA,NA,NA,NA,NA,Treis1Doyiso2,Kambaata,Kambaata,ktb,kamb1316,Wolaytta,Wolaytta,wal,wola1242,Kambaata - Wolaytta,ktb-wal,kamb1316–wola1242,Greater Abyssinia,"FDG, OR"
1.0.0,set03,set04,D12,DLB31,,"10. How often are these speech styles typically used during work, in comparison with unmonitored speech?",NA,NA,Yvonne Treis & Deginet Wotango Doyiso,DLB,2,Scalar,Always,Sometimes,As much as unmonitored speech,Rarely,Never,NA,NA,NA,Treis1Doyiso2,Kambaata,Kambaata,ktb,kamb1316,Wolaytta,Wolaytta,wal,wola1242,Kambaata - Wolaytta,ktb-wal,kamb1316–wola1242,Greater Abyssinia,"FDG, OR"
1.0.0,set03,set04,D3,DLB03,DLB03-1,"11. Involvement in work. Does involvement in work differ based on hierarchies associated to profession or wealth, such as a person's class and caste?",Yes,,Yvonne Treis & Deginet Wotango Doyiso,DLB,2,Binary-YesNo,Yes,No,NA,NA,NA,NA,NA,NA,Treis1Doyiso2,Kambaata,Kambaata,ktb,kamb1316,Wolaytta,Wolaytta,wal,wola1242,Kambaata - Wolaytta,ktb-wal,kamb1316–wola1242,Greater Abyssinia,"FDG, OR"
1.0.0,set03,set04,D3,DLB03,DLB03-2,"11. Involvement in work. Does involvement in work differ based on whether a person belongs to some magico-religiously sanctioned group, such as religious denomination?",No,,Yvonne Treis & Deginet Wotango Doyiso,DLB,2,Binary-YesNo,Yes,No,NA,NA,NA,NA,NA,NA,Treis1Doyiso2,Kambaata,Kambaata,ktb,kamb1316,Wolaytta,Wolaytta,wal,wola1242,Kambaata - Wolaytta,ktb-wal,kamb1316–wola1242,Greater Abyssinia,"FDG, OR"
1.0.0,set03,set04,D3,DLB03,DLB03-3,"11. Involvement in work. Does involvement in work domain differ based on a person's descent group, such as clan, house, lineage group, kinship group?",Yes,,Yvonne Treis & Deginet Wotango Doyiso,DLB,2,Binary-YesNo,Yes,No,NA,NA,NA,NA,NA,NA,Treis1Doyiso2,Kambaata,Kambaata,ktb,kamb1316,Wolaytta,Wolaytta,wal,wola1242,Kambaata - Wolaytta,ktb-wal,kamb1316–wola1242,Greater Abyssinia,"FDG, OR"
1.0.0,set03,set04,D3,DLB03,DLB03-4,"11. Involvement in work. Does involvement in work domain differ based on a person’s group of land ownership, such as tribe, clan, territorial group?",No,,Yvonne Treis & Deginet Wotango Doyiso,DLB,2,Binary-YesNo,Yes,No,NA,NA,NA,NA,NA,NA,Treis1Doyiso2,Kambaata,Kambaata,ktb,kamb1316,Wolaytta,Wolaytta,wal,wola1242,Kambaata - Wolaytta,ktb-wal,kamb1316–wola1242,Greater Abyssinia,"FDG, OR"
1.0.0,set03,set04,D3,DLB03,DLB03-5,"11. Involvement in work. Does involvement in work differ based on a person’s race, ethnicity, or some other similar grouping?",No,,Yvonne Treis & Deginet Wotango Doyiso,DLB,2,Binary-YesNo,Yes,No,NA,NA,NA,NA,NA,NA,Treis1Doyiso2,Kambaata,Kambaata,ktb,kamb1316,Wolaytta,Wolaytta,wal,wola1242,Kambaata - Wolaytta,ktb-wal,kamb1316–wola1242,Greater Abyssinia,"FDG, OR"
1.0.0,set03,set04,D3,DLB03,DLB03-6,11. Involvement in work. Does involvement in work differ based on a person’s age or life stage?,No,,Yvonne Treis & Deginet Wotango Doyiso,DLB,2,Binary-YesNo,Yes,No,NA,NA,NA,NA,NA,NA,Treis1Doyiso2,Kambaata,Kambaata,ktb,kamb1316,Wolaytta,Wolaytta,wal,wola1242,Kambaata - Wolaytta,ktb-wal,kamb1316–wola1242,Greater Abyssinia,"FDG, OR"
1.0.0,set03,set04,D3,DLB03,DLB03-7,11. Involvement in work. Does involvement in work differ based on a person’s place identity and affiliation?,No,,Yvonne Treis & Deginet Wotango Doyiso,DLB,2,Binary-YesNo,Yes,No,NA,NA,NA,NA,NA,NA,Treis1Doyiso2,Kambaata,Kambaata,ktb,kamb1316,Wolaytta,Wolaytta,wal,wola1242,Kambaata - Wolaytta,ktb-wal,kamb1316–wola1242,Greater Abyssinia,"FDG, OR"
1.0.0,set03,set04,D3,DLB03,DLB03-8,11. Involvement in work. Does involvement in work differ based on a person’s sex or gender?,Yes,,Yvonne Treis & Deginet Wotango Doyiso,DLB,2,Binary-YesNo,Yes,No,NA,NA,NA,NA,NA,NA,Treis1Doyiso2,Kambaata,Kambaata,ktb,kamb1316,Wolaytta,Wolaytta,wal,wola1242,Kambaata - Wolaytta,ktb-wal,kamb1316–wola1242,Greater Abyssinia,"FDG, OR"
1.0.0,set03,set04,D3,DLB03,DLB03-9,11. Involvement in work. Does involvement in work differ based on any other communities of practice?,No,,Yvonne Treis & Deginet Wotango Doyiso,DLB,2,Binary-YesNo,Yes,No,NA,NA,NA,NA,NA,NA,Treis1Doyiso2,Kambaata,Kambaata,ktb,kamb1316,Wolaytta,Wolaytta,wal,wola1242,Kambaata - Wolaytta,ktb-wal,kamb1316–wola1242,Greater Abyssinia,"FDG, OR"
1.0.0,set03,set04,D10,DLB30,,12. Do [q2o1answer] people experience work differently depending on social group?,No,"The question is difficult to answer. The contact between K. and W. does not seem to be much influenced by social group (e.g. gender, caste) in our view. It is rather the type of work you do that determines whether you come into contact with W. or not (e.g. at constructions sites, in hotels). Probably also members of all K. clans/castes could employ W. domestic workers.",Yvonne Treis & Deginet Wotango Doyiso,DLB,2,Binary-YesNo,Yes,No,NA,NA,NA,NA,NA,NA,Treis1Doyiso2,Kambaata,Kambaata,ktb,kamb1316,Wolaytta,Wolaytta,wal,wola1242,Kambaata - Wolaytta,ktb-wal,kamb1316–wola1242,Greater Abyssinia,"FDG, OR"
1.0.0,set03,set04,S1,DLB07,,13. How often do [q2o1answer] people work with [q2o2answer] people?,Rarely,,Yvonne Treis & Deginet Wotango Doyiso,DLB,2,Scalar,Very often,Often,Sometimes,Rarely,Very rarely,NA,NA,NA,Treis1Doyiso2,Kambaata,Kambaata,ktb,kamb1316,Wolaytta,Wolaytta,wal,wola1242,Kambaata - Wolaytta,ktb-wal,kamb1316–wola1242,Greater Abyssinia,"FDG, OR"
1.0.0,set03,set04,S3,DLB09,,14. How many people are typically involved in interactions between [q2o1answer] people and [q2o2answer] people when working?,Interactions are sometimes under 5 people,,Yvonne Treis & Deginet Wotango Doyiso,DLB,2,Scalar,Interactions are practically always under 5 people,Interactions are often under 5 people,Interactions are sometimes under 5 people,Interactions are rarely under 5 people,Interactions are practically never under 5 people,NA,NA,NA,Treis1Doyiso2,Kambaata,Kambaata,ktb,kamb1316,Wolaytta,Wolaytta,wal,wola1242,Kambaata - Wolaytta,ktb-wal,kamb1316–wola1242,Greater Abyssinia,"FDG, OR"
1.0.0,set03,set04,S4,DLB10,,15. How physically proximate to each other are people when working?,Very proximate to each other,,Yvonne Treis & Deginet Wotango Doyiso,DLB,2,Scalar,Very proximate to each other,Proximate to each other,Somewhat proximate to each other,Far from each other,Very far from each other,NA,NA,NA,Treis1Doyiso2,Kambaata,Kambaata,ktb,kamb1316,Wolaytta,Wolaytta,wal,wola1242,Kambaata - Wolaytta,ktb-wal,kamb1316–wola1242,Greater Abyssinia,"FDG, OR"
1.0.0,set03,set04,S5,DLB11,,16. How would you rate the overall relationship between [q2o1answer] and [q2o2answer] people involved in work?,Neutral,,Yvonne Treis & Deginet Wotango Doyiso,DLB,2,Scalar,Friendly,Somewhat friendly,Neutral,Somewhat hostile,Hostile,NA,NA,NA,Treis1Doyiso2,Kambaata,Kambaata,ktb,kamb1316,Wolaytta,Wolaytta,wal,wola1242,Kambaata - Wolaytta,ktb-wal,kamb1316–wola1242,Greater Abyssinia,"FDG, OR"
1.0.0,set03,set04,S6,DLB27,,"17. What is the proportion of total [q2o1answer] people who have opportunities for contact with [q2o2answer] people, in work?",Few people,,Yvonne Treis & Deginet Wotango Doyiso,DLB,2,Scalar,Almost everyone,Many people,Some people,Few people,Practically no one,NA,NA,NA,Treis1Doyiso2,Kambaata,Kambaata,ktb,kamb1316,Wolaytta,Wolaytta,wal,wola1242,Kambaata - Wolaytta,ktb-wal,kamb1316–wola1242,Greater Abyssinia,"FDG, OR"
1.0.0,set03,set04,S7,DLB28,,"18. What is the proportion of total [q2o2answer] people who have opportunities for contact with [q2o1answer] people, in work?",Few people,,Yvonne Treis & Deginet Wotango Doyiso,DLB,2,Scalar,Almost everyone,Many people,Some people,Few people,Practically no one,NA,NA,NA,Treis1Doyiso2,Kambaata,Kambaata,ktb,kamb1316,Wolaytta,Wolaytta,wal,wola1242,Kambaata - Wolaytta,ktb-wal,kamb1316–wola1242,Greater Abyssinia,"FDG, OR"
1.0.0,set03,set04,BA,DLB22,,19. What is the overall attitude that [q2o1answer] people have towards [q2o2answer] people in work?,Neutral,"Mixed overall attitude: considered strong, people who can endure hard work; on the other hand considered little trustworthy",Yvonne Treis & Deginet Wotango Doyiso,DLB,2,Scalar,Very positive,Positive,Neutral,Negative,Very negative,NA,NA,NA,Treis1Doyiso2,Kambaata,Kambaata,ktb,kamb1316,Wolaytta,Wolaytta,wal,wola1242,Kambaata - Wolaytta,ktb-wal,kamb1316–wola1242,Greater Abyssinia,"FDG, OR"
1.0.0,set03,set04,BH,DLB23,,"20. How do [q2o1answer] people view themselves overall in relation to [q2o2answer] people, within the context of work?",[q2o1answer] see themselves as superior to [q2o2answer],,Yvonne Treis & Deginet Wotango Doyiso,DLB,2,Scalar,[q2o1answer] see themselves as very superior to [q2o2answer],[q2o1answer] see themselves as superior to [q2o2answer],[q2o1answer] see themselves as neither superior nor inferior to [q2o2answer],[q2o1answer] see themselves as inferior to [q2o2answer],[q2o1answer] see themselves as very inferior to [q2o2answer],NA,NA,NA,Treis1Doyiso2,Kambaata,Kambaata,ktb,kamb1316,Wolaytta,Wolaytta,wal,wola1242,Kambaata - Wolaytta,ktb-wal,kamb1316–wola1242,Greater Abyssinia,"FDG, OR"
1.0.0,set03,set04,BI,DLB25,,21. What language do [q2o1answer] people expect to be used when working with [q2o2answer] people?,Some other language,Amharic,Yvonne Treis & Deginet Wotango Doyiso,DLB,2,Types,The [q2o1answer] language,The [q2o2answer] language,Some other language,This is highly contextual,NA,NA,NA,NA,Treis1Doyiso2,Kambaata,Kambaata,ktb,kamb1316,Wolaytta,Wolaytta,wal,wola1242,Kambaata - Wolaytta,ktb-wal,kamb1316–wola1242,Greater Abyssinia,"FDG, OR"
1.0.0,set03,set04,O1,DLB32,,22. What language do [q2o1answer] people typically speak when working with [q2o2answer] people?,Some other language,Amharic,Yvonne Treis & Deginet Wotango Doyiso,DLB,2,Types,The [q2o1answer] language,The [q2o2answer] language,Some other language,This is highly contextual,NA,NA,NA,NA,Treis1Doyiso2,Kambaata,Kambaata,ktb,kamb1316,Wolaytta,Wolaytta,wal,wola1242,Kambaata - Wolaytta,ktb-wal,kamb1316–wola1242,Greater Abyssinia,"FDG, OR"
1.0.0,set03,set04,O2,DLB13,,23. Do [q2o1answer] people typically simplify their language when working with [q2o2answer] people?,NA,NA,Yvonne Treis & Deginet Wotango Doyiso,DLB,2,Types,Yes,No,This is highly contextual,NA,NA,NA,NA,NA,Treis1Doyiso2,Kambaata,Kambaata,ktb,kamb1316,Wolaytta,Wolaytta,wal,wola1242,Kambaata - Wolaytta,ktb-wal,kamb1316–wola1242,Greater Abyssinia,"FDG, OR"
1.0.0,set03,set04,O3,DLB14,,"24. Typically in work, how fluently do [q2o1answer] people speak the [q2o2answer] language?",NA,NA,Yvonne Treis & Deginet Wotango Doyiso,DLB,2,Scalar,Very fluently,Fluently,Somewhat fluently,A little fluently,Not fluently at all,NA,NA,NA,Treis1Doyiso2,Kambaata,Kambaata,ktb,kamb1316,Wolaytta,Wolaytta,wal,wola1242,Kambaata - Wolaytta,ktb-wal,kamb1316–wola1242,Greater Abyssinia,"FDG, OR"
1.0.0,set03,set04,I1,DLB15,,25. What language do [q2o2answer] people typically speak when working with [q2o1answer] people?,Some other language,Amharic,Yvonne Treis & Deginet Wotango Doyiso,DLB,2,Types,The [q2o1answer] language,The [q2o2answer] language,Some other language,This is highly contextual,NA,NA,NA,NA,Treis1Doyiso2,Kambaata,Kambaata,ktb,kamb1316,Wolaytta,Wolaytta,wal,wola1242,Kambaata - Wolaytta,ktb-wal,kamb1316–wola1242,Greater Abyssinia,"FDG, OR"
1.0.0,set03,set04,I2,DLB16,,"26. Typically in work, how well do [q2o1answer] people understand the [q2o2answer] language?",NA,NA,Yvonne Treis & Deginet Wotango Doyiso,DLB,2,Scalar,Very well,Well,Somewhat,Poorly,Very poorly,NA,NA,NA,Treis1Doyiso2,Kambaata,Kambaata,ktb,kamb1316,Wolaytta,Wolaytta,wal,wola1242,Kambaata - Wolaytta,ktb-wal,kamb1316–wola1242,Greater Abyssinia,"FDG, OR"
1.0.0,set03,set04,T1,DLB17,,27. How much do [q2o1answer] children participate in work?,They participate somewhat,,Yvonne Treis & Deginet Wotango Doyiso,DLB,2,Scalar,They practically always participate,They participate a lot,They participate somewhat,They participate a little,They practically never participate,NA,NA,NA,Treis1Doyiso2,Kambaata,Kambaata,ktb,kamb1316,Wolaytta,Wolaytta,wal,wola1242,Kambaata - Wolaytta,ktb-wal,kamb1316–wola1242,Greater Abyssinia,"FDG, OR"
1.0.0,set03,set04,T6,DLB21,DLB21-1,"28. Looking after children during work. Typically, do adults other than the parents look after children up to five year of age during work?",Yes,,Yvonne Treis & Deginet Wotango Doyiso,DLB,2,Binary-YesNo,Yes,No,NA,NA,NA,NA,NA,NA,Treis1Doyiso2,Kambaata,Kambaata,ktb,kamb1316,Wolaytta,Wolaytta,wal,wola1242,Kambaata - Wolaytta,ktb-wal,kamb1316–wola1242,Greater Abyssinia,"FDG, OR"
1.0.0,set03,set04,T6,DLB21,DLB21-2,"28. Looking after children during work. Typically, do parents look after children up to five year of age during work?",Yes,,Yvonne Treis & Deginet Wotango Doyiso,DLB,2,Binary-YesNo,Yes,No,NA,NA,NA,NA,NA,NA,Treis1Doyiso2,Kambaata,Kambaata,ktb,kamb1316,Wolaytta,Wolaytta,wal,wola1242,Kambaata - Wolaytta,ktb-wal,kamb1316–wola1242,Greater Abyssinia,"FDG, OR"
1.0.0,set03,set04,T6,DLB21,DLB21-3,"28. Looking after children during work. Typically, do children from sibling-kin groups look after children up to five year of age during work?",Yes,,Yvonne Treis & Deginet Wotango Doyiso,DLB,2,Binary-YesNo,Yes,No,NA,NA,NA,NA,NA,NA,Treis1Doyiso2,Kambaata,Kambaata,ktb,kamb1316,Wolaytta,Wolaytta,wal,wola1242,Kambaata - Wolaytta,ktb-wal,kamb1316–wola1242,Greater Abyssinia,"FDG, OR"
1.0.0,set03,set04,T6,DLB21,DLB21-4,"28. Looking after children during work. Typically, do children up to five year of age look after each other as part of the same peer group during work?",Yes,,Yvonne Treis & Deginet Wotango Doyiso,DLB,2,Binary-YesNo,Yes,No,NA,NA,NA,NA,NA,NA,Treis1Doyiso2,Kambaata,Kambaata,ktb,kamb1316,Wolaytta,Wolaytta,wal,wola1242,Kambaata - Wolaytta,ktb-wal,kamb1316–wola1242,Greater Abyssinia,"FDG, OR"
1.0.0,set03,set04,T11,DLB26,,"29. Typically, how much supervision do adults provide to children in work?",A lot of supervision,,Yvonne Treis & Deginet Wotango Doyiso,DLB,2,Scalar,Constant supervision,A lot of supervision,Some supervision,Little supervision,No supervision at all,NA,NA,NA,Treis1Doyiso2,Kambaata,Kambaata,ktb,kamb1316,Wolaytta,Wolaytta,wal,wola1242,Kambaata - Wolaytta,ktb-wal,kamb1316–wola1242,Greater Abyssinia,"FDG, OR"
1.0.0,set03,set04,T2,DLB18,,30. What language do [q2o2answer] adults typically speak to a [q2o1answer] children in work?,Some other language,,Yvonne Treis & Deginet Wotango Doyiso,DLB,2,Types,The [q2o1answer] language,The [q2o2answer] language,Some other language,This is highly contextual,NA,NA,NA,NA,Treis1Doyiso2,Kambaata,Kambaata,ktb,kamb1316,Wolaytta,Wolaytta,wal,wola1242,Kambaata - Wolaytta,ktb-wal,kamb1316–wola1242,Greater Abyssinia,"FDG, OR"
1.0.0,set03,set04,T4,DLB19,,"31. Typically, what language do [q2o1answer] children from four/five year of age prefer to speak with [q2o2answer] adults in work?",Some other language,,Yvonne Treis & Deginet Wotango Doyiso,DLB,2,Types,The [q2o1answer] language,The [q2o2answer] language,Some other language,This is highly contextual,NA,NA,NA,NA,Treis1Doyiso2,Kambaata,Kambaata,ktb,kamb1316,Wolaytta,Wolaytta,wal,wola1242,Kambaata - Wolaytta,ktb-wal,kamb1316–wola1242,Greater Abyssinia,"FDG, OR"
1.0.0,set03,set04,T5,DLB20,,"32. Typically, what language would a [q2o1answer] child speak to [q2o2answer] children in work?",Some other language,,Yvonne Treis & Deginet Wotango Doyiso,DLB,2,Types,[q2o1answer] children do not interact with [q2o2answer] children,The [q2o1answer] language,The [q2o2answer] language,Some other language,This is highly contextual,NA,NA,NA,Treis1Doyiso2,Kambaata,Kambaata,ktb,kamb1316,Wolaytta,Wolaytta,wal,wola1242,Kambaata - Wolaytta,ktb-wal,kamb1316–wola1242,Greater Abyssinia,"FDG, OR"
