Version,Set,Old_Set_ID,CID,QID,Sub-ID,Wording,Response,Comment,Respondent,Dom,DomOrder,DataType,Answer1,Answer2,Answer3,Answer4,Answer5,Answer6,Answer7,Answer8,Surname,[q2o1answer],FLang,F_ISO,F_Glottocode,[q2o2answer],NLang,N_ISO,N_Glottocode,ContactPair,ContactPair_ISO,ContactPair_Glottocode,AArea,Reviewer
1.0.0,set03,set04,S6,DEM42,,40. What is the proportion of total [q2o1answer] people who have opportunities for contact with [q2o2answer] people in the context of marriage exchanges?,Practically no one,,Yvonne Treis & Deginet Wotango Doyiso,DEM,5,Scalar,Almost everyone,Many people,Some people,Few people,Practically no one,NA,NA,NA,Treis1Doyiso2,Kambaata,Kambaata,ktb,kamb1316,Wolaytta,Wolaytta,wal,wola1242,Kambaata - Wolaytta,ktb-wal,kamb1316–wola1242,Greater Abyssinia,"FDG, OR"
1.0.0,set03,set04,S7,DEM43,,41. What is the proportion of total [q2o2answer] people who have opportunities for contact with [q2o1answer] people in the context of marriage exchanges? ,Practically no one,,Yvonne Treis & Deginet Wotango Doyiso,DEM,5,Scalar,Almost everyone,Many people,Some people,Few people,Practically no one,NA,NA,NA,Treis1Doyiso2,Kambaata,Kambaata,ktb,kamb1316,Wolaytta,Wolaytta,wal,wola1242,Kambaata - Wolaytta,ktb-wal,kamb1316–wola1242,Greater Abyssinia,"FDG, OR"
1.0.0,set03,set04,BA,DEM35,,42. What is the overall attitude that [q2o1answer] people have towards [q2o2answer] people in practices of marriage exchanges?,Negative,,Yvonne Treis & Deginet Wotango Doyiso,DEM,5,Scalar,Very positive,Positive,Neutral,Negative,Very negative,NA,NA,NA,Treis1Doyiso2,Kambaata,Kambaata,ktb,kamb1316,Wolaytta,Wolaytta,wal,wola1242,Kambaata - Wolaytta,ktb-wal,kamb1316–wola1242,Greater Abyssinia,"FDG, OR"
1.0.0,set03,set04,BH,DEM36,,"43. How do [q2o1answer] people view themselves overall in relation to [q2o2answer] people, within the context of marriage?",[q2o1answer] see themselves as superior to [q2o2answer],,Yvonne Treis & Deginet Wotango Doyiso,DEM,5,Scalar,[q2o1answer] see themselves as very superior to [q2o2answer],[q2o1answer] see themselves as superior to [q2o2answer],[q2o1answer] see themselves as neither superior nor inferior to [q2o2answer],[q2o1answer] see themselves as inferior to [q2o2answer],[q2o1answer] see themselves as very inferior to [q2o2answer],NA,NA,NA,Treis1Doyiso2,Kambaata,Kambaata,ktb,kamb1316,Wolaytta,Wolaytta,wal,wola1242,Kambaata - Wolaytta,ktb-wal,kamb1316–wola1242,Greater Abyssinia,"FDG, OR"
1.0.0,set03,set04,BI,DEM33,,44. What language do [q2o1answer] people expect to be used in marriage ceremonies with [q2o2answer] people?,Some other language,,Yvonne Treis & Deginet Wotango Doyiso,DEM,5,Types,The [q2o1answer] language,The [q2o2answer] language,Some other language,This is highly contextual,NA,NA,NA,NA,Treis1Doyiso2,Kambaata,Kambaata,ktb,kamb1316,Wolaytta,Wolaytta,wal,wola1242,Kambaata - Wolaytta,ktb-wal,kamb1316–wola1242,Greater Abyssinia,"FDG, OR"
1.0.0,set03,set04,T6,DEM30,DEM30-1,45. Does marriage impose any child rearing obligations for both parents and grandparents on both sides?,No,"We cannot really speak of ""obligations"", it's rather socially expected",Yvonne Treis & Deginet Wotango Doyiso,DEM,5,Binary-YesNo,Yes,No,NA,NA,NA,NA,NA,NA,Treis1Doyiso2,Kambaata,Kambaata,ktb,kamb1316,Wolaytta,Wolaytta,wal,wola1242,Kambaata - Wolaytta,ktb-wal,kamb1316–wola1242,Greater Abyssinia,"FDG, OR"
1.0.0,set03,set04,T6,DEM30,DEM30-2,"45. Does marriage impose any child rearing obligations for one parent, and grandparents on both sides?",Yes,[See above],Yvonne Treis & Deginet Wotango Doyiso,DEM,5,Binary-YesNo,Yes,No,NA,NA,NA,NA,NA,NA,Treis1Doyiso2,Kambaata,Kambaata,ktb,kamb1316,Wolaytta,Wolaytta,wal,wola1242,Kambaata - Wolaytta,ktb-wal,kamb1316–wola1242,Greater Abyssinia,"FDG, OR"
1.0.0,set03,set04,T6,DEM30,DEM30-3,"45. Does marriage impose any child rearing obligations for one parent, and grandparents on that side?",No,[See above],Yvonne Treis & Deginet Wotango Doyiso,DEM,5,Binary-YesNo,Yes,No,NA,NA,NA,NA,NA,NA,Treis1Doyiso2,Kambaata,Kambaata,ktb,kamb1316,Wolaytta,Wolaytta,wal,wola1242,Kambaata - Wolaytta,ktb-wal,kamb1316–wola1242,Greater Abyssinia,"FDG, OR"
1.0.0,set03,set04,T6,DEM30,DEM30-4,"45. Does marriage impose any child rearing obligations for one parent, and grandparents from the other side?",No,[See above],Yvonne Treis & Deginet Wotango Doyiso,DEM,5,Binary-YesNo,Yes,No,NA,NA,NA,NA,NA,NA,Treis1Doyiso2,Kambaata,Kambaata,ktb,kamb1316,Wolaytta,Wolaytta,wal,wola1242,Kambaata - Wolaytta,ktb-wal,kamb1316–wola1242,Greater Abyssinia,"FDG, OR"
1.0.0,set03,set04,E1,DEM96,,"46. List any other groups that the [q2o1answer] practiced Social Exchange with in the past, in so far as you believe this had linguistic consequences for the [q2o1answer] language. Where possible, please also give an indication of when this contact through Social Exchange practices happened. ",NA,NA,Yvonne Treis & Deginet Wotango Doyiso,DEM,5,Comment,NA,NA,NA,NA,NA,NA,NA,NA,Treis1Doyiso2,Kambaata,Kambaata,ktb,kamb1316,Wolaytta,Wolaytta,wal,wola1242,Kambaata - Wolaytta,ktb-wal,kamb1316–wola1242,Greater Abyssinia,"FDG, OR"
1.0.0,set03,set04,E4,DEM97,,47. What type of data informed your answers to the questions in the domain of social exchange overall? ,NA,NA,Yvonne Treis & Deginet Wotango Doyiso,DEM,5,TypesMultiple,Impressions from my own fieldwork with the exact or related community,Reports from language consultants,Published or ongoing research project of my own on topics covered in this questionnaire,Published material by linguists,Published materials by other researchers in other fields,Other,NA,NA,Treis1Doyiso2,Kambaata,Kambaata,ktb,kamb1316,Wolaytta,Wolaytta,wal,wola1242,Kambaata - Wolaytta,ktb-wal,kamb1316–wola1242,Greater Abyssinia,"FDG, OR"
1.0.0,set03,set04,E5,DEM98,,48. How certain are you in your responses for the domain of social exchange?,NA,NA,Yvonne Treis & Deginet Wotango Doyiso,DEM,5,Scalar,Very certain,Certain,Somewhat certain,Uncertain,Very uncertain,NA,NA,NA,Treis1Doyiso2,Kambaata,Kambaata,ktb,kamb1316,Wolaytta,Wolaytta,wal,wola1242,Kambaata - Wolaytta,ktb-wal,kamb1316–wola1242,Greater Abyssinia,"FDG, OR"
1.0.0,set03,set04,E6,DEM99,,49. List any comments or notes that you feel are relevant to this section of the questionnaire.,NA,NA,Yvonne Treis & Deginet Wotango Doyiso,DEM,5,Comment,NA,NA,NA,NA,NA,NA,NA,NA,Treis1Doyiso2,Kambaata,Kambaata,ktb,kamb1316,Wolaytta,Wolaytta,wal,wola1242,Kambaata - Wolaytta,ktb-wal,kamb1316–wola1242,Greater Abyssinia,"FDG, OR"
1.0.0,set03,set04,P1,DFK00,,"2. Do [q2o1answer] people and [q2o2answer] people marry each other, or have they done so in the past?",Yes,,Yvonne Treis & Deginet Wotango Doyiso,DFK,5,Binary-YesNo,Yes,No,NA,NA,NA,NA,NA,NA,Treis1Doyiso2,Kambaata,Kambaata,ktb,kamb1316,Wolaytta,Wolaytta,wal,wola1242,Kambaata - Wolaytta,ktb-wal,kamb1316–wola1242,Greater Abyssinia,"FDG, OR"
1.0.0,set03,set04,P2,DFK0a,,2. How long have [q2o1answer] and [q2o2answer] peoples been forming families with each other for?,since they settle beside each other,,Yvonne Treis & Deginet Wotango Doyiso,DFK,5,Comment,NA,NA,NA,NA,NA,NA,NA,NA,Treis1Doyiso2,Kambaata,Kambaata,ktb,kamb1316,Wolaytta,Wolaytta,wal,wola1242,Kambaata - Wolaytta,ktb-wal,kamb1316–wola1242,Greater Abyssinia,"FDG, OR"
1.0.0,set03,set04,P2N,DFK0aN,,"Coarse time range, numerical",1850-2020,NA,Yvonne Treis & Deginet Wotango Doyiso,DFK,5,Value,NA,NA,NA,NA,NA,NA,NA,NA,Treis1Doyiso2,Kambaata,Kambaata,ktb,kamb1316,Wolaytta,Wolaytta,wal,wola1242,Kambaata - Wolaytta,ktb-wal,kamb1316–wola1242,Greater Abyssinia,"FDG, OR"
1.0.0,set03,set04,P3,DFK0b,,3. What’s the time frame of densest contact between [q2o1answer] and [q2o2answer] as far as family formation is concerned?,"It was probably more common in the past, nowadays people are more and more ethnically segregated.",,Yvonne Treis & Deginet Wotango Doyiso,DFK,5,Comment,NA,NA,NA,NA,NA,NA,NA,NA,Treis1Doyiso2,Kambaata,Kambaata,ktb,kamb1316,Wolaytta,Wolaytta,wal,wola1242,Kambaata - Wolaytta,ktb-wal,kamb1316–wola1242,Greater Abyssinia,"FDG, OR"
1.0.0,set03,set04,P3N,DFK0bN,,"Coarse time range, numerical",0000-0000,NA,Yvonne Treis & Deginet Wotango Doyiso,DFK,5,Value,NA,NA,NA,NA,NA,NA,NA,NA,Treis1Doyiso2,Kambaata,Kambaata,ktb,kamb1316,Wolaytta,Wolaytta,wal,wola1242,Kambaata - Wolaytta,ktb-wal,kamb1316–wola1242,Greater Abyssinia,"FDG, OR"
1.0.0,set03,set04,P4,DFK01,,"4. What other languages, if any, are spoken between family members?",Amharic,,Yvonne Treis & Deginet Wotango Doyiso,DFK,5,Comment,NA,NA,NA,NA,NA,NA,NA,NA,Treis1Doyiso2,Kambaata,Kambaata,ktb,kamb1316,Wolaytta,Wolaytta,wal,wola1242,Kambaata - Wolaytta,ktb-wal,kamb1316–wola1242,Greater Abyssinia,"FDG, OR"
1.0.0,set03,set04,D6,DFK35,,5. What is the typical pattern of relocation for [q2o1answer] women when starting a new family?,[q2o1answer] women often relocate to [q2o2answer] locations,The rule is that women relocate to their husband's family.,Yvonne Treis & Deginet Wotango Doyiso,DFK,5,Scalar,[q2o1answer] women practically always relocate to [q2o2answer] locations,[q2o1answer] women often relocate to [q2o2answer] locations,[q2o1answer] women sometimes relocate to [q2o2answer] locations,[q2o1answer] women rarely relocate to [q2o2answer] locations,[q2o1answer] women practically never relocate to [q2o2answer] locations,NA,NA,NA,Treis1Doyiso2,Kambaata,Kambaata,ktb,kamb1316,Wolaytta,Wolaytta,wal,wola1242,Kambaata - Wolaytta,ktb-wal,kamb1316–wola1242,Greater Abyssinia,"FDG, OR"
1.0.0,set03,set04,D6,DFK39,,6. What is the typical pattern of relocation for [q2o2answer] women when starting a new family? ,[q2o2answer] women often relocate to [q2o1answer] locations,,Yvonne Treis & Deginet Wotango Doyiso,DFK,5,Scalar,[q2o2answer] women practically always relocate to [q2o1answer] locations,[q2o2answer] women often relocate to [q2o1answer] locations,[q2o2answer] women sometimes relocate to [q2o1answer] locations,[q2o2answer] women rarely relocate to [q2o1answer] locations,[q2o2answer] women practically never relocate to [q2o1answer] locations,NA,NA,NA,Treis1Doyiso2,Kambaata,Kambaata,ktb,kamb1316,Wolaytta,Wolaytta,wal,wola1242,Kambaata - Wolaytta,ktb-wal,kamb1316–wola1242,Greater Abyssinia,"FDG, OR"
1.0.0,set03,set04,D1,DFK02,DFK02-1,7. Do mothers form a co-residential unit with their children and their husbands?,Yes,,Yvonne Treis & Deginet Wotango Doyiso,DFK,5,Binary-YesNo,Yes,No,NA,NA,NA,NA,NA,NA,Treis1Doyiso2,Kambaata,Kambaata,ktb,kamb1316,Wolaytta,Wolaytta,wal,wola1242,Kambaata - Wolaytta,ktb-wal,kamb1316–wola1242,Greater Abyssinia,"FDG, OR"
1.0.0,set03,set04,D1,DFK02,DFK02-2,7. Do mothers form a co-residential unit with their children and their mothers?,No,,Yvonne Treis & Deginet Wotango Doyiso,DFK,5,Binary-YesNo,Yes,No,NA,NA,NA,NA,NA,NA,Treis1Doyiso2,Kambaata,Kambaata,ktb,kamb1316,Wolaytta,Wolaytta,wal,wola1242,Kambaata - Wolaytta,ktb-wal,kamb1316–wola1242,Greater Abyssinia,"FDG, OR"
1.0.0,set03,set04,D1,DFK02,DFK02-3,7. Do mothers form a co-residential unit with their children and their mother in laws?,Yes,,Yvonne Treis & Deginet Wotango Doyiso,DFK,5,Binary-YesNo,Yes,No,NA,NA,NA,NA,NA,NA,Treis1Doyiso2,Kambaata,Kambaata,ktb,kamb1316,Wolaytta,Wolaytta,wal,wola1242,Kambaata - Wolaytta,ktb-wal,kamb1316–wola1242,Greater Abyssinia,"FDG, OR"
1.0.0,set03,set04,D10,DFK40,,8. Do [q2o1answer] people experience family life differently depending on social group?,No,,Yvonne Treis & Deginet Wotango Doyiso,DFK,5,Binary-YesNo,Yes,No,NA,NA,NA,NA,NA,NA,Treis1Doyiso2,Kambaata,Kambaata,ktb,kamb1316,Wolaytta,Wolaytta,wal,wola1242,Kambaata - Wolaytta,ktb-wal,kamb1316–wola1242,Greater Abyssinia,"FDG, OR"
1.0.0,set03,set04,S1,DFK03,,"9. Typically, how much of their lives do spouses spend with each other during the course of their lifetime?",Some of their lives,,Yvonne Treis & Deginet Wotango Doyiso,DFK,5,Scalar,Practically all their lives,Much of their lives,Some of their lives,A little of their lives,Practically none of their lives,NA,NA,NA,Treis1Doyiso2,Kambaata,Kambaata,ktb,kamb1316,Wolaytta,Wolaytta,wal,wola1242,Kambaata - Wolaytta,ktb-wal,kamb1316–wola1242,Greater Abyssinia,"FDG, OR"
1.0.0,set03,set04,S4,DFK37,,10. How physically proximate to each other are the households of the husband and wife?,Very proximate to each other,,Yvonne Treis & Deginet Wotango Doyiso,DFK,5,Scalar,Very proximate to each other,Proximate to each other,Somewhat proximate to each other,Far from each other,Very far from each other,NA,NA,NA,Treis1Doyiso2,Kambaata,Kambaata,ktb,kamb1316,Wolaytta,Wolaytta,wal,wola1242,Kambaata - Wolaytta,ktb-wal,kamb1316–wola1242,Greater Abyssinia,"FDG, OR"
1.0.0,set03,set04,BA,DFK16,,11. What is the overall level of affection that the [q2o1answer] person has towards their [q2o2answer] spouse?,Affectionate,,Yvonne Treis & Deginet Wotango Doyiso,DFK,5,Scalar,Very affectionate,Affectionate,Neutral,Unaffectionate,Very unaffectionate,NA,NA,NA,Treis1Doyiso2,Kambaata,Kambaata,ktb,kamb1316,Wolaytta,Wolaytta,wal,wola1242,Kambaata - Wolaytta,ktb-wal,kamb1316–wola1242,Greater Abyssinia,"FDG, OR"
1.0.0,set03,set04,O1,DFK06,,12. What language do [q2o1answer] people typically speak with their [q2o2answer] spouse?,This is highly contextual,,Yvonne Treis & Deginet Wotango Doyiso,DFK,5,Types,The [q2o1answer] language,The [q2o2answer] language,Some other language,This is highly contextual,NA,NA,NA,NA,Treis1Doyiso2,Kambaata,Kambaata,ktb,kamb1316,Wolaytta,Wolaytta,wal,wola1242,Kambaata - Wolaytta,ktb-wal,kamb1316–wola1242,Greater Abyssinia,"FDG, OR"
1.0.0,set03,set04,O2,DFK07,,13. Do [q2o1answer] people typically simplify their [q2o1answer] language when speaking with their [q2o2answer] spouse?,No,,Yvonne Treis & Deginet Wotango Doyiso,DFK,5,Types,Yes,No,This is highly contextual,NA,NA,NA,NA,NA,Treis1Doyiso2,Kambaata,Kambaata,ktb,kamb1316,Wolaytta,Wolaytta,wal,wola1242,Kambaata - Wolaytta,ktb-wal,kamb1316–wola1242,Greater Abyssinia,"FDG, OR"
1.0.0,set03,set04,O3,DFK08,,"14. Typically in the domain of family, how fluently to [q2o1answer] people speak the [q2o2answer] language?",Somewhat fluently,,Yvonne Treis & Deginet Wotango Doyiso,DFK,5,Scalar,Very fluently,Fluently,Somewhat fluently,A little fluently,Not fluently at all,NA,NA,NA,Treis1Doyiso2,Kambaata,Kambaata,ktb,kamb1316,Wolaytta,Wolaytta,wal,wola1242,Kambaata - Wolaytta,ktb-wal,kamb1316–wola1242,Greater Abyssinia,"FDG, OR"
1.0.0,set03,set04,I1,DFK09,,15. What language do [q2o2answer] people typically speak with their [q2o1answer] spouse?,This is highly contextual,,Yvonne Treis & Deginet Wotango Doyiso,DFK,5,Types,The [q2o1answer] language,The [q2o2answer] language,Some other language,This is highly contextual,NA,NA,NA,NA,Treis1Doyiso2,Kambaata,Kambaata,ktb,kamb1316,Wolaytta,Wolaytta,wal,wola1242,Kambaata - Wolaytta,ktb-wal,kamb1316–wola1242,Greater Abyssinia,"FDG, OR"
1.0.0,set03,set04,I2,DFK10,,"16. Typically in the domain of family, how well do [q2o1answer] people understand the [q2o2answer] language?",Somewhat,,Yvonne Treis & Deginet Wotango Doyiso,DFK,5,Scalar,Very well,Well,Somewhat,Poorly,Very poorly,NA,NA,NA,Treis1Doyiso2,Kambaata,Kambaata,ktb,kamb1316,Wolaytta,Wolaytta,wal,wola1242,Kambaata - Wolaytta,ktb-wal,kamb1316–wola1242,Greater Abyssinia,"FDG, OR"
1.0.0,set03,set04,T6,DFK04,DFK04-1,"17. Looking after children. Typically, do fathers look after children up to five year of age?",No,,Yvonne Treis & Deginet Wotango Doyiso,DFK,5,Binary-YesNo,Yes,No,NA,NA,NA,NA,NA,NA,Treis1Doyiso2,Kambaata,Kambaata,ktb,kamb1316,Wolaytta,Wolaytta,wal,wola1242,Kambaata - Wolaytta,ktb-wal,kamb1316–wola1242,Greater Abyssinia,"FDG, OR"
1.0.0,set03,set04,T6,DFK04,DFK04-2,"17. Looking after children. Typically, do mothers primarily look after children up to five year of age?",Yes,,Yvonne Treis & Deginet Wotango Doyiso,DFK,5,Binary-YesNo,Yes,No,NA,NA,NA,NA,NA,NA,Treis1Doyiso2,Kambaata,Kambaata,ktb,kamb1316,Wolaytta,Wolaytta,wal,wola1242,Kambaata - Wolaytta,ktb-wal,kamb1316–wola1242,Greater Abyssinia,"FDG, OR"
1.0.0,set03,set04,T6,DFK04,DFK04-3,17. Looking after children. Do adults other than the parents look after children up to five year of age?,Yes,,Yvonne Treis & Deginet Wotango Doyiso,DFK,5,Binary-YesNo,Yes,No,NA,NA,NA,NA,NA,NA,Treis1Doyiso2,Kambaata,Kambaata,ktb,kamb1316,Wolaytta,Wolaytta,wal,wola1242,Kambaata - Wolaytta,ktb-wal,kamb1316–wola1242,Greater Abyssinia,"FDG, OR"
1.0.0,set03,set04,T6,DFK04,DFK04-4,17. Looking after children. Do children from sibling-kin groups look after children up to five year of age?,Yes,,Yvonne Treis & Deginet Wotango Doyiso,DFK,5,Binary-YesNo,Yes,No,NA,NA,NA,NA,NA,NA,Treis1Doyiso2,Kambaata,Kambaata,ktb,kamb1316,Wolaytta,Wolaytta,wal,wola1242,Kambaata - Wolaytta,ktb-wal,kamb1316–wola1242,Greater Abyssinia,"FDG, OR"
1.0.0,set03,set04,T6,DFK04,DFK04-5,17. Looking after children. Do children up to five year of age look after each other as part of the same peer group?,Yes,,Yvonne Treis & Deginet Wotango Doyiso,DFK,5,Binary-YesNo,Yes,No,NA,NA,NA,NA,NA,NA,Treis1Doyiso2,Kambaata,Kambaata,ktb,kamb1316,Wolaytta,Wolaytta,wal,wola1242,Kambaata - Wolaytta,ktb-wal,kamb1316–wola1242,Greater Abyssinia,"FDG, OR"
1.0.0,set03,set04,T11,DFK24,,"18. Typically, how much supervision do grandparents provide to children?",A lot of supervision,,Yvonne Treis & Deginet Wotango Doyiso,DFK,5,Scalar,Constant supervision,A lot of supervision,Some supervision,Little supervision,No supervision at all,NA,NA,NA,Treis1Doyiso2,Kambaata,Kambaata,ktb,kamb1316,Wolaytta,Wolaytta,wal,wola1242,Kambaata - Wolaytta,ktb-wal,kamb1316–wola1242,Greater Abyssinia,"FDG, OR"
1.0.0,set03,set04,BI,DFK05,,19. What language are children expected to speak to their [q2o2answer] parent?,This is highly contextual,"We cannot really decide, it depends on where the family lives (in rural areas or the towns) and the choice of the living place is usually determined by the father (patrilocality is the norm).",Yvonne Treis & Deginet Wotango Doyiso,DFK,5,Types,The [q2o1answer] language,The [q2o2answer] language,Some other language,This is highly contextual,NA,NA,NA,NA,Treis1Doyiso2,Kambaata,Kambaata,ktb,kamb1316,Wolaytta,Wolaytta,wal,wola1242,Kambaata - Wolaytta,ktb-wal,kamb1316–wola1242,Greater Abyssinia,"FDG, OR"
1.0.0,set03,set04,T7,DFK20,,20. What language do [q2o1answer] parents typically speak with their children?,This is highly contextual,see earlier comment,Yvonne Treis & Deginet Wotango Doyiso,DFK,5,Types,The [q2o1answer] language,The [q2o2answer] language,Some other language,This is highly contextual,NA,NA,NA,NA,Treis1Doyiso2,Kambaata,Kambaata,ktb,kamb1316,Wolaytta,Wolaytta,wal,wola1242,Kambaata - Wolaytta,ktb-wal,kamb1316–wola1242,Greater Abyssinia,"FDG, OR"
1.0.0,set03,set04,T8,DFK21,,21. What language do [q2o2answer] parents typically speak with their children?,This is highly contextual,see earlier comment,Yvonne Treis & Deginet Wotango Doyiso,DFK,5,Types,The [q2o1answer] language,The [q2o2answer] language,Some other language,This is highly contextual,NA,NA,NA,NA,Treis1Doyiso2,Kambaata,Kambaata,ktb,kamb1316,Wolaytta,Wolaytta,wal,wola1242,Kambaata - Wolaytta,ktb-wal,kamb1316–wola1242,Greater Abyssinia,"FDG, OR"
1.0.0,set03,set04,T9,DFK22,,22. What language do children typically speak with their [q2o1answer] parent?,This is highly contextual,see earlier comment,Yvonne Treis & Deginet Wotango Doyiso,DFK,5,Types,The [q2o1answer] language,The [q2o2answer] language,Some other language,This is highly contextual,NA,NA,NA,NA,Treis1Doyiso2,Kambaata,Kambaata,ktb,kamb1316,Wolaytta,Wolaytta,wal,wola1242,Kambaata - Wolaytta,ktb-wal,kamb1316–wola1242,Greater Abyssinia,"FDG, OR"
1.0.0,set03,set04,T10,DFK23,,23. What language do children typically speak with their [q2o2answer] parent?,This is highly contextual,"see earlier comment (no language is per se dominant, it mostly depends on where the family settles)",Yvonne Treis & Deginet Wotango Doyiso,DFK,5,Types,The [q2o1answer] language,The [q2o2answer] language,Some other language,This is highly contextual,NA,NA,NA,NA,Treis1Doyiso2,Kambaata,Kambaata,ktb,kamb1316,Wolaytta,Wolaytta,wal,wola1242,Kambaata - Wolaytta,ktb-wal,kamb1316–wola1242,Greater Abyssinia,"FDG, OR"
1.0.0,set03,set04,T2,DFK25,,24. What language do [q2o2answer] grandparent/aunts/uncles typically speak to the children?,This is highly contextual,see comment above,Yvonne Treis & Deginet Wotango Doyiso,DFK,5,Types,The [q2o1answer] language,The [q2o2answer] language,Some other language,This is highly contextual,NA,NA,NA,NA,Treis1Doyiso2,Kambaata,Kambaata,ktb,kamb1316,Wolaytta,Wolaytta,wal,wola1242,Kambaata - Wolaytta,ktb-wal,kamb1316–wola1242,Greater Abyssinia,"FDG, OR"
1.0.0,set03,set04,T4,DFK26,,"25. Typically, what language do [q2o1answer] children speak with their [q2o2answer] grandparents/aunts/uncles?",This is highly contextual,see comment above,Yvonne Treis & Deginet Wotango Doyiso,DFK,5,Types,The [q2o1answer] language,The [q2o2answer] language,Some other language,This is highly contextual,NA,NA,NA,NA,Treis1Doyiso2,Kambaata,Kambaata,ktb,kamb1316,Wolaytta,Wolaytta,wal,wola1242,Kambaata - Wolaytta,ktb-wal,kamb1316–wola1242,Greater Abyssinia,"FDG, OR"
1.0.0,set03,set04,D9,DFK38,DFK38-1,26. Are any of the following features characteristic when speaking to one’s [q2o2answer] in-laws? Lexical avoidance,No,,Yvonne Treis & Deginet Wotango Doyiso,DFK,5,Binary-YesNo,Yes,No,NA,NA,NA,NA,NA,NA,Treis1Doyiso2,Kambaata,Kambaata,ktb,kamb1316,Wolaytta,Wolaytta,wal,wola1242,Kambaata - Wolaytta,ktb-wal,kamb1316–wola1242,Greater Abyssinia,"FDG, OR"
1.0.0,set03,set04,D9,DFK38,DFK38-2,26. Are any of the following features characteristic when speaking to one’s [q2o2answer] in-laws? The use of certain morphosyntactic forms,No,,Yvonne Treis & Deginet Wotango Doyiso,DFK,5,Binary-YesNo,Yes,No,NA,NA,NA,NA,NA,NA,Treis1Doyiso2,Kambaata,Kambaata,ktb,kamb1316,Wolaytta,Wolaytta,wal,wola1242,Kambaata - Wolaytta,ktb-wal,kamb1316–wola1242,Greater Abyssinia,"FDG, OR"
1.0.0,set03,set04,D9,DFK38,DFK38-3,26. Are any of the following features characteristic when speaking to one’s [q2o2answer] in-laws? The use of certain pronominal forms,Yes,,Yvonne Treis & Deginet Wotango Doyiso,DFK,5,Binary-YesNo,Yes,No,NA,NA,NA,NA,NA,NA,Treis1Doyiso2,Kambaata,Kambaata,ktb,kamb1316,Wolaytta,Wolaytta,wal,wola1242,Kambaata - Wolaytta,ktb-wal,kamb1316–wola1242,Greater Abyssinia,"FDG, OR"
1.0.0,set03,set04,S1,DFK12,,"27. Thinking about the [q2o1answer] person and their [q2o2answer] in-laws, how often would they typically meet?",B,We cannot answer this. It all depends on whether the Wolaytta in-laws live close or not,Yvonne Treis & Deginet Wotango Doyiso,DFK,5,Scalar,Very often,Often,Sometimes,Rarely,Very rarely,NA,NA,NA,Treis1Doyiso2,Kambaata,Kambaata,ktb,kamb1316,Wolaytta,Wolaytta,wal,wola1242,Kambaata - Wolaytta,ktb-wal,kamb1316–wola1242,Greater Abyssinia,"FDG, OR"
1.0.0,set03,set04,S3,DFK15,,28. How many people are typically involved in interactions between a [q2o1answer] person and their [q2o2answer] in-laws?,Interactions are rarely under 5 people,,Yvonne Treis & Deginet Wotango Doyiso,DFK,5,Scalar,Interactions are practically always under 5 people,Interactions are often under 5 people,Interactions are sometimes under 5 people,Interactions are rarely under 5 people,Interactions are practically never under 5 people,NA,NA,NA,Treis1Doyiso2,Kambaata,Kambaata,ktb,kamb1316,Wolaytta,Wolaytta,wal,wola1242,Kambaata - Wolaytta,ktb-wal,kamb1316–wola1242,Greater Abyssinia,"FDG, OR"
1.0.0,set03,set04,S4,DFK11,,29. How physically proximate to each other are a [q2o1answer] person and their [q2o2answer] in-laws?,B,It depends on where the couple lives (which is mostly at the husband's place),Yvonne Treis & Deginet Wotango Doyiso,DFK,5,Scalar,Very proximate to each other,Proximate to each other,Somewhat proximate to each other,Far from each other,Very far from each other,NA,NA,NA,Treis1Doyiso2,Kambaata,Kambaata,ktb,kamb1316,Wolaytta,Wolaytta,wal,wola1242,Kambaata - Wolaytta,ktb-wal,kamb1316–wola1242,Greater Abyssinia,"FDG, OR"
1.0.0,set03,set04,S5,DFK14,,30. How would you rate the overall relationship between a [q2o1answer] person and their [q2o2answer] in-laws?,B,Our choice would have been: respectfully,Yvonne Treis & Deginet Wotango Doyiso,DFK,5,Scalar,Friendly,Somewhat friendly,Neutral,Somewhat hostile,Hostile,NA,NA,NA,Treis1Doyiso2,Kambaata,Kambaata,ktb,kamb1316,Wolaytta,Wolaytta,wal,wola1242,Kambaata - Wolaytta,ktb-wal,kamb1316–wola1242,Greater Abyssinia,"FDG, OR"
1.0.0,set03,set04,BA,DFK33,,31. What is the overall attitude that a [q2o1answer] person has towards their [q2o2answer] in-laws?,Positive,,Yvonne Treis & Deginet Wotango Doyiso,DFK,5,Scalar,Very positive,Positive,Neutral,Negative,Very negative,NA,NA,NA,Treis1Doyiso2,Kambaata,Kambaata,ktb,kamb1316,Wolaytta,Wolaytta,wal,wola1242,Kambaata - Wolaytta,ktb-wal,kamb1316–wola1242,Greater Abyssinia,"FDG, OR"
1.0.0,set03,set04,O1,DFK30,,32. Your child has married a [q2o2answer] person. What language do you typically speak when speaking with your [q2o2answer] son/daughter-in-law?,Some other language,,Yvonne Treis & Deginet Wotango Doyiso,DFK,5,Types,The [q2o1answer] language,The [q2o2answer] language,Some other language,This is highly contextual,NA,NA,NA,NA,Treis1Doyiso2,Kambaata,Kambaata,ktb,kamb1316,Wolaytta,Wolaytta,wal,wola1242,Kambaata - Wolaytta,ktb-wal,kamb1316–wola1242,Greater Abyssinia,"FDG, OR"
1.0.0,set03,set04,O2,DFK31,,"33. Typically, does a [q2o1answer] person simplify their [q2o1answer] language when speaking to their [q2o2answer] in-laws?",NA,NA,Yvonne Treis & Deginet Wotango Doyiso,DFK,5,Types,Yes,No,This is highly contextual,NA,NA,NA,NA,NA,Treis1Doyiso2,Kambaata,Kambaata,ktb,kamb1316,Wolaytta,Wolaytta,wal,wola1242,Kambaata - Wolaytta,ktb-wal,kamb1316–wola1242,Greater Abyssinia,"FDG, OR"
