Version,Set,Old_Set_ID,CID,QID,Sub-ID,Wording,Response,Comment,Respondent,Dom,DomOrder,DataType,Answer1,Answer2,Answer3,Answer4,Answer5,Answer6,Answer7,Answer8,Surname,[q2o1answer],FLang,F_ISO,F_Glottocode,[q2o2answer],NLang,N_ISO,N_Glottocode,ContactPair,ContactPair_ISO,ContactPair_Glottocode,AArea,Reviewer
1.0.0,set04,set08,P3N,DLC0bN,,"Coarse time range, numerical",2000-2020,NA,Hannah Gibson & Maarten Mous,DLC,3,Value,NA,NA,NA,NA,NA,NA,NA,NA,Gibson1Mous2,Rangi,Langi,lag,lang1320,Alagwa,Alagwa,wbj,alag1248,Langi - Alagwa,lag-wbj,lang1320-alag1248,South Africa,"FDG, OR"
1.0.0,set04,set08,P4,DLC01,,"4. What other languages, if any, are spoken in the local community?","Swahili
Burunge
",,Hannah Gibson & Maarten Mous,DLC,3,Comment,NA,NA,NA,NA,NA,NA,NA,NA,Gibson1Mous2,Rangi,Langi,lag,lang1320,Alagwa,Alagwa,wbj,alag1248,Langi - Alagwa,lag-wbj,lang1320-alag1248,South Africa,"FDG, OR"
1.0.0,set04,set08,D1,DLC02,,5. Choose one of the following where [q2o1answer] people are most likely to speak in an unmonitored way.,Neighbourhood or village,"We would like to have chosen two options here, both 'nuclear family' and 'neighbourhood' as there is a close overlap between these two.",Hannah Gibson & Maarten Mous,DLC,3,Types,Nuclear Family,Band,Neighbourhood or village,Town or city,Other,NA,NA,NA,Gibson1Mous2,Rangi,Langi,lag,lang1320,Alagwa,Alagwa,wbj,alag1248,Langi - Alagwa,lag-wbj,lang1320-alag1248,South Africa,"FDG, OR"
1.0.0,set04,set08,D6,DLC28,,6. Where do [q2o1answer] and [q2o2answer] people typically meet up in the local community?,This is highly contextual,"There are no clearly delimited areas that 'belong' to these different communities. Typical interactions take place in homes, village level and public spaces.",Hannah Gibson & Maarten Mous,DLC,3,Types,At places which belong to the [q2o1answer],At places which belong to the [q2o2answer],At places which belong to some other group,This is highly contextual,NA,NA,NA,NA,Gibson1Mous2,Rangi,Langi,lag,lang1320,Alagwa,Alagwa,wbj,alag1248,Langi - Alagwa,lag-wbj,lang1320-alag1248,South Africa,"FDG, OR"
1.0.0,set04,set08,D11,DLC27,,7. How much influence can the [q2o1answer] exert over [q2o2answer] in the activities of the local community?,B,We cannot answer this question and don't think that power relations (or the notion of 'local community') works in this way in this area.,Hannah Gibson & Maarten Mous,DLC,3,Scalar,Influence is practically always exerted,Influence is very much exerted,Influence is somewhat exerted,Influence is exerted very little,Influence is practically never exerted,NA,NA,NA,Gibson1Mous2,Rangi,Langi,lag,lang1320,Alagwa,Alagwa,wbj,alag1248,Langi - Alagwa,lag-wbj,lang1320-alag1248,South Africa,"FDG, OR"
1.0.0,set04,set08,D3,DLC25,DLC25-1,"8. Involvement in the Local Community. Does involvement in the local community differ based on hierarchies associated to profession or wealth, such as a person's class and caste?",Yes,,Hannah Gibson & Maarten Mous,DLC,3,Binary-YesNo,Yes,No,NA,NA,NA,NA,NA,NA,Gibson1Mous2,Rangi,Langi,lag,lang1320,Alagwa,Alagwa,wbj,alag1248,Langi - Alagwa,lag-wbj,lang1320-alag1248,South Africa,"FDG, OR"
1.0.0,set04,set08,D3,DLC25,DLC25-2,"8. Involvement in the Local Community. Does involvement in the local community differ based on whether a person belongs to some magico-religiously sanctioned group, such as religious denomination?",No,,Hannah Gibson & Maarten Mous,DLC,3,Binary-YesNo,Yes,No,NA,NA,NA,NA,NA,NA,Gibson1Mous2,Rangi,Langi,lag,lang1320,Alagwa,Alagwa,wbj,alag1248,Langi - Alagwa,lag-wbj,lang1320-alag1248,South Africa,"FDG, OR"
1.0.0,set04,set08,D3,DLC25,DLC25-3,"8. Involvement in the Local Community. Does involvement in the local community differ based on a person's descent group, such as clan, house, lineage group, kinship group?",No,,Hannah Gibson & Maarten Mous,DLC,3,Binary-YesNo,Yes,No,NA,NA,NA,NA,NA,NA,Gibson1Mous2,Rangi,Langi,lag,lang1320,Alagwa,Alagwa,wbj,alag1248,Langi - Alagwa,lag-wbj,lang1320-alag1248,South Africa,"FDG, OR"
1.0.0,set04,set08,D3,DLC25,DLC25-4,"8. Involvement in the Local Community. Does involvement in the local community differ based on a person’s group of land ownership, such as tribe, clan, territorial group?",No,,Hannah Gibson & Maarten Mous,DLC,3,Binary-YesNo,Yes,No,NA,NA,NA,NA,NA,NA,Gibson1Mous2,Rangi,Langi,lag,lang1320,Alagwa,Alagwa,wbj,alag1248,Langi - Alagwa,lag-wbj,lang1320-alag1248,South Africa,"FDG, OR"
1.0.0,set04,set08,D3,DLC25,DLC25-5,"8. Involvement in the Local Community. Does involvement in the local community differ based on a person’s race, ethnicity, or some other similar grouping?",No,,Hannah Gibson & Maarten Mous,DLC,3,Binary-YesNo,Yes,No,NA,NA,NA,NA,NA,NA,Gibson1Mous2,Rangi,Langi,lag,lang1320,Alagwa,Alagwa,wbj,alag1248,Langi - Alagwa,lag-wbj,lang1320-alag1248,South Africa,"FDG, OR"
1.0.0,set04,set08,D3,DLC25,DLC25-6,8. Involvement in the Local Community. Does involvement in the local community differ based on a person’s age or life stage?,Yes,,Hannah Gibson & Maarten Mous,DLC,3,Binary-YesNo,Yes,No,NA,NA,NA,NA,NA,NA,Gibson1Mous2,Rangi,Langi,lag,lang1320,Alagwa,Alagwa,wbj,alag1248,Langi - Alagwa,lag-wbj,lang1320-alag1248,South Africa,"FDG, OR"
1.0.0,set04,set08,D3,DLC25,DLC25-7,8. Involvement in the Local Community. Does involvement in the local community differ based on a person’s place identity and affiliation?,No,,Hannah Gibson & Maarten Mous,DLC,3,Binary-YesNo,Yes,No,NA,NA,NA,NA,NA,NA,Gibson1Mous2,Rangi,Langi,lag,lang1320,Alagwa,Alagwa,wbj,alag1248,Langi - Alagwa,lag-wbj,lang1320-alag1248,South Africa,"FDG, OR"
1.0.0,set04,set08,D3,DLC25,DLC25-8,8. Involvement in the Local Community. Does involvement in the local community differ based on a person’s sex or gender?,Yes,,Hannah Gibson & Maarten Mous,DLC,3,Binary-YesNo,Yes,No,NA,NA,NA,NA,NA,NA,Gibson1Mous2,Rangi,Langi,lag,lang1320,Alagwa,Alagwa,wbj,alag1248,Langi - Alagwa,lag-wbj,lang1320-alag1248,South Africa,"FDG, OR"
1.0.0,set04,set08,D3,DLC25,DLC25-9,8. Involvement in the Local Community. Does involvement in the local community differ based on any other communities of practice?,No,,Hannah Gibson & Maarten Mous,DLC,3,Binary-YesNo,Yes,No,NA,NA,NA,NA,NA,NA,Gibson1Mous2,Rangi,Langi,lag,lang1320,Alagwa,Alagwa,wbj,alag1248,Langi - Alagwa,lag-wbj,lang1320-alag1248,South Africa,"FDG, OR"
1.0.0,set04,set08,D10,DLC29,,9. Do [q2o1answer] people experience the local community differently depending on social group?,No,In general this is no but we are not sure whether there are gender differences here that are not captured in the labour domain.,Hannah Gibson & Maarten Mous,DLC,3,Binary-YesNo,Yes,No,NA,NA,NA,NA,NA,NA,Gibson1Mous2,Rangi,Langi,lag,lang1320,Alagwa,Alagwa,wbj,alag1248,Langi - Alagwa,lag-wbj,lang1320-alag1248,South Africa,"FDG, OR"
1.0.0,set04,set08,S1,DLC16,,10. How often do [q2o1answer] people interact with [q2o2answer] people in the local community?,Very often,This varies between regions but in some areas would be several times per day at least.,Hannah Gibson & Maarten Mous,DLC,3,Scalar,Very often,Often,Sometimes,Rarely,Very rarely,NA,NA,NA,Gibson1Mous2,Rangi,Langi,lag,lang1320,Alagwa,Alagwa,wbj,alag1248,Langi - Alagwa,lag-wbj,lang1320-alag1248,South Africa,"FDG, OR"
1.0.0,set04,set08,S3,DLC15,,11. How many people are typically involved in interactions between [q2o1answer] people and [q2o2answer] people in the local community?,Interactions are often under 5 people,Daily interactions are likely to be in smaller groups.,Hannah Gibson & Maarten Mous,DLC,3,Scalar,Interactions are practically always under 5 people,Interactions are often under 5 people,Interactions are sometimes under 5 people,Interactions are rarely under 5 people,Interactions are practically never under 5 people,NA,NA,NA,Gibson1Mous2,Rangi,Langi,lag,lang1320,Alagwa,Alagwa,wbj,alag1248,Langi - Alagwa,lag-wbj,lang1320-alag1248,South Africa,"FDG, OR"
1.0.0,set04,set08,S4,DLC05,,12. How physically proximate to each other are people in the local community?,Very proximate to each other,,Hannah Gibson & Maarten Mous,DLC,3,Scalar,Very proximate to each other,Proximate to each other,Somewhat proximate to each other,Far from each other,Very far from each other,NA,NA,NA,Gibson1Mous2,Rangi,Langi,lag,lang1320,Alagwa,Alagwa,wbj,alag1248,Langi - Alagwa,lag-wbj,lang1320-alag1248,South Africa,"FDG, OR"
1.0.0,set04,set08,S5,DLC14,,13. How would you rate the overall relationship between [q2o1answer] and [q2o2answer] people in the local community?,Friendly,,Hannah Gibson & Maarten Mous,DLC,3,Scalar,Friendly,Somewhat friendly,Neutral,Somewhat hostile,Hostile,NA,NA,NA,Gibson1Mous2,Rangi,Langi,lag,lang1320,Alagwa,Alagwa,wbj,alag1248,Langi - Alagwa,lag-wbj,lang1320-alag1248,South Africa,"FDG, OR"
1.0.0,set04,set08,S6,DLC32,,"14. What is the proportion of total [q2o1answer] people who have opportunities for contact with [q2o2answer] people, in the form of local communities?",Some people,Varies by area.,Hannah Gibson & Maarten Mous,DLC,3,Scalar,Almost everyone,Many people,Some people,Few people,Practically no one,NA,NA,NA,Gibson1Mous2,Rangi,Langi,lag,lang1320,Alagwa,Alagwa,wbj,alag1248,Langi - Alagwa,lag-wbj,lang1320-alag1248,South Africa,"FDG, OR"
1.0.0,set04,set08,S7,DLC33,,"15. What is the proportion of total [q2o2answer] people who have opportunities for contact with [q2o1answer] people, in the form of local communities?",Many people,Varies by area.,Hannah Gibson & Maarten Mous,DLC,3,Scalar,Almost everyone,Many people,Some people,Few people,Practically no one,NA,NA,NA,Gibson1Mous2,Rangi,Langi,lag,lang1320,Alagwa,Alagwa,wbj,alag1248,Langi - Alagwa,lag-wbj,lang1320-alag1248,South Africa,"FDG, OR"
1.0.0,set04,set08,BA,DLC18,,16. What is the overall attitude that [q2o1answer] people have towards [q2o2answer] people in the local community?,Neutral,,Hannah Gibson & Maarten Mous,DLC,3,Scalar,Very positive,Positive,Neutral,Negative,Very negative,NA,NA,NA,Gibson1Mous2,Rangi,Langi,lag,lang1320,Alagwa,Alagwa,wbj,alag1248,Langi - Alagwa,lag-wbj,lang1320-alag1248,South Africa,"FDG, OR"
1.0.0,set04,set08,BH,DLC19,,"17. How do [q2o1answer] people view themselves overall in relation to [q2o2answer] people, in the context of the local community?",[q2o1answer] see themselves as superior to [q2o2answer],,Hannah Gibson & Maarten Mous,DLC,3,Scalar,[q2o1answer] see themselves as very superior to [q2o2answer],[q2o1answer] see themselves as superior to [q2o2answer],[q2o1answer] see themselves as neither superior nor inferior to [q2o2answer],[q2o1answer] see themselves as inferior to [q2o2answer],[q2o1answer] see themselves as very inferior to [q2o2answer],NA,NA,NA,Gibson1Mous2,Rangi,Langi,lag,lang1320,Alagwa,Alagwa,wbj,alag1248,Langi - Alagwa,lag-wbj,lang1320-alag1248,South Africa,"FDG, OR"
1.0.0,set04,set08,BI,DLC04,,18. What language do [q2o1answer] people expect to be used with [q2o2answer] people in the local community?,This is highly contextual,Rangi and Swahili,Hannah Gibson & Maarten Mous,DLC,3,Types,The [q2o1answer] language,The [q2o2answer] language,Some other language,This is highly contextual,NA,NA,NA,NA,Gibson1Mous2,Rangi,Langi,lag,lang1320,Alagwa,Alagwa,wbj,alag1248,Langi - Alagwa,lag-wbj,lang1320-alag1248,South Africa,"FDG, OR"
1.0.0,set04,set08,O1,DLC11,,19. What language do [q2o1answer] people typically speak with [q2o2answer] people in the local community?,This is highly contextual,Rangi and Swahili,Hannah Gibson & Maarten Mous,DLC,3,Types,The [q2o1answer] language,The [q2o2answer] language,Some other language,This is highly contextual,NA,NA,NA,NA,Gibson1Mous2,Rangi,Langi,lag,lang1320,Alagwa,Alagwa,wbj,alag1248,Langi - Alagwa,lag-wbj,lang1320-alag1248,South Africa,"FDG, OR"
1.0.0,set04,set08,O2,DLC12,,20. Do [q2o1answer] people typically simplify their language when speaking with [q2o2answer] people in the local community?,No,,Hannah Gibson & Maarten Mous,DLC,3,Types,Yes,No,This is highly contextual,NA,NA,NA,NA,NA,Gibson1Mous2,Rangi,Langi,lag,lang1320,Alagwa,Alagwa,wbj,alag1248,Langi - Alagwa,lag-wbj,lang1320-alag1248,South Africa,"FDG, OR"
1.0.0,set04,set08,O3,DLC13,,"21. Typically in the local community, how fluently do [q2o1answer] people speak the [q2o2answer] language?",Not fluently at all,,Hannah Gibson & Maarten Mous,DLC,3,Scalar,Very fluently,Fluently,Somewhat fluently,A little fluently,Not fluently at all,NA,NA,NA,Gibson1Mous2,Rangi,Langi,lag,lang1320,Alagwa,Alagwa,wbj,alag1248,Langi - Alagwa,lag-wbj,lang1320-alag1248,South Africa,"FDG, OR"
1.0.0,set04,set08,I1,DLC09,,22. What language do [q2o2answer] people typically speak with [q2o1answer] people in the local community?,This is highly contextual,Rangi and Swahili,Hannah Gibson & Maarten Mous,DLC,3,Types,The [q2o1answer] language,The [q2o2answer] language,Some other language,This is highly contextual,NA,NA,NA,NA,Gibson1Mous2,Rangi,Langi,lag,lang1320,Alagwa,Alagwa,wbj,alag1248,Langi - Alagwa,lag-wbj,lang1320-alag1248,South Africa,"FDG, OR"
1.0.0,set04,set08,I2,DLC10,,"23. Typically in the local community, how well do [q2o1answer] people understand the [q2o2answer] language?",Very poorly,Except for some individuals,Hannah Gibson & Maarten Mous,DLC,3,Scalar,Very well,Well,Somewhat,Poorly,Very poorly,NA,NA,NA,Gibson1Mous2,Rangi,Langi,lag,lang1320,Alagwa,Alagwa,wbj,alag1248,Langi - Alagwa,lag-wbj,lang1320-alag1248,South Africa,"FDG, OR"
1.0.0,set04,set08,T1,DLC31,,24. How much do [q2o1answer] children participate in the activities of the local community?,They participate somewhat,Children spend a lot of time at school where they speak Swahili.,Hannah Gibson & Maarten Mous,DLC,3,Scalar,They practically always participate,They participate a lot,They participate somewhat,They participate a little,They practically never participate,NA,NA,NA,Gibson1Mous2,Rangi,Langi,lag,lang1320,Alagwa,Alagwa,wbj,alag1248,Langi - Alagwa,lag-wbj,lang1320-alag1248,South Africa,"FDG, OR"
1.0.0,set04,set08,T6,DLC03,DLC03-1,"25. Looking after children in the local community. Typically, do adults other than the parents look after children up to five year of age in the local community?",Yes,The distinct between adults and parents (option 1 and 2) is not so straightforward here.,Hannah Gibson & Maarten Mous,DLC,3,Binary-YesNo,Yes,No,NA,NA,NA,NA,NA,NA,Gibson1Mous2,Rangi,Langi,lag,lang1320,Alagwa,Alagwa,wbj,alag1248,Langi - Alagwa,lag-wbj,lang1320-alag1248,South Africa,"FDG, OR"
1.0.0,set04,set08,T6,DLC03,DLC03-2,"25. Looking after children in the local community. Typically, do parents look after children up to five year of age in the local community?",Yes,[See above],Hannah Gibson & Maarten Mous,DLC,3,Binary-YesNo,Yes,No,NA,NA,NA,NA,NA,NA,Gibson1Mous2,Rangi,Langi,lag,lang1320,Alagwa,Alagwa,wbj,alag1248,Langi - Alagwa,lag-wbj,lang1320-alag1248,South Africa,"FDG, OR"
1.0.0,set04,set08,T6,DLC03,DLC03-3,"25. Looking after children in the local community. Typically, do children from sibling-kin groups look after children up to five year of age in local community?",Yes,[See above],Hannah Gibson & Maarten Mous,DLC,3,Binary-YesNo,Yes,No,NA,NA,NA,NA,NA,NA,Gibson1Mous2,Rangi,Langi,lag,lang1320,Alagwa,Alagwa,wbj,alag1248,Langi - Alagwa,lag-wbj,lang1320-alag1248,South Africa,"FDG, OR"
1.0.0,set04,set08,T6,DLC03,DLC03-4,"25. Looking after children in the local community. Typically, do children up to five year of age look after each other as part of the same peer group in the local community?",Yes,[See above],Hannah Gibson & Maarten Mous,DLC,3,Binary-YesNo,Yes,No,NA,NA,NA,NA,NA,NA,Gibson1Mous2,Rangi,Langi,lag,lang1320,Alagwa,Alagwa,wbj,alag1248,Langi - Alagwa,lag-wbj,lang1320-alag1248,South Africa,"FDG, OR"
1.0.0,set04,set08,T11,DLC20,,"26. Typically in the local community, how much supervision do adults provide to children’s own activities, such as playing?",Little supervision,,Hannah Gibson & Maarten Mous,DLC,3,Scalar,Constant supervision,A lot of supervision,Some supervision,Little supervision,No supervision at all,NA,NA,NA,Gibson1Mous2,Rangi,Langi,lag,lang1320,Alagwa,Alagwa,wbj,alag1248,Langi - Alagwa,lag-wbj,lang1320-alag1248,South Africa,"FDG, OR"
1.0.0,set04,set08,T2,DLC21,,27. What language do [q2o2answer] adults typically speak to a [q2o1answer] children?,The [q2o1answer] language,Or Swahili.,Hannah Gibson & Maarten Mous,DLC,3,Types,The [q2o1answer] language,The [q2o2answer] language,Some other language,This is highly contextual,NA,NA,NA,NA,Gibson1Mous2,Rangi,Langi,lag,lang1320,Alagwa,Alagwa,wbj,alag1248,Langi - Alagwa,lag-wbj,lang1320-alag1248,South Africa,"FDG, OR"
1.0.0,set04,set08,T4,DLC22,,"28. Typically, what language do [q2o1answer] children from four/five year of age prefer to speak with [q2o2answer] adults?",The [q2o1answer] language,,Hannah Gibson & Maarten Mous,DLC,3,Types,The [q2o1answer] language,The [q2o2answer] language,Some other language,This is highly contextual,NA,NA,NA,NA,Gibson1Mous2,Rangi,Langi,lag,lang1320,Alagwa,Alagwa,wbj,alag1248,Langi - Alagwa,lag-wbj,lang1320-alag1248,South Africa,"FDG, OR"
1.0.0,set04,set08,T5,DLC23,,"29. Typically, what language would a [q2o1answer] child speak to [q2o2answer] children in the local community?",This is highly contextual,Rangi would dominate here amongst younger children. When children get to school and start speaking Swahili this is likely to become Swahili.,Hannah Gibson & Maarten Mous,DLC,3,Types,[q2o1answer] children do not interact with [q2o2answer] children],The [q2o1answer] language,The [q2o2answer] language,Some other language,This is highly contextual,NA,NA,NA,Gibson1Mous2,Rangi,Langi,lag,lang1320,Alagwa,Alagwa,wbj,alag1248,Langi - Alagwa,lag-wbj,lang1320-alag1248,South Africa,"FDG, OR"
1.0.0,set04,set08,E1,DLC96,,"30. List any other groups that the [q2o1answer] formed local communities with in the past, in so far as you believe this had linguistic consequences for the [q2o1answer] language. Where possible, please also give an indication of when this happened.","Mbugwe
Burunge
Swahili traders",NA,Hannah Gibson & Maarten Mous,DLC,3,Comment,NA,NA,NA,NA,NA,NA,NA,NA,Gibson1Mous2,Rangi,Langi,lag,lang1320,Alagwa,Alagwa,wbj,alag1248,Langi - Alagwa,lag-wbj,lang1320-alag1248,South Africa,"FDG, OR"
1.0.0,set04,set08,E4,DLC97,,"31. What type of data informed your answers to the questions in the domain of local community, overall?",Impressions from my own fieldwork with the exact or related community,NA,Hannah Gibson & Maarten Mous,DLC,3,TypesMultiple,Impressions from my own fieldwork with the exact or related community,Reports from language consultants,Published or ongoing research project of my own on topics covered in this questionnaire,Published material by linguists,Published materials by other researchers in other fields,Other,NA,NA,Gibson1Mous2,Rangi,Langi,lag,lang1320,Alagwa,Alagwa,wbj,alag1248,Langi - Alagwa,lag-wbj,lang1320-alag1248,South Africa,"FDG, OR"
1.0.0,set04,set08,E5,DLC98,,32. How certain are you in your responses for the domain of local community?,Somewhat certain,NA,Hannah Gibson & Maarten Mous,DLC,3,Scalar,Very certain,Certain,Somewhat certain,Uncertain,Very uncertain,NA,NA,NA,Gibson1Mous2,Rangi,Langi,lag,lang1320,Alagwa,Alagwa,wbj,alag1248,Langi - Alagwa,lag-wbj,lang1320-alag1248,South Africa,"FDG, OR"
1.0.0,set04,set08,E6,DLC99,,33. List any comments or notes that you feel are relevant to this section of the questionnaire.,"As with the previous questionnaires, our confidence level is based on our own assessment. But there are not published detailed sources on this kind of information.",NA,Hannah Gibson & Maarten Mous,DLC,3,Comment,NA,NA,NA,NA,NA,NA,NA,NA,Gibson1Mous2,Rangi,Langi,lag,lang1320,Alagwa,Alagwa,wbj,alag1248,Langi - Alagwa,lag-wbj,lang1320-alag1248,South Africa,"FDG, OR"
1.0.0,set04,set08,P1,DKN00,,1. Have [q2o1answer] and [q2o2answer] people occupied the same spaces of knowledge transfer together?,No,,Hannah Gibson & Maarten Mous,DKN,5,Binary-YesNo,Yes,No,NA,NA,NA,NA,NA,NA,Gibson1Mous2,Rangi,Langi,lag,lang1320,Alagwa,Alagwa,wbj,alag1248,Langi - Alagwa,lag-wbj,lang1320-alag1248,South Africa,"FDG, OR"
1.0.0,set04,set08,P2,DKN0a,,2. How long have [q2o1answer] and [q2o2answer] people been involved in the knowledge domain together for?,NA,NA,Hannah Gibson & Maarten Mous,DKN,5,Comment,NA,NA,NA,NA,NA,NA,NA,NA,Gibson1Mous2,Rangi,Langi,lag,lang1320,Alagwa,Alagwa,wbj,alag1248,Langi - Alagwa,lag-wbj,lang1320-alag1248,South Africa,"FDG, OR"
1.0.0,set04,set08,P2N,DKN0aN,,"Coarse time range, numerical",NA,NA,Hannah Gibson & Maarten Mous,DKN,5,Value,NA,NA,NA,NA,NA,NA,NA,NA,Gibson1Mous2,Rangi,Langi,lag,lang1320,Alagwa,Alagwa,wbj,alag1248,Langi - Alagwa,lag-wbj,lang1320-alag1248,South Africa,"FDG, OR"
1.0.0,set04,set08,P3,DKN0b,,3. What is the time frame when the largest number of people had the most opportunities for interaction in the knowledge domain?,NA,NA,Hannah Gibson & Maarten Mous,DKN,5,Comment,NA,NA,NA,NA,NA,NA,NA,NA,Gibson1Mous2,Rangi,Langi,lag,lang1320,Alagwa,Alagwa,wbj,alag1248,Langi - Alagwa,lag-wbj,lang1320-alag1248,South Africa,"FDG, OR"
1.0.0,set04,set08,P3N,DKN0bN,,"Coarse time range, numerical",NA,NA,Hannah Gibson & Maarten Mous,DKN,5,Value,NA,NA,NA,NA,NA,NA,NA,NA,Gibson1Mous2,Rangi,Langi,lag,lang1320,Alagwa,Alagwa,wbj,alag1248,Langi - Alagwa,lag-wbj,lang1320-alag1248,South Africa,"FDG, OR"
1.0.0,set04,set08,P4,DKN01,,"4. What other languages, if any, are spoken in the knowledge domain?",NA,NA,Hannah Gibson & Maarten Mous,DKN,5,Comment,NA,NA,NA,NA,NA,NA,NA,NA,Gibson1Mous2,Rangi,Langi,lag,lang1320,Alagwa,Alagwa,wbj,alag1248,Langi - Alagwa,lag-wbj,lang1320-alag1248,South Africa,"FDG, OR"
1.0.0,set04,set08,D1,DKN02,,5. The most influential form of knowledge in this contact scenario is:,NA,NA,Hannah Gibson & Maarten Mous,DKN,5,Types,Global,Local,NA,NA,NA,NA,NA,NA,Gibson1Mous2,Rangi,Langi,lag,lang1320,Alagwa,Alagwa,wbj,alag1248,Langi - Alagwa,lag-wbj,lang1320-alag1248,South Africa,"FDG, OR"
1.0.0,set04,set08,D4,DKN04,,6. The relationship between [q2o1answer] people and [q2o2answer] people in the knowledge domain can typically be characterised as:,NA,NA,Hannah Gibson & Maarten Mous,DKN,5,Types,"[q2o1answer] people are masters, [q2o2answer] are novices","[q2o2answer] people are masters, [q2o1answer] are novices",None of the above,NA,NA,NA,NA,NA,Gibson1Mous2,Rangi,Langi,lag,lang1320,Alagwa,Alagwa,wbj,alag1248,Langi - Alagwa,lag-wbj,lang1320-alag1248,South Africa,"FDG, OR"
1.0.0,set04,set08,D6,DKN05,,7. Where does knowledge transmission between [q2o1answer] people and [q2o2answer] people typically take place?,NA,NA,Hannah Gibson & Maarten Mous,DKN,5,Types,At places which belong to the [q2o1answer],At places which belong to the [q2o2answer],At places which belong to some other group,This is highly contextual,NA,NA,NA,NA,Gibson1Mous2,Rangi,Langi,lag,lang1320,Alagwa,Alagwa,wbj,alag1248,Langi - Alagwa,lag-wbj,lang1320-alag1248,South Africa,"FDG, OR"
1.0.0,set04,set08,D11,DKN28,,8. How much influence can the [q2o1answer] people exert over the decision of what constitutes legitimate knowledge in this domain?,NA,NA,Hannah Gibson & Maarten Mous,DKN,5,Scalar,Influence is practically always exerted,Influence is very much exerted,Influence is somewhat exerted,Influence is exerted very little,Influence is practically never exerted,NA,NA,NA,Gibson1Mous2,Rangi,Langi,lag,lang1320,Alagwa,Alagwa,wbj,alag1248,Langi - Alagwa,lag-wbj,lang1320-alag1248,South Africa,"FDG, OR"
1.0.0,set04,set08,D9,DKN06,,9. Are there any speech styles used in the knowledge domain?,NA,NA,Hannah Gibson & Maarten Mous,DKN,5,Binary-YesNo,Yes,No,NA,NA,NA,NA,NA,NA,Gibson1Mous2,Rangi,Langi,lag,lang1320,Alagwa,Alagwa,wbj,alag1248,Langi - Alagwa,lag-wbj,lang1320-alag1248,South Africa,"FDG, OR"
1.0.0,set04,set08,D12,DKN31,,"10. How often are these speech styles typically used in knowledge transmission, in comparison with unmonitored speech?",NA,NA,Hannah Gibson & Maarten Mous,DKN,5,Scalar,Always,Sometimes,As much as unmonitored speech,Rarely,Never,NA,NA,NA,Gibson1Mous2,Rangi,Langi,lag,lang1320,Alagwa,Alagwa,wbj,alag1248,Langi - Alagwa,lag-wbj,lang1320-alag1248,South Africa,"FDG, OR"
1.0.0,set04,set08,D3,DKN03,DKN03-1,"11. Involvement in the knowledge domain. Does involvement in the knowledge domain differ based on hierarchies associated to profession or wealth, such as a person's class and caste?",NA,NA,Hannah Gibson & Maarten Mous,DKN,5,Binary-YesNo,Yes,No,NA,NA,NA,NA,NA,NA,Gibson1Mous2,Rangi,Langi,lag,lang1320,Alagwa,Alagwa,wbj,alag1248,Langi - Alagwa,lag-wbj,lang1320-alag1248,South Africa,"FDG, OR"
1.0.0,set04,set08,D3,DKN03,DKN03-2,"11. Involvement in the knowledge domain. Does involvement in the knowledge domain differ based on whether a person belongs to some magico-religiously sanctioned group, such as religious denomination?",NA,NA,Hannah Gibson & Maarten Mous,DKN,5,Binary-YesNo,Yes,No,NA,NA,NA,NA,NA,NA,Gibson1Mous2,Rangi,Langi,lag,lang1320,Alagwa,Alagwa,wbj,alag1248,Langi - Alagwa,lag-wbj,lang1320-alag1248,South Africa,"FDG, OR"
1.0.0,set04,set08,D3,DKN03,DKN03-3,"11. Involvement in the knowledge domain. Does involvement in the knowledge domain differ based on a person's descent group, such as clan, house, lineage group, kinship group?",NA,NA,Hannah Gibson & Maarten Mous,DKN,5,Binary-YesNo,Yes,No,NA,NA,NA,NA,NA,NA,Gibson1Mous2,Rangi,Langi,lag,lang1320,Alagwa,Alagwa,wbj,alag1248,Langi - Alagwa,lag-wbj,lang1320-alag1248,South Africa,"FDG, OR"
1.0.0,set04,set08,D3,DKN03,DKN03-4,"11. Involvement in the knowledge domain. Does involvement in the knowledge domain differ based on a person’s group of land ownership, such as tribe, clan, territorial group?",NA,NA,Hannah Gibson & Maarten Mous,DKN,5,Binary-YesNo,Yes,No,NA,NA,NA,NA,NA,NA,Gibson1Mous2,Rangi,Langi,lag,lang1320,Alagwa,Alagwa,wbj,alag1248,Langi - Alagwa,lag-wbj,lang1320-alag1248,South Africa,"FDG, OR"
