Version,Set,Old_Set_ID,CID,QID,Sub-ID,Wording,Response,Comment,Respondent,Dom,DomOrder,DataType,Answer1,Answer2,Answer3,Answer4,Answer5,Answer6,Answer7,Answer8,Surname,[q2o1answer],FLang,F_ISO,F_Glottocode,[q2o2answer],NLang,N_ISO,N_Glottocode,ContactPair,ContactPair_ISO,ContactPair_Glottocode,AArea,Reviewer
1.0.0,set04,set08,OT1,OT1,,1. How long have [q2o1answer] and [q2o2answer] people been in contact overall?,For at least the last 100 years. And then for as long as Rangi have existed there has been contact between these communities.,We are not sure about the exact date/time when the Rangi community came into being.,Hannah Gibson & Maarten Mous,OV,6,Comment,NA,NA,NA,NA,NA,NA,NA,NA,Gibson1Mous2,Rangi,Langi,lag,lang1320,Alagwa,Alagwa,wbj,alag1248,Langi - Alagwa,lag-wbj,lang1320-alag1248,South Africa,"FDG, OR"
1.0.0,set04,set08,OT1N,OT1N,,"Coarse time range, numerical",1920-2020,NA,Hannah Gibson & Maarten Mous,OV,6,Value,NA,NA,NA,NA,NA,NA,NA,NA,Gibson1Mous2,Rangi,Langi,lag,lang1320,Alagwa,Alagwa,wbj,alag1248,Langi - Alagwa,lag-wbj,lang1320-alag1248,South Africa,"FDG, OR"
1.0.0,set04,set08,OT2,OT2,,2. What is the overall time frame when the largest number of people had the most opportunities for interaction?,The present-day has the highest density of contact.,,Hannah Gibson & Maarten Mous,OV,6,Comment,NA,NA,NA,NA,NA,NA,NA,NA,Gibson1Mous2,Rangi,Langi,lag,lang1320,Alagwa,Alagwa,wbj,alag1248,Langi - Alagwa,lag-wbj,lang1320-alag1248,South Africa,"FDG, OR"
1.0.0,set04,set08,OT2N,OT2N,,"Coarse time range, numerical",2000-2020,NA,Hannah Gibson & Maarten Mous,OV,6,Value,NA,NA,NA,NA,NA,NA,NA,NA,Gibson1Mous2,Rangi,Langi,lag,lang1320,Alagwa,Alagwa,wbj,alag1248,Langi - Alagwa,lag-wbj,lang1320-alag1248,South Africa,"FDG, OR"
1.0.0,set04,set08,OD1,OD1,,1. What is the total number of native-like speakers of [q2o1answer]?,"100,000-999,999 speakers","Estimates of the number of Rangi speakers range from 270,000 (Bergman et al. 2007) to 310,000 (Gordon 2005), whilst Cox and Stegen (2007) calculate the Rangi-speaking population to be as high as 420,000. This higher figure is supported by the findings of the 2002 Tanzanian census which gave the population of Kondoa District as 428,090, indicating that the Rangi population may have reached 400,000 (Stegen 2011).",Hannah Gibson & Maarten Mous,OV,6,Types,10-99 speakers,100-999 speakers,"1,000-9,999 speakers","10,000-99,999 speakers","100,000-999,999 speakers","1,000,000-9,999,999 speakers","10,000,000-99,999,999 speakers","100,000,000-999,999,999 speakers",Gibson1Mous2,Rangi,Langi,lag,lang1320,Alagwa,Alagwa,wbj,alag1248,Langi - Alagwa,lag-wbj,lang1320-alag1248,South Africa,"FDG, OR"
1.0.0,set04,set08,OD3,OD3,,2. What is the total number of native-like speakers of [q2o2answer]?,"10,000-99,999 speakers","48,000 (Languages of Tanzania 2009)",Hannah Gibson & Maarten Mous,OV,6,Types,10-99 speakers,100-999 speakers,"1,000-9,999 speakers","10,000-99,999 speakers","100,000-999,999 speakers","1,000,000-9,999,999 speakers","10,000,000-99,999,999 speakers","100,000,000-999,999,999 speakers",Gibson1Mous2,Rangi,Langi,lag,lang1320,Alagwa,Alagwa,wbj,alag1248,Langi - Alagwa,lag-wbj,lang1320-alag1248,South Africa,"FDG, OR"
1.0.0,set04,set08,OD4,OD4,,3. What is the approximate proportion of native-like speakers in the total population of all speakers of [q2o1answer]?,High proportion,,Hannah Gibson & Maarten Mous,OV,6,Scalar,High proportion,Fairly high proportion,Intermediate proportion,Fairly low proportion,Low proportion,NA,NA,NA,Gibson1Mous2,Rangi,Langi,lag,lang1320,Alagwa,Alagwa,wbj,alag1248,Langi - Alagwa,lag-wbj,lang1320-alag1248,South Africa,"FDG, OR"
1.0.0,set04,set08,OD5,OD5,,4. What is the approximate proportion of native-like speakers in the total population of all speakers of [q2o2answer]?,High proportion,We estimate this to in fact be close to 100%,Hannah Gibson & Maarten Mous,OV,6,Scalar,High proportion,Fairly high proportion,Intermediate proportion,Fairly low proportion,Low proportion,NA,NA,NA,Gibson1Mous2,Rangi,Langi,lag,lang1320,Alagwa,Alagwa,wbj,alag1248,Langi - Alagwa,lag-wbj,lang1320-alag1248,South Africa,"FDG, OR"
1.0.0,set04,set08,OG1,OG1,,5. What is the population density within the area where [q2o1answer] is spoken?,20–99 persons per 10 sq. km,Population density in Kondoa is 46.6km2,Hannah Gibson & Maarten Mous,OV,6,Types,Less than 2 persons per 10 sq. km,2–4 persons per 10 sq. km,5–19 persons per 10 sq. km,20–99 persons per 10 sq. km,100–399 persons per 10 sq. km,NA,NA,NA,Gibson1Mous2,Rangi,Langi,lag,lang1320,Alagwa,Alagwa,wbj,alag1248,Langi - Alagwa,lag-wbj,lang1320-alag1248,South Africa,"FDG, OR"
1.0.0,set04,set08,OS7,OS7,,6. What is the mean size of the [q2o1answer] speaking communities at the local level?,"More than 1,000 persons in the absence of indigenous urban aggregations","The whole of Kondoa District is predominantly Rangi, including the capital town of Kondoa. However, beyond this the vast majority of communities at the local level (i.e. villages) would be over 1000 people.",Hannah Gibson & Maarten Mous,OV,6,Types,Fewer than 50 persons,From 50 to 99 persons,From 100 to 199 persons,From 200 to 399 persons,"From 400 to 1,000 persons","More than 1,000 persons in the absence of indigenous urban aggregations","One or more indigenous towns of more than 5,000 inhabitants but none of more than 50,000",NA,Gibson1Mous2,Rangi,Langi,lag,lang1320,Alagwa,Alagwa,wbj,alag1248,Langi - Alagwa,lag-wbj,lang1320-alag1248,South Africa,"FDG, OR"
1.0.0,set04,set08,OS9,OS9,,7. How frequently do [q2o1answer] people generally interact with out-group people? ,Very Frequently,Daily in most instances.,Hannah Gibson & Maarten Mous,OV,6,Scalar,Very Frequently,Frequently,Neither frequently nor infrequently,Infrequently,Very infrequently,NA,NA,NA,Gibson1Mous2,Rangi,Langi,lag,lang1320,Alagwa,Alagwa,wbj,alag1248,Langi - Alagwa,lag-wbj,lang1320-alag1248,South Africa,"FDG, OR"
1.0.0,set04,set08,OI1,OI1,OI1-1,"8. Is [q2o1answer] stated as an expression of identity of any of the following? Group centered around shared descent, such as clan, house, lineage group, kinship group",Yes,,Hannah Gibson & Maarten Mous,OV,6,Binary-YesNo,Yes,No,NA,NA,NA,NA,NA,NA,Gibson1Mous2,Rangi,Langi,lag,lang1320,Alagwa,Alagwa,wbj,alag1248,Langi - Alagwa,lag-wbj,lang1320-alag1248,South Africa,"FDG, OR"
1.0.0,set04,set08,OI1,OI1,OI1-2,"8. Is [q2o1answer] stated as an expression of identity of any of the following? Race, ethnicity, or some other similar grouping",Yes,,Hannah Gibson & Maarten Mous,OV,6,Binary-YesNo,Yes,No,NA,NA,NA,NA,NA,NA,Gibson1Mous2,Rangi,Langi,lag,lang1320,Alagwa,Alagwa,wbj,alag1248,Langi - Alagwa,lag-wbj,lang1320-alag1248,South Africa,"FDG, OR"
1.0.0,set04,set08,OI1,OI1,OI1-3,"8. Is [q2o1answer] stated as an expression of identity of any of the following? Micro-level (politico-)territorial group, including regional or areal groups, clans, bands, tribes",Yes,,Hannah Gibson & Maarten Mous,OV,6,Binary-YesNo,Yes,No,NA,NA,NA,NA,NA,NA,Gibson1Mous2,Rangi,Langi,lag,lang1320,Alagwa,Alagwa,wbj,alag1248,Langi - Alagwa,lag-wbj,lang1320-alag1248,South Africa,"FDG, OR"
1.0.0,set04,set08,OI1,OI1,OI1-4,"8. Is [q2o1answer] stated as an expression of identity of any of the following? Macro-level (politico-)territorial group, such as nation, tribe, state",Yes,,Hannah Gibson & Maarten Mous,OV,6,Binary-YesNo,Yes,No,NA,NA,NA,NA,NA,NA,Gibson1Mous2,Rangi,Langi,lag,lang1320,Alagwa,Alagwa,wbj,alag1248,Langi - Alagwa,lag-wbj,lang1320-alag1248,South Africa,"FDG, OR"
1.0.0,set04,set08,OI1,OI1,OI1-5,"8. Is [q2o1answer] stated as an expression of identity of any of the following? Formal or informal relationships between non-kin, such as alliances, sodality membership, ad-hoc relationships between families or individuals",No,,Hannah Gibson & Maarten Mous,OV,6,Binary-YesNo,Yes,No,NA,NA,NA,NA,NA,NA,Gibson1Mous2,Rangi,Langi,lag,lang1320,Alagwa,Alagwa,wbj,alag1248,Langi - Alagwa,lag-wbj,lang1320-alag1248,South Africa,"FDG, OR"
1.0.0,set04,set08,OI3,OI3,,9. Is there a codified standard variety for [q2o1answer]?,No,,Hannah Gibson & Maarten Mous,OV,6,Binary-YesNo,Yes,No,NA,NA,NA,NA,NA,NA,Gibson1Mous2,Rangi,Langi,lag,lang1320,Alagwa,Alagwa,wbj,alag1248,Langi - Alagwa,lag-wbj,lang1320-alag1248,South Africa,"FDG, OR"
1.0.0,set04,set08,OI6,OI6,,"10. What are the [q2o1answer] speakers' attitudes towards linguistic transfers from [q2o2answer], such as lexical or grammatical borrowing?",Neither positive nor negative,There is very little awareness about linguistic transfer from Alagwa.,Hannah Gibson & Maarten Mous,OV,6,Scalar,Very positive,Positive,Neither positive nor negative,Negative,Very negative,NA,NA,NA,Gibson1Mous2,Rangi,Langi,lag,lang1320,Alagwa,Alagwa,wbj,alag1248,Langi - Alagwa,lag-wbj,lang1320-alag1248,South Africa,"FDG, OR"
1.0.0,set04,set08,OI7,OI7,,"11. What are the [q2o1answer] speakers' general attitudes towards linguistic transfer, such as lexical or grammatical borrowing, from any other language than [q2o2answer]?",Positive,"We have selected 'positive' here since there is widespread influence from Swahili for example. However, there are discussions of 'purity' where people are also resistant to influence from other languages so this could also be categorised as 'negative'.",Hannah Gibson & Maarten Mous,OV,6,Scalar,Very positive,Positive,Neither positive nor negative,Negative,Very negative,NA,NA,NA,Gibson1Mous2,Rangi,Langi,lag,lang1320,Alagwa,Alagwa,wbj,alag1248,Langi - Alagwa,lag-wbj,lang1320-alag1248,South Africa,"FDG, OR"
1.0.0,set04,set08,OI9,OI9,,12. What are the [q2o1answer] speakers' attitudes towards lectal differences within [q2o1answer]?,Positive,"There is awareness of dialectal variation with some varieties (e.g. Haubi) being seen as prestigious. And awareness of regional variation to a certain extent, as well as urban/rural.",Hannah Gibson & Maarten Mous,OV,6,Scalar,Very positive,Positive,Neither positive nor negative,Negative,Very negative,NA,NA,NA,Gibson1Mous2,Rangi,Langi,lag,lang1320,Alagwa,Alagwa,wbj,alag1248,Langi - Alagwa,lag-wbj,lang1320-alag1248,South Africa,"FDG, OR"
1.0.0,set04,set08,OI8,OI8,,13. How significant is language as part of group identity for the speakers of [q2o1answer]?,Very significant,,Hannah Gibson & Maarten Mous,OV,6,Scalar,Very significant,Significant,Neither significant nor insignificant,Insignificant,Very insignificant,NA,NA,NA,Gibson1Mous2,Rangi,Langi,lag,lang1320,Alagwa,Alagwa,wbj,alag1248,Langi - Alagwa,lag-wbj,lang1320-alag1248,South Africa,"FDG, OR"
1.0.0,set04,set08,OB1,OB1,,14. There is an emic conception of [q2o1answer] as “a language” or some other categorical or objective thing?,Yes,,Hannah Gibson & Maarten Mous,OV,6,Binary-YesNo,Yes,No,NA,NA,NA,NA,NA,NA,Gibson1Mous2,Rangi,Langi,lag,lang1320,Alagwa,Alagwa,wbj,alag1248,Langi - Alagwa,lag-wbj,lang1320-alag1248,South Africa,"FDG, OR"
1.0.0,set04,set08,O10,O10,,[q2o1answer] peoples’ language loyalty towards [q2o1answer] can be characterised as:,High,,Hannah Gibson & Maarten Mous,OV,6,Scalar,Very high,High,Neither low nor high,Low,Very low,NA,NA,NA,Gibson1Mous2,Rangi,Langi,lag,lang1320,Alagwa,Alagwa,wbj,alag1248,Langi - Alagwa,lag-wbj,lang1320-alag1248,South Africa,"FDG, OR"
1.0.0,set04,set08,OL3,OL3,,15. Do the [q2o1answer] speaking people use some orthography in writing their language?,"No, the Focus Group language is not written",,Hannah Gibson & Maarten Mous,OV,6,Types,"Yes, in a non-standardised way","Yes, in a standardised way","No, the Focus Group language is not written",NA,NA,NA,NA,NA,Gibson1Mous2,Rangi,Langi,lag,lang1320,Alagwa,Alagwa,wbj,alag1248,Langi - Alagwa,lag-wbj,lang1320-alag1248,South Africa,"FDG, OR"
1.0.0,set04,set08,OL1,OL1,,16. What is the approximate rate of formal literacy in the [q2o1answer] speaking community?,Low,The language is essentially not written. There are some efforts by a small group of people to write it and some people may use Swahili-based orthography to try to write Rangi. But this is very limited.,Hannah Gibson & Maarten Mous,OV,6,Scalar,High,Fairly high,Intermediate,Fairly low,Low,NA,NA,NA,Gibson1Mous2,Rangi,Langi,lag,lang1320,Alagwa,Alagwa,wbj,alag1248,Langi - Alagwa,lag-wbj,lang1320-alag1248,South Africa,"FDG, OR"
1.0.0,set04,set08,OL2,OL2,OL2-1,"17. Restrictions in access to literacy in terms of social categories. Is the ability to read and write restricted, in practice, to people of certain hierarchy groups associated with profession or wealth (such as class and caste)?",No,Here we have focused entirely on literacy in Swahili since there is no widely written form of Rangi. The key factor here would be access to schooling and formal education.,Hannah Gibson & Maarten Mous,OV,6,Binary-YesNo,Yes,No,NA,NA,NA,NA,NA,NA,Gibson1Mous2,Rangi,Langi,lag,lang1320,Alagwa,Alagwa,wbj,alag1248,Langi - Alagwa,lag-wbj,lang1320-alag1248,South Africa,"FDG, OR"
1.0.0,set04,set08,OL2,OL2,OL2-2,"17. Restrictions in access to literacy in terms of social categories. Is the ability to read and write restricted, in practice, to people of certain magico-religiously sanctioned groups (such as religious denomination)?",No,[See above],Hannah Gibson & Maarten Mous,OV,6,Binary-YesNo,Yes,No,NA,NA,NA,NA,NA,NA,Gibson1Mous2,Rangi,Langi,lag,lang1320,Alagwa,Alagwa,wbj,alag1248,Langi - Alagwa,lag-wbj,lang1320-alag1248,South Africa,"FDG, OR"
1.0.0,set04,set08,OL2,OL2,OL2-3,"17. Restrictions in access to literacy in terms of social categories. Is the ability to read and write restricted, in practice, to people of certain descent groups, such as clan, house, lineage group, kinship group)?",No,[See above],Hannah Gibson & Maarten Mous,OV,6,Binary-YesNo,Yes,No,NA,NA,NA,NA,NA,NA,Gibson1Mous2,Rangi,Langi,lag,lang1320,Alagwa,Alagwa,wbj,alag1248,Langi - Alagwa,lag-wbj,lang1320-alag1248,South Africa,"FDG, OR"
1.0.0,set04,set08,OL2,OL2,OL2-4,"17. Restrictions in access to literacy in terms of social categories. Is the ability to read and write restricted, in practice, to people of certain races, ethnicities, or some other similar grouping?",No,[See above],Hannah Gibson & Maarten Mous,OV,6,Binary-YesNo,Yes,No,NA,NA,NA,NA,NA,NA,Gibson1Mous2,Rangi,Langi,lag,lang1320,Alagwa,Alagwa,wbj,alag1248,Langi - Alagwa,lag-wbj,lang1320-alag1248,South Africa,"FDG, OR"
1.0.0,set04,set08,OL2,OL2,OL2-5,"17. Restrictions in access to literacy in terms of social categories. Is the ability to read and write restricted, in practice, to people of certain age cohorts or life stages?",No,[See above],Hannah Gibson & Maarten Mous,OV,6,Binary-YesNo,Yes,No,NA,NA,NA,NA,NA,NA,Gibson1Mous2,Rangi,Langi,lag,lang1320,Alagwa,Alagwa,wbj,alag1248,Langi - Alagwa,lag-wbj,lang1320-alag1248,South Africa,"FDG, OR"
1.0.0,set04,set08,OL2,OL2,OL2-6,"17. Restrictions in access to literacy in terms of social categories. Is the ability to read and write restricted, in practice, to a certain sex or genders?",No,[See above],Hannah Gibson & Maarten Mous,OV,6,Binary-YesNo,Yes,No,NA,NA,NA,NA,NA,NA,Gibson1Mous2,Rangi,Langi,lag,lang1320,Alagwa,Alagwa,wbj,alag1248,Langi - Alagwa,lag-wbj,lang1320-alag1248,South Africa,"FDG, OR"
1.0.0,set04,set08,OL2,OL2,OL2-7,"17. Restrictions in access to literacy in terms of social categories. Is the ability to read and write restricted, in practice, to other communities of practice not mentioned above?",No,[See above],Hannah Gibson & Maarten Mous,OV,6,Binary-YesNo,Yes,No,NA,NA,NA,NA,NA,NA,Gibson1Mous2,Rangi,Langi,lag,lang1320,Alagwa,Alagwa,wbj,alag1248,Langi - Alagwa,lag-wbj,lang1320-alag1248,South Africa,"FDG, OR"
1.0.0,set04,set08,OS1,OS1,,"18. Typically, how many levels of jurisdictional hierarchy are there in the [q2o1answer] speaking society, beyond the local community?",Two levels,"We consider here the local level of elders or the village more broadly, and then beyond this the state-level jurisdiction. However, parallel to this there is also religious bodies which may also be involved in such rulings and decisions.",Hannah Gibson & Maarten Mous,OV,6,Scalar,Four levels,Three levels,Two levels,One level,No levels,NA,NA,NA,Gibson1Mous2,Rangi,Langi,lag,lang1320,Alagwa,Alagwa,wbj,alag1248,Langi - Alagwa,lag-wbj,lang1320-alag1248,South Africa,"FDG, OR"
1.0.0,set04,set08,OS2,OS2,,"19. Typically, how many levels of jurisdictional hierarchy are there in [q2o2answer] society, beyond the local community?",Two levels,"We consider here the local level of elders or the village more broadly, and then beyond this the state-level jurisdiction. However, parallel to this there is also religious bodies which may also be involved in such rulings and decisions.",Hannah Gibson & Maarten Mous,OV,6,Scalar,Four levels,Three levels,Two levels,One level,No levels,NA,NA,NA,Gibson1Mous2,Rangi,Langi,lag,lang1320,Alagwa,Alagwa,wbj,alag1248,Langi - Alagwa,lag-wbj,lang1320-alag1248,South Africa,"FDG, OR"
1.0.0,set04,set08,OS4,OS4,,"20. Which of the following best characterises the dominant form of the [q2o1answer] speaking group's mobility and sedentism, in regards to subsistence?",Sedentary,,Hannah Gibson & Maarten Mous,OV,6,Types,Sedentary,Mobile,Mixed,NA,NA,NA,NA,NA,Gibson1Mous2,Rangi,Langi,lag,lang1320,Alagwa,Alagwa,wbj,alag1248,Langi - Alagwa,lag-wbj,lang1320-alag1248,South Africa,"FDG, OR"
1.0.0,set04,set08,OS5,OS5,,"21. Which of the following best characterises the dominant form of the [q2o2answer] speaking group's mobility and sedentism, in regards to subsistence?",Sedentary,,Hannah Gibson & Maarten Mous,OV,6,Types,Sedentary,Mobile,Mixed,NA,NA,NA,NA,NA,Gibson1Mous2,Rangi,Langi,lag,lang1320,Alagwa,Alagwa,wbj,alag1248,Langi - Alagwa,lag-wbj,lang1320-alag1248,South Africa,"FDG, OR"
1.0.0,set04,set08,OS6,OS6,,22. The [q2o1answer] speaking society's subsistence pattern can be broadly characterised as... ,"Agricultural, Permanent",,Hannah Gibson & Maarten Mous,OV,6,Types,Hunter-gatherer,Fishing,Animal Husbadry,"Agricultural, casual","Agricultural, shifting","Agricultural, permanent",Highly Mixed,NA,Gibson1Mous2,Rangi,Langi,lag,lang1320,Alagwa,Alagwa,wbj,alag1248,Langi - Alagwa,lag-wbj,lang1320-alag1248,South Africa,"FDG, OR"
1.0.0,set04,set08,OH1,OH1,,"23. Have there been any natural disasters or major societal upheaval during the densest period of contact between the [q2o1answer] speaking and [q2o2answer] speaking people, such it impacted people's mobility, and [q2o1answer] speaking people talk about it?",Yes,,Hannah Gibson & Maarten Mous,OV,6,Binary-YesNo,Yes,No,NA,NA,NA,NA,NA,NA,Gibson1Mous2,Rangi,Langi,lag,lang1320,Alagwa,Alagwa,wbj,alag1248,Langi - Alagwa,lag-wbj,lang1320-alag1248,South Africa,"FDG, OR"
1.0.0,set04,set08,OE1,OE1,,24. How long time have you spent working with this community?,"Hannah Gibson - Working with the Rangi communities since approximately 2009 with more intense periods between 2009-2012. Working in Haubi and then later Kondoa and Dodoma.

Maarten Mous - 4 x 3-4 weeks 1989-2019 working in Kolo on Alagwa.",NA,Hannah Gibson & Maarten Mous,OV,6,Comment,NA,NA,NA,NA,NA,NA,NA,NA,Gibson1Mous2,Rangi,Langi,lag,lang1320,Alagwa,Alagwa,wbj,alag1248,Langi - Alagwa,lag-wbj,lang1320-alag1248,South Africa,"FDG, OR"
1.0.0,set04,set08,OE2,OE2,,25. Whom did you mostly interact with during your stay and through community-based research?,"Hannah Gibson - primarily adults who had received some formal education and also spoke Swahili. A mixture of men and women.

Maarten Mous - approx. 8 adults, 3 female and 5 male. And 3 young men. Most intense with 2 male adults.",NA,Hannah Gibson & Maarten Mous,OV,6,Comment,NA,NA,NA,NA,NA,NA,NA,NA,Gibson1Mous2,Rangi,Langi,lag,lang1320,Alagwa,Alagwa,wbj,alag1248,Langi - Alagwa,lag-wbj,lang1320-alag1248,South Africa,"FDG, OR"
1.0.0,set04,set08,OE3,OE3,,26. Was your interaction with members of the community typically mediated by one/a few person(s)? Who were they?,"Hannah Gibson - primarily one-on-one interactions for research purposes or interactions mediated by one other community member (research assistant). But then since I was living there for periods of time daily interactions were with a wider range of people.

Maarten Mous - one-to-one and small group interactions.",NA,Hannah Gibson & Maarten Mous,OV,6,Comment,NA,NA,NA,NA,NA,NA,NA,NA,Gibson1Mous2,Rangi,Langi,lag,lang1320,Alagwa,Alagwa,wbj,alag1248,Langi - Alagwa,lag-wbj,lang1320-alag1248,South Africa,"FDG, OR"
1.0.0,set04,set08,OC1,OC1,,27. How certain are you in your responses to the set of questions about each domain?,Somewhat certain,"For the questions based on our own assessment this is somewhat certain. However, some of the questions in this section are based on published data and figures for example.",Hannah Gibson & Maarten Mous,OV,6,Scalar,Very certain,Certain,Somewhat certain,Uncertain,Very uncertain,NA,NA,NA,Gibson1Mous2,Rangi,Langi,lag,lang1320,Alagwa,Alagwa,wbj,alag1248,Langi - Alagwa,lag-wbj,lang1320-alag1248,South Africa,"FDG, OR"
1.0.0,set04,set08,OC2,OC2,,28. How certain are you in your responses to the set of questions about social networks (The S-Set of questions)?,Certain,,Hannah Gibson & Maarten Mous,OV,6,Scalar,Very certain,Certain,Somewhat certain,Uncertain,Very uncertain,NA,NA,NA,Gibson1Mous2,Rangi,Langi,lag,lang1320,Alagwa,Alagwa,wbj,alag1248,Langi - Alagwa,lag-wbj,lang1320-alag1248,South Africa,"FDG, OR"
1.0.0,set04,set08,OC3,OC3,,29. How certain are you in your responses to the set of questions about attitudes and ideologies (The B-Set of questions)?,Somewhat certain,,Hannah Gibson & Maarten Mous,OV,6,Scalar,Very certain,Certain,Somewhat certain,Uncertain,Very uncertain,NA,NA,NA,Gibson1Mous2,Rangi,Langi,lag,lang1320,Alagwa,Alagwa,wbj,alag1248,Langi - Alagwa,lag-wbj,lang1320-alag1248,South Africa,"FDG, OR"
1.0.0,set04,set08,OC4,OC4,,30. How certain are you in your responses to the set of questions about language production (The O-Set of questions)?,Somewhat certain,,Hannah Gibson & Maarten Mous,OV,6,Scalar,Very certain,Certain,Somewhat certain,Uncertain,Very uncertain,NA,NA,NA,Gibson1Mous2,Rangi,Langi,lag,lang1320,Alagwa,Alagwa,wbj,alag1248,Langi - Alagwa,lag-wbj,lang1320-alag1248,South Africa,"FDG, OR"
1.0.0,set04,set08,OC5,OC5,,31. How certain are you in your responses to the set of questions about the languages spoken to the [q2o1answer] people (The I-Set of questions)?,Somewhat certain,,Hannah Gibson & Maarten Mous,OV,6,Scalar,Very certain,Certain,Somewhat certain,Uncertain,Very uncertain,NA,NA,NA,Gibson1Mous2,Rangi,Langi,lag,lang1320,Alagwa,Alagwa,wbj,alag1248,Langi - Alagwa,lag-wbj,lang1320-alag1248,South Africa,"FDG, OR"
1.0.0,set04,set08,OC6,OC6,,32. How certain are you in your responses to the set of questions about children (The T-Set of questions)?,Somewhat certain,,Hannah Gibson & Maarten Mous,OV,6,Scalar,Very certain,Certain,Somewhat certain,Uncertain,Very uncertain,NA,NA,NA,Gibson1Mous2,Rangi,Langi,lag,lang1320,Alagwa,Alagwa,wbj,alag1248,Langi - Alagwa,lag-wbj,lang1320-alag1248,South Africa,"FDG, OR"
1.0.0,set04,set08,P1,DEM00,,1. Has exchange ever been a relevant domain of contact between [q2o1answer] and [q2o2answer]?,No,,Hannah Gibson & Maarten Mous,DEM,2,Binary-YesNo,Yes,No,NA,NA,NA,NA,NA,NA,Gibson1Mous2,Rangi,Langi,lag,lang1320,Alagwa,Alagwa,wbj,alag1248,Langi - Alagwa,lag-wbj,lang1320-alag1248,South Africa,"FDG, OR"
1.0.0,set04,set08,P2,DEM0a,,3. How long have [q2o1answer] and [q2o2answer] people practised exchange for? ,NA,NA,Hannah Gibson & Maarten Mous,DEM,2,Comment,NA,NA,NA,NA,NA,NA,NA,NA,Gibson1Mous2,Rangi,Langi,lag,lang1320,Alagwa,Alagwa,wbj,alag1248,Langi - Alagwa,lag-wbj,lang1320-alag1248,South Africa,"FDG, OR"
1.0.0,set04,set08,P2N,DEM0aN,,"Coarse time range, numerical",NA,NA,Hannah Gibson & Maarten Mous,DEM,2,Value,NA,NA,NA,NA,NA,NA,NA,NA,Gibson1Mous2,Rangi,Langi,lag,lang1320,Alagwa,Alagwa,wbj,alag1248,Langi - Alagwa,lag-wbj,lang1320-alag1248,South Africa,"FDG, OR"
1.0.0,set04,set08,P3,DEM0b,,4. What is the time frame when the largest number of people had the most opportunities for interaction in exchange?,NA,NA,Hannah Gibson & Maarten Mous,DEM,2,Comment,NA,NA,NA,NA,NA,NA,NA,NA,Gibson1Mous2,Rangi,Langi,lag,lang1320,Alagwa,Alagwa,wbj,alag1248,Langi - Alagwa,lag-wbj,lang1320-alag1248,South Africa,"FDG, OR"
1.0.0,set04,set08,P3,DEM0bN,,"Coarse time range, numerical",NA,NA,Hannah Gibson & Maarten Mous,DEM,2,Value,NA,NA,NA,NA,NA,NA,NA,NA,Gibson1Mous2,Rangi,Langi,lag,lang1320,Alagwa,Alagwa,wbj,alag1248,Langi - Alagwa,lag-wbj,lang1320-alag1248,South Africa,"FDG, OR"
1.0.0,set04,set08,P4,DEM01,,"5. What other languages, if any, are spoken in this domain?",NA,NA,Hannah Gibson & Maarten Mous,DEM,2,Comment,NA,NA,NA,NA,NA,NA,NA,NA,Gibson1Mous2,Rangi,Langi,lag,lang1320,Alagwa,Alagwa,wbj,alag1248,Langi - Alagwa,lag-wbj,lang1320-alag1248,South Africa,"FDG, OR"
1.0.0,set04,set08,D1,DEM02,DEM02-1,6. Characteristic of the domain of Exchange. Is Exchange between [q2o1answer] and [q2o2answer] the individual’s initiative?,NA,NA,Hannah Gibson & Maarten Mous,DEM,2,Binary-YesNo,Yes,No,NA,NA,NA,NA,NA,NA,Gibson1Mous2,Rangi,Langi,lag,lang1320,Alagwa,Alagwa,wbj,alag1248,Langi - Alagwa,lag-wbj,lang1320-alag1248,South Africa,"FDG, OR"
1.0.0,set04,set08,D1,DEM02,DEM02-2,6. Characteristic of the domain of Exchange. Is Exchange between [q2o1answer] and [q2o2answer] an institutionalised procedure?,NA,NA,Hannah Gibson & Maarten Mous,DEM,2,Binary-YesNo,Yes,No,NA,NA,NA,NA,NA,NA,Gibson1Mous2,Rangi,Langi,lag,lang1320,Alagwa,Alagwa,wbj,alag1248,Langi - Alagwa,lag-wbj,lang1320-alag1248,South Africa,"FDG, OR"
1.0.0,set04,set08,D1,DEM02,DEM02-3,6. Characteristic of the domain of Exchange. Is Exchange between [q2o1answer] and [q2o2answer] part of a ceremonial event to which both communities participate?,NA,NA,Hannah Gibson & Maarten Mous,DEM,2,Binary-YesNo,Yes,No,NA,NA,NA,NA,NA,NA,Gibson1Mous2,Rangi,Langi,lag,lang1320,Alagwa,Alagwa,wbj,alag1248,Langi - Alagwa,lag-wbj,lang1320-alag1248,South Africa,"FDG, OR"
