Version,Set,Old_Set_ID,CID,QID,Sub-ID,Wording,Response,Comment,Respondent,Dom,DomOrder,DataType,Answer1,Answer2,Answer3,Answer4,Answer5,Answer6,Answer7,Answer8,Surname,[q2o1answer],FLang,F_ISO,F_Glottocode,[q2o2answer],NLang,N_ISO,N_Glottocode,ContactPair,ContactPair_ISO,ContactPair_Glottocode,AArea,Reviewer
1.0.0,set11,set01,P1,DLC00,,1. Has the local community ever been a relevant domain of contact between [q2o1answer] and [q2o2answer]?,No,"Mandinka are utterly and conspicuously absent in the loal sphere in Djibonker. In ten years of field stays there, amounting to more than two years of time altogether I have never met a Mandinka person, or heard the Mandinka language anywhere in the village. Considering that many of the spouses, escpecially the wives come from outside the village, and considering that Mandinka speaking areas are situated relatively close to Djibonker, this asks for an explanation. 
In the Myfyr Prys questionnaire, 12 of 14 participants replied to the question: ""Languages spoken by the worst friend for sons or daughters"" with 'Mandinka'. 11 of 14 replied to the question after 'worst spouse' with 'Mandinka'. None stated 'Mandinka' when asked after best spouse or best friend for son or daughter. The stigma attached to Mandinka seems to actively inhibit friendships and marriages. Apart from being generally considered as lazy, Mandinka also are frequently described as crooked and untrustworthy, to te extent that they are activley excluded from the local space. 
One of our project members brought a Mandinka-speaking spouse to an adjacent village and he was met by mistrust and hostility.  Religion does not seem to be the problem, as villagers marry and interact with Muslims, and often have Muslims in their families. I have witnessed Muslim Non-Mandinka strangers being welcomed without issues into the community and local spaces.",Alexander Cobbinah,DLC,3,Binary-YesNo,Yes,No,NA,NA,NA,NA,NA,NA,Cobbinah,Baïnounk Gubëeher,Bainounk Gubeeher,gube1234,gube1234,Mandinka,Mandinka,mnk,mand1436,Bainounk Gubeeher - Mandinka,gube1234-mnk,gube1234-mand1436,African Savannah,EK
1.0.0,set11,set01,P2,DLC0a,,2. How long have [q2o1answer] and [q2o2answer] people been in contact in the local community?,NA,,Alexander Cobbinah,DLC,3,Comment,NA,NA,NA,NA,NA,NA,NA,NA,Cobbinah,Baïnounk Gubëeher,Bainounk Gubeeher,gube1234,gube1234,Mandinka,Mandinka,mnk,mand1436,Bainounk Gubeeher - Mandinka,gube1234-mnk,gube1234-mand1436,African Savannah,EK
1.0.0,set11,set01,P2N,DLC0aN,,"Coarse time range, numerical",NA,NA,Alexander Cobbinah,DLC,3,Value,NA,NA,NA,NA,NA,NA,NA,NA,Cobbinah,Baïnounk Gubëeher,Bainounk Gubeeher,gube1234,gube1234,Mandinka,Mandinka,mnk,mand1436,Bainounk Gubeeher - Mandinka,gube1234-mnk,gube1234-mand1436,African Savannah,EK
1.0.0,set11,set01,P3,DLC0b,,3. What is the time frame when the largest number of people had the most opportunities for interaction in the local community?,NA,,Alexander Cobbinah,DLC,3,Comment,NA,NA,NA,NA,NA,NA,NA,NA,Cobbinah,Baïnounk Gubëeher,Bainounk Gubeeher,gube1234,gube1234,Mandinka,Mandinka,mnk,mand1436,Bainounk Gubeeher - Mandinka,gube1234-mnk,gube1234-mand1436,African Savannah,EK
1.0.0,set11,set01,P3N,DLC0bN,,"Coarse time range, numerical",NA,NA,Alexander Cobbinah,DLC,3,Value,NA,NA,NA,NA,NA,NA,NA,NA,Cobbinah,Baïnounk Gubëeher,Bainounk Gubeeher,gube1234,gube1234,Mandinka,Mandinka,mnk,mand1436,Bainounk Gubeeher - Mandinka,gube1234-mnk,gube1234-mand1436,African Savannah,EK
1.0.0,set11,set01,P4,DLC01,,"4. What other languages, if any, are spoken in the local community?",NA,,Alexander Cobbinah,DLC,3,Comment,NA,NA,NA,NA,NA,NA,NA,NA,Cobbinah,Baïnounk Gubëeher,Bainounk Gubeeher,gube1234,gube1234,Mandinka,Mandinka,mnk,mand1436,Bainounk Gubeeher - Mandinka,gube1234-mnk,gube1234-mand1436,African Savannah,EK
1.0.0,set11,set01,D1,DLC02,,5. Choose one of the following where [q2o1answer] people are most likely to speak in an unmonitored way.,NA,,Alexander Cobbinah,DLC,3,Types,Nuclear Family,Band,Neighbourhood or village,Town or city,Other,NA,NA,NA,Cobbinah,Baïnounk Gubëeher,Bainounk Gubeeher,gube1234,gube1234,Mandinka,Mandinka,mnk,mand1436,Bainounk Gubeeher - Mandinka,gube1234-mnk,gube1234-mand1436,African Savannah,EK
1.0.0,set11,set01,D6,DLC28,,6. Where do [q2o1answer] and [q2o2answer] people typically meet up in the local community?,NA,,Alexander Cobbinah,DLC,3,Types,At places which belong to the [q2o1answer],At places which belong to the [q2o2answer],At places which belong to some other group,This is highly contextual,NA,NA,NA,NA,Cobbinah,Baïnounk Gubëeher,Bainounk Gubeeher,gube1234,gube1234,Mandinka,Mandinka,mnk,mand1436,Bainounk Gubeeher - Mandinka,gube1234-mnk,gube1234-mand1436,African Savannah,EK
1.0.0,set11,set01,D11,DLC27,,7. How much influence can the [q2o1answer] exert over [q2o2answer] in the activities of the local community?,NA,,Alexander Cobbinah,DLC,3,Scalar,Influence is practically always exerted,Influence is very much exerted,Influence is somewhat exerted,Influence is exerted very little,Influence is practically never exerted,NA,NA,NA,Cobbinah,Baïnounk Gubëeher,Bainounk Gubeeher,gube1234,gube1234,Mandinka,Mandinka,mnk,mand1436,Bainounk Gubeeher - Mandinka,gube1234-mnk,gube1234-mand1436,African Savannah,EK
1.0.0,set11,set01,D3,DLC25,DLC25-1,"8. Involvement in the Local Community. Does involvement in the local community differ based on hierarchies associated to profession or wealth, such as a person's class and caste?",NA,,Alexander Cobbinah,DLC,3,Binary-YesNo,Yes,No,NA,NA,NA,NA,NA,NA,Cobbinah,Baïnounk Gubëeher,Bainounk Gubeeher,gube1234,gube1234,Mandinka,Mandinka,mnk,mand1436,Bainounk Gubeeher - Mandinka,gube1234-mnk,gube1234-mand1436,African Savannah,EK
1.0.0,set11,set01,D3,DLC25,DLC25-2,"8. Involvement in the Local Community. Does involvement in the local community differ based on whether a person belongs to some magico-religiously sanctioned group, such as religious denomination?",NA,,Alexander Cobbinah,DLC,3,Binary-YesNo,Yes,No,NA,NA,NA,NA,NA,NA,Cobbinah,Baïnounk Gubëeher,Bainounk Gubeeher,gube1234,gube1234,Mandinka,Mandinka,mnk,mand1436,Bainounk Gubeeher - Mandinka,gube1234-mnk,gube1234-mand1436,African Savannah,EK
1.0.0,set11,set01,D3,DLC25,DLC25-3,"8. Involvement in the Local Community. Does involvement in the local community differ based on a person's descent group, such as clan, house, lineage group, kinship group?",NA,,Alexander Cobbinah,DLC,3,Binary-YesNo,Yes,No,NA,NA,NA,NA,NA,NA,Cobbinah,Baïnounk Gubëeher,Bainounk Gubeeher,gube1234,gube1234,Mandinka,Mandinka,mnk,mand1436,Bainounk Gubeeher - Mandinka,gube1234-mnk,gube1234-mand1436,African Savannah,EK
1.0.0,set11,set01,D3,DLC25,DLC25-4,"8. Involvement in the Local Community. Does involvement in the local community differ based on a person’s group of land ownership, such as tribe, clan, territorial group?",NA,,Alexander Cobbinah,DLC,3,Binary-YesNo,Yes,No,NA,NA,NA,NA,NA,NA,Cobbinah,Baïnounk Gubëeher,Bainounk Gubeeher,gube1234,gube1234,Mandinka,Mandinka,mnk,mand1436,Bainounk Gubeeher - Mandinka,gube1234-mnk,gube1234-mand1436,African Savannah,EK
1.0.0,set11,set01,D3,DLC25,DLC25-5,"8. Involvement in the Local Community. Does involvement in the local community differ based on a person’s race, ethnicity, or some other similar grouping?",NA,,Alexander Cobbinah,DLC,3,Binary-YesNo,Yes,No,NA,NA,NA,NA,NA,NA,Cobbinah,Baïnounk Gubëeher,Bainounk Gubeeher,gube1234,gube1234,Mandinka,Mandinka,mnk,mand1436,Bainounk Gubeeher - Mandinka,gube1234-mnk,gube1234-mand1436,African Savannah,EK
1.0.0,set11,set01,D3,DLC25,DLC25-6,8. Involvement in the Local Community. Does involvement in the local community differ based on a person’s age or life stage?,NA,,Alexander Cobbinah,DLC,3,Binary-YesNo,Yes,No,NA,NA,NA,NA,NA,NA,Cobbinah,Baïnounk Gubëeher,Bainounk Gubeeher,gube1234,gube1234,Mandinka,Mandinka,mnk,mand1436,Bainounk Gubeeher - Mandinka,gube1234-mnk,gube1234-mand1436,African Savannah,EK
1.0.0,set11,set01,D3,DLC25,DLC25-7,8. Involvement in the Local Community. Does involvement in the local community differ based on a person’s place identity and affiliation?,NA,,Alexander Cobbinah,DLC,3,Binary-YesNo,Yes,No,NA,NA,NA,NA,NA,NA,Cobbinah,Baïnounk Gubëeher,Bainounk Gubeeher,gube1234,gube1234,Mandinka,Mandinka,mnk,mand1436,Bainounk Gubeeher - Mandinka,gube1234-mnk,gube1234-mand1436,African Savannah,EK
1.0.0,set11,set01,D3,DLC25,DLC25-8,8. Involvement in the Local Community. Does involvement in the local community differ based on a person’s sex or gender?,NA,,Alexander Cobbinah,DLC,3,Binary-YesNo,Yes,No,NA,NA,NA,NA,NA,NA,Cobbinah,Baïnounk Gubëeher,Bainounk Gubeeher,gube1234,gube1234,Mandinka,Mandinka,mnk,mand1436,Bainounk Gubeeher - Mandinka,gube1234-mnk,gube1234-mand1436,African Savannah,EK
1.0.0,set11,set01,D3,DLC25,DLC25-9,8. Involvement in the Local Community. Does involvement in the local community differ based on any other communities of practice?,NA,,Alexander Cobbinah,DLC,3,Binary-YesNo,Yes,No,NA,NA,NA,NA,NA,NA,Cobbinah,Baïnounk Gubëeher,Bainounk Gubeeher,gube1234,gube1234,Mandinka,Mandinka,mnk,mand1436,Bainounk Gubeeher - Mandinka,gube1234-mnk,gube1234-mand1436,African Savannah,EK
1.0.0,set11,set01,D10,DLC29,,9. Do [q2o1answer] people experience the local community differently depending on social group?,NA,,Alexander Cobbinah,DLC,3,Binary-YesNo,Yes,No,NA,NA,NA,NA,NA,NA,Cobbinah,Baïnounk Gubëeher,Bainounk Gubeeher,gube1234,gube1234,Mandinka,Mandinka,mnk,mand1436,Bainounk Gubeeher - Mandinka,gube1234-mnk,gube1234-mand1436,African Savannah,EK
1.0.0,set11,set01,S1,DLC16,,10. How often do [q2o1answer] people interact with [q2o2answer] people in the local community?,NA,,Alexander Cobbinah,DLC,3,Scalar,Very often,Often,Sometimes,Rarely,Very rarely,NA,NA,NA,Cobbinah,Baïnounk Gubëeher,Bainounk Gubeeher,gube1234,gube1234,Mandinka,Mandinka,mnk,mand1436,Bainounk Gubeeher - Mandinka,gube1234-mnk,gube1234-mand1436,African Savannah,EK
1.0.0,set11,set01,S3,DLC15,,11. How many people are typically involved in interactions between [q2o1answer] people and [q2o2answer] people in the local community?,NA,,Alexander Cobbinah,DLC,3,Scalar,Interactions are practically always under 5 people,Interactions are often under 5 people,Interactions are sometimes under 5 people,Interactions are rarely under 5 people,Interactions are practically never under 5 people,NA,NA,NA,Cobbinah,Baïnounk Gubëeher,Bainounk Gubeeher,gube1234,gube1234,Mandinka,Mandinka,mnk,mand1436,Bainounk Gubeeher - Mandinka,gube1234-mnk,gube1234-mand1436,African Savannah,EK
1.0.0,set11,set01,S4,DLC05,,12. How physically proximate to each other are people in the local community?,NA,,Alexander Cobbinah,DLC,3,Scalar,Very proximate to each other,Proximate to each other,Somewhat proximate to each other,Far from each other,Very far from each other,NA,NA,NA,Cobbinah,Baïnounk Gubëeher,Bainounk Gubeeher,gube1234,gube1234,Mandinka,Mandinka,mnk,mand1436,Bainounk Gubeeher - Mandinka,gube1234-mnk,gube1234-mand1436,African Savannah,EK
1.0.0,set11,set01,S5,DLC14,,13. How would you rate the overall relationship between [q2o1answer] and [q2o2answer] people in the local community?,NA,,Alexander Cobbinah,DLC,3,Scalar,Friendly,Somewhat friendly,Neutral,Somewhat hostile,Hostile,NA,NA,NA,Cobbinah,Baïnounk Gubëeher,Bainounk Gubeeher,gube1234,gube1234,Mandinka,Mandinka,mnk,mand1436,Bainounk Gubeeher - Mandinka,gube1234-mnk,gube1234-mand1436,African Savannah,EK
1.0.0,set11,set01,S6,DLC32,,"14. What is the proportion of total [q2o1answer] people who have opportunities for contact with [q2o2answer] people, in the form of local communities?",NA,,Alexander Cobbinah,DLC,3,Scalar,Almost everyone,Many people,Some people,Few people,Practically no one,NA,NA,NA,Cobbinah,Baïnounk Gubëeher,Bainounk Gubeeher,gube1234,gube1234,Mandinka,Mandinka,mnk,mand1436,Bainounk Gubeeher - Mandinka,gube1234-mnk,gube1234-mand1436,African Savannah,EK
1.0.0,set11,set01,S7,DLC33,,"15. What is the proportion of total [q2o2answer] people who have opportunities for contact with [q2o1answer] people, in the form of local communities?",NA,,Alexander Cobbinah,DLC,3,Scalar,Almost everyone,Many people,Some people,Few people,Practically no one,NA,NA,NA,Cobbinah,Baïnounk Gubëeher,Bainounk Gubeeher,gube1234,gube1234,Mandinka,Mandinka,mnk,mand1436,Bainounk Gubeeher - Mandinka,gube1234-mnk,gube1234-mand1436,African Savannah,EK
1.0.0,set11,set01,BA,DLC18,,16. What is the overall attitude that [q2o1answer] people have towards [q2o2answer] people in the local community?,NA,,Alexander Cobbinah,DLC,3,Scalar,Very positive,Positive,Neutral,Negative,Very negative,NA,NA,NA,Cobbinah,Baïnounk Gubëeher,Bainounk Gubeeher,gube1234,gube1234,Mandinka,Mandinka,mnk,mand1436,Bainounk Gubeeher - Mandinka,gube1234-mnk,gube1234-mand1436,African Savannah,EK
1.0.0,set11,set01,BH,DLC19,,"17. How do [q2o1answer] people view themselves overall in relation to [q2o2answer] people, in the context of the local community?",NA,,Alexander Cobbinah,DLC,3,Scalar,[q2o1answer] see themselves as very superior to [q2o2answer],[q2o1answer] see themselves as superior to [q2o2answer],[q2o1answer] see themselves as neither superior nor inferior to [q2o2answer],[q2o1answer] see themselves as inferior to [q2o2answer],[q2o1answer] see themselves as very inferior to [q2o2answer],NA,NA,NA,Cobbinah,Baïnounk Gubëeher,Bainounk Gubeeher,gube1234,gube1234,Mandinka,Mandinka,mnk,mand1436,Bainounk Gubeeher - Mandinka,gube1234-mnk,gube1234-mand1436,African Savannah,EK
1.0.0,set11,set01,BI,DLC04,,18. What language do [q2o1answer] people expect to be used with [q2o2answer] people in the local community?,NA,,Alexander Cobbinah,DLC,3,Types,The [q2o1answer] language,The [q2o2answer] language,Some other language,This is highly contextual,NA,NA,NA,NA,Cobbinah,Baïnounk Gubëeher,Bainounk Gubeeher,gube1234,gube1234,Mandinka,Mandinka,mnk,mand1436,Bainounk Gubeeher - Mandinka,gube1234-mnk,gube1234-mand1436,African Savannah,EK
1.0.0,set11,set01,O1,DLC11,,19. What language do [q2o1answer] people typically speak with [q2o2answer] people in the local community?,NA,,Alexander Cobbinah,DLC,3,Types,The [q2o1answer] language,The [q2o2answer] language,Some other language,This is highly contextual,NA,NA,NA,NA,Cobbinah,Baïnounk Gubëeher,Bainounk Gubeeher,gube1234,gube1234,Mandinka,Mandinka,mnk,mand1436,Bainounk Gubeeher - Mandinka,gube1234-mnk,gube1234-mand1436,African Savannah,EK
1.0.0,set11,set01,O2,DLC12,,20. Do [q2o1answer] people typically simplify their language when speaking with [q2o2answer] people in the local community?,NA,,Alexander Cobbinah,DLC,3,Types,Yes,No,This is highly contextual,NA,NA,NA,NA,NA,Cobbinah,Baïnounk Gubëeher,Bainounk Gubeeher,gube1234,gube1234,Mandinka,Mandinka,mnk,mand1436,Bainounk Gubeeher - Mandinka,gube1234-mnk,gube1234-mand1436,African Savannah,EK
1.0.0,set11,set01,O3,DLC13,,"21. Typically in the local community, how fluently do [q2o1answer] people speak the [q2o2answer] language?",NA,,Alexander Cobbinah,DLC,3,Scalar,Very fluently,Fluently,Somewhat fluently,A little fluently,Not fluently at all,NA,NA,NA,Cobbinah,Baïnounk Gubëeher,Bainounk Gubeeher,gube1234,gube1234,Mandinka,Mandinka,mnk,mand1436,Bainounk Gubeeher - Mandinka,gube1234-mnk,gube1234-mand1436,African Savannah,EK
1.0.0,set11,set01,I1,DLC09,,22. What language do [q2o2answer] people typically speak with [q2o1answer] people in the local community?,NA,,Alexander Cobbinah,DLC,3,Types,The [q2o1answer] language,The [q2o2answer] language,Some other language,This is highly contextual,NA,NA,NA,NA,Cobbinah,Baïnounk Gubëeher,Bainounk Gubeeher,gube1234,gube1234,Mandinka,Mandinka,mnk,mand1436,Bainounk Gubeeher - Mandinka,gube1234-mnk,gube1234-mand1436,African Savannah,EK
1.0.0,set11,set01,I2,DLC10,,"23. Typically in the local community, how well do [q2o1answer] people understand the [q2o2answer] language?",NA,,Alexander Cobbinah,DLC,3,Scalar,Very well,Well,Somewhat,Poorly,Very poorly,NA,NA,NA,Cobbinah,Baïnounk Gubëeher,Bainounk Gubeeher,gube1234,gube1234,Mandinka,Mandinka,mnk,mand1436,Bainounk Gubeeher - Mandinka,gube1234-mnk,gube1234-mand1436,African Savannah,EK
1.0.0,set11,set01,T1,DLC31,,24. How much do [q2o1answer] children participate in the activities of the local community?,NA,,Alexander Cobbinah,DLC,3,Scalar,They practically always participate,They participate a lot,They participate somewhat,They participate a little,They practically never participate,NA,NA,NA,Cobbinah,Baïnounk Gubëeher,Bainounk Gubeeher,gube1234,gube1234,Mandinka,Mandinka,mnk,mand1436,Bainounk Gubeeher - Mandinka,gube1234-mnk,gube1234-mand1436,African Savannah,EK
1.0.0,set11,set01,T6,DLC03,DLC03-1,"25. Looking after children in the local community. Typically, do adults other than the parents look after children up to five year of age in the local community?",NA,,Alexander Cobbinah,DLC,3,Binary-YesNo,Yes,No,NA,NA,NA,NA,NA,NA,Cobbinah,Baïnounk Gubëeher,Bainounk Gubeeher,gube1234,gube1234,Mandinka,Mandinka,mnk,mand1436,Bainounk Gubeeher - Mandinka,gube1234-mnk,gube1234-mand1436,African Savannah,EK
1.0.0,set11,set01,T6,DLC03,DLC03-2,"25. Looking after children in the local community. Typically, do parents look after children up to five year of age in the local community?",NA,,Alexander Cobbinah,DLC,3,Binary-YesNo,Yes,No,NA,NA,NA,NA,NA,NA,Cobbinah,Baïnounk Gubëeher,Bainounk Gubeeher,gube1234,gube1234,Mandinka,Mandinka,mnk,mand1436,Bainounk Gubeeher - Mandinka,gube1234-mnk,gube1234-mand1436,African Savannah,EK
1.0.0,set11,set01,T6,DLC03,DLC03-3,"25. Looking after children in the local community. Typically, do children from sibling-kin groups look after children up to five year of age in local community?",NA,,Alexander Cobbinah,DLC,3,Binary-YesNo,Yes,No,NA,NA,NA,NA,NA,NA,Cobbinah,Baïnounk Gubëeher,Bainounk Gubeeher,gube1234,gube1234,Mandinka,Mandinka,mnk,mand1436,Bainounk Gubeeher - Mandinka,gube1234-mnk,gube1234-mand1436,African Savannah,EK
1.0.0,set11,set01,T6,DLC03,DLC03-4,"25. Looking after children in the local community. Typically, do children up to five year of age look after each other as part of the same peer group in the local community?",NA,,Alexander Cobbinah,DLC,3,Binary-YesNo,Yes,No,NA,NA,NA,NA,NA,NA,Cobbinah,Baïnounk Gubëeher,Bainounk Gubeeher,gube1234,gube1234,Mandinka,Mandinka,mnk,mand1436,Bainounk Gubeeher - Mandinka,gube1234-mnk,gube1234-mand1436,African Savannah,EK
1.0.0,set11,set01,T11,DLC20,,"26. Typically in the local community, how much supervision do adults provide to children’s own activities, such as playing?",NA,,Alexander Cobbinah,DLC,3,Scalar,Constant supervision,A lot of supervision,Some supervision,Little supervision,No supervision at all,NA,NA,NA,Cobbinah,Baïnounk Gubëeher,Bainounk Gubeeher,gube1234,gube1234,Mandinka,Mandinka,mnk,mand1436,Bainounk Gubeeher - Mandinka,gube1234-mnk,gube1234-mand1436,African Savannah,EK
1.0.0,set11,set01,T2,DLC21,,27. What language do [q2o2answer] adults typically speak to a [q2o1answer] children?,NA,,Alexander Cobbinah,DLC,3,Types,The [q2o1answer] language,The [q2o2answer] language,Some other language,This is highly contextual,NA,NA,NA,NA,Cobbinah,Baïnounk Gubëeher,Bainounk Gubeeher,gube1234,gube1234,Mandinka,Mandinka,mnk,mand1436,Bainounk Gubeeher - Mandinka,gube1234-mnk,gube1234-mand1436,African Savannah,EK
1.0.0,set11,set01,T4,DLC22,,"28. Typically, what language do [q2o1answer] children from four/five year of age prefer to speak with [q2o2answer] adults?",NA,,Alexander Cobbinah,DLC,3,Types,The [q2o1answer] language,The [q2o2answer] language,Some other language,This is highly contextual,NA,NA,NA,NA,Cobbinah,Baïnounk Gubëeher,Bainounk Gubeeher,gube1234,gube1234,Mandinka,Mandinka,mnk,mand1436,Bainounk Gubeeher - Mandinka,gube1234-mnk,gube1234-mand1436,African Savannah,EK
1.0.0,set11,set01,T5,DLC23,,"29. Typically, what language would a [q2o1answer] child speak to [q2o2answer] children in the local community?",NA,,Alexander Cobbinah,DLC,3,Types,[q2o1answer] children do not interact with [q2o2answer] children],The [q2o1answer] language,The [q2o2answer] language,Some other language,This is highly contextual,NA,NA,NA,Cobbinah,Baïnounk Gubëeher,Bainounk Gubeeher,gube1234,gube1234,Mandinka,Mandinka,mnk,mand1436,Bainounk Gubeeher - Mandinka,gube1234-mnk,gube1234-mand1436,African Savannah,EK
1.0.0,set11,set01,E1,DLC96,,"30. List any other groups that the [q2o1answer] formed local communities with in the past, in so far as you believe this had linguistic consequences for the [q2o1answer] language. Where possible, please also give an indication of when this happened.",NA,NA,Alexander Cobbinah,DLC,3,Comment,NA,NA,NA,NA,NA,NA,NA,NA,Cobbinah,Baïnounk Gubëeher,Bainounk Gubeeher,gube1234,gube1234,Mandinka,Mandinka,mnk,mand1436,Bainounk Gubeeher - Mandinka,gube1234-mnk,gube1234-mand1436,African Savannah,EK
1.0.0,set11,set01,E4,DLC97,,"31. What type of data informed your answers to the questions in the domain of local community, overall?",NA,NA,Alexander Cobbinah,DLC,3,TypesMultiple,Impressions from my own fieldwork with the exact or related community,Reports from language consultants,Published or ongoing research project of my own on topics covered in this questionnaire,Published material by linguists,Published materials by other researchers in other fields,Other,NA,NA,Cobbinah,Baïnounk Gubëeher,Bainounk Gubeeher,gube1234,gube1234,Mandinka,Mandinka,mnk,mand1436,Bainounk Gubeeher - Mandinka,gube1234-mnk,gube1234-mand1436,African Savannah,EK
1.0.0,set11,set01,E5,DLC98,,32. How certain are you in your responses for the domain of local community?,NA,NA,Alexander Cobbinah,DLC,3,Scalar,Very certain,Certain,Somewhat certain,Uncertain,Very uncertain,NA,NA,NA,Cobbinah,Baïnounk Gubëeher,Bainounk Gubeeher,gube1234,gube1234,Mandinka,Mandinka,mnk,mand1436,Bainounk Gubeeher - Mandinka,gube1234-mnk,gube1234-mand1436,African Savannah,EK
1.0.0,set11,set01,E6,DLC99,,33. List any comments or notes that you feel are relevant to this section of the questionnaire.,NA,NA,Alexander Cobbinah,DLC,3,Comment,NA,NA,NA,NA,NA,NA,NA,NA,Cobbinah,Baïnounk Gubëeher,Bainounk Gubeeher,gube1234,gube1234,Mandinka,Mandinka,mnk,mand1436,Bainounk Gubeeher - Mandinka,gube1234-mnk,gube1234-mand1436,African Savannah,EK
1.0.0,set11,set01,P1,DKN00,,1. Have [q2o1answer] and [q2o2answer] people occupied the same spaces of knowledge transfer together?,No,"Knowledge transfer in the religious and cultural spheres provides few regular opportunities of contact between Baïnounk Gubëeher and Mandinka in the current setting. I cannot make assumptions about the past, although due to the spacial proximity some form of knowlege exchange most probably has taken place at some point. 
 The people of Djibonker are deeply integrated into Joola-speaking networks (Joola Kaasa, Joola Fogny, Joola Kujireray, Bayot) and marginally into Creole speaking networks. The overwelming majority is either Catholic, of local religion or both, whereas most speakers of Mandinka, or who identify as such are Muslim. The prohibition of alcohol in Islam is seen as a major obstacle to participation in cultural events by many Baïnounk Gubëeher and surrounding Joola, due to the fact that many rites involve the consumption of palmwine. Probably more detrimental to Baïnounk Gubëeher/Mandinka cultural integration is the widespread assumption that Mandinka language and culture dominates those who they 'colonize', leading to rapid language shift, name change and islamization. Often interviewees have accused other Baïnounk groups of being inauthentic due to Mandinka influence, and speaking 'impure' varieties of Baïnounk languages. This is of course anecdotal - citing emblematic but isolated items of vocabulary - and does not reflect real outcomes of language contact. More than anything it illustrates the perceived polluting capacity of Mandinka language and culture in the eyes of speakers of Baïnounk Gubëeher. It is ignored that Baïnounk Gubëeher also uses Mandinka loans and shows a heavy influence of local Joola varieties, which in turn is not considered as polluting or diluting real 'Bainounkness'.
 One participant as much as urged me to not quote Mandinka as one of the languages she speaks, because as she said, she has learned the language in her youth cohabiting with Mandinka, and understands it, but will never speak it again, because she wants nothing to do with Mandinka and hates everything to do with them. She also reported the common stereotype that Mandinka refuse to speak other languages and force everyone else to speak Mandinka, an act of utter rudeness in the eyes of the highly multilingual and adaptive Baïnounk Gubëeher.
 When asked about what language the 'worst teacher' would speak, only one person in 14 did not say 'Mandinka', which reflects the unwillingness to enter into situations of knowledge exchange with anyone perceived as Mandinka.
 Somehow Mandinka have taken the role of social and cultural nemesis, laden with negative stereotype and actively excluded from the social and cultural sphere, due to fears of cultural takeover and pollution as well as deviant behaviour in terms of work ethics.",Alexander Cobbinah,DKN,4,Binary-YesNo,Yes,No,NA,NA,NA,NA,NA,NA,Cobbinah,Baïnounk Gubëeher,Bainounk Gubeeher,gube1234,gube1234,Mandinka,Mandinka,mnk,mand1436,Bainounk Gubeeher - Mandinka,gube1234-mnk,gube1234-mand1436,African Savannah,EK
1.0.0,set11,set01,P2,DKN0a,,2. How long have [q2o1answer] and [q2o2answer] people been involved in the knowledge domain together for?,NA,,Alexander Cobbinah,DKN,4,Comment,NA,NA,NA,NA,NA,NA,NA,NA,Cobbinah,Baïnounk Gubëeher,Bainounk Gubeeher,gube1234,gube1234,Mandinka,Mandinka,mnk,mand1436,Bainounk Gubeeher - Mandinka,gube1234-mnk,gube1234-mand1436,African Savannah,EK
