Version,Set,Old_Set_ID,CID,QID,Sub-ID,Wording,Response,Comment,Respondent,Dom,DomOrder,DataType,Answer1,Answer2,Answer3,Answer4,Answer5,Answer6,Answer7,Answer8,Surname,[q2o1answer],FLang,F_ISO,F_Glottocode,[q2o2answer],NLang,N_ISO,N_Glottocode,ContactPair,ContactPair_ISO,ContactPair_Glottocode,AArea,Reviewer
1.0.0,set11,set01,OT1,OT1,,1. How long have [q2o1answer] and [q2o2answer] people been in contact overall?,In recent times probably very little.,Even though social contact is generally avoided and there are no Mandinka identifying persons in the village speakers of GB would eventually come into contact with Mandinka speakers. For example those GB speakers who live in Ziguinchor or who visit people in other villages where Mandinka is spoken.,Alexander Cobbinah,OV,6,Comment,NA,NA,NA,NA,NA,NA,NA,NA,Cobbinah,Baïnounk Gubëeher,Bainounk Gubeeher,gube1234,gube1234,Mandinka,Mandinka,mnk,mand1436,Bainounk Gubeeher - Mandinka,gube1234-mnk,gube1234-mand1436,African Savannah,EK
1.0.0,set11,set01,OT1N,OT1N,,"Coarse time range, numerical",1500-2020,NA,Alexander Cobbinah,OV,6,Value,NA,NA,NA,NA,NA,NA,NA,NA,Cobbinah,Baïnounk Gubëeher,Bainounk Gubeeher,gube1234,gube1234,Mandinka,Mandinka,mnk,mand1436,Bainounk Gubeeher - Mandinka,gube1234-mnk,gube1234-mand1436,African Savannah,EK
1.0.0,set11,set01,OT2,OT2,,2. What is the overall time frame when the largest number of people had the most opportunities for interaction?,No information available,,Alexander Cobbinah,OV,6,Comment,NA,NA,NA,NA,NA,NA,NA,NA,Cobbinah,Baïnounk Gubëeher,Bainounk Gubeeher,gube1234,gube1234,Mandinka,Mandinka,mnk,mand1436,Bainounk Gubeeher - Mandinka,gube1234-mnk,gube1234-mand1436,African Savannah,EK
1.0.0,set11,set01,OT2N,OT2N,,"Coarse time range, numerical",1500-2020,"[Given the response that “no information is available, we have copied the estimated overall contact period OT1N]",Alexander Cobbinah,OV,6,Value,NA,NA,NA,NA,NA,NA,NA,NA,Cobbinah,Baïnounk Gubëeher,Bainounk Gubeeher,gube1234,gube1234,Mandinka,Mandinka,mnk,mand1436,Bainounk Gubeeher - Mandinka,gube1234-mnk,gube1234-mand1436,African Savannah,EK
1.0.0,set11,set01,OD1,OD1,,1. What is the total number of native-like speakers of [q2o1answer]?,100-999 speakers,"The village has about 700 inhabitants, I would guess that maybe 500 identify as and speak Baïnounk Gubëeher. Many members of the 'diaspora' who live in Dakar or Ziguinchor also speak the language. I would put the number of speakers between at least 800, at most 1.500.",Alexander Cobbinah,OV,6,Types,10-99 speakers,100-999 speakers,"1,000-9,999 speakers","10,000-99,999 speakers","100,000-999,999 speakers","1,000,000-9,999,999 speakers","10,000,000-99,999,999 speakers","100,000,000-999,999,999 speakers",Cobbinah,Baïnounk Gubëeher,Bainounk Gubeeher,gube1234,gube1234,Mandinka,Mandinka,mnk,mand1436,Bainounk Gubeeher - Mandinka,gube1234-mnk,gube1234-mand1436,African Savannah,EK
1.0.0,set11,set01,OD3,OD3,,2. What is the total number of native-like speakers of [q2o2answer]?,"1,000,000-9,999,999 speakers","According to ethnologue.com: 888,000 in Senegal (2017). Total users in all countries: 1,949,000.",Alexander Cobbinah,OV,6,Types,10-99 speakers,100-999 speakers,"1,000-9,999 speakers","10,000-99,999 speakers","100,000-999,999 speakers","1,000,000-9,999,999 speakers","10,000,000-99,999,999 speakers","100,000,000-999,999,999 speakers",Cobbinah,Baïnounk Gubëeher,Bainounk Gubeeher,gube1234,gube1234,Mandinka,Mandinka,mnk,mand1436,Bainounk Gubeeher - Mandinka,gube1234-mnk,gube1234-mand1436,African Savannah,EK
1.0.0,set11,set01,OD4,OD4,,3. What is the approximate proportion of native-like speakers in the total population of all speakers of [q2o1answer]?,60–80%,"Some people who identify as Baïnounk Gubëeher but grew up in an urban environment (mostly Dakar) do not speak the language, probably almost all who grew up in the village do have native command of the language. Some young children are brought up in Wolof and it is unclear so far whether they will acquire Baïnounk Gubëeher, but I think this to be probable.",Alexander Cobbinah,OV,6,Scalar,High proportion,Fairly high proportion,Intermediate proportion,Fairly low proportion,Low proportion,NA,NA,NA,Cobbinah,Baïnounk Gubëeher,Bainounk Gubeeher,gube1234,gube1234,Mandinka,Mandinka,mnk,mand1436,Bainounk Gubeeher - Mandinka,gube1234-mnk,gube1234-mand1436,African Savannah,EK
1.0.0,set11,set01,OD5,OD5,,4. What is the approximate proportion of native-like speakers in the total population of all speakers of [q2o2answer]?,Fairly high proportion,"Mandinka is one of the lingua francas of Casamance and Gambia, so I would assume that not only those who identify as Mandinka speak the language but also hundreds of thousands of non-Mandinka have native command, plus an amount of second language learners who have some notion of the language.",Alexander Cobbinah,OV,6,Scalar,High proportion,Fairly high proportion,Intermediate proportion,Fairly low proportion,Low proportion,NA,NA,NA,Cobbinah,Baïnounk Gubëeher,Bainounk Gubeeher,gube1234,gube1234,Mandinka,Mandinka,mnk,mand1436,Bainounk Gubeeher - Mandinka,gube1234-mnk,gube1234-mand1436,African Savannah,EK
1.0.0,set11,set01,OG1,OG1,,5. What is the population density within the area where [q2o1answer] is spoken?,B,"The internet says, 1.5million people on 28000 sqkm. Id assume population might have increased a bit in the last ten years.",Alexander Cobbinah,OV,6,Types,Less than 2 persons per 10 sq. km,2–4 persons per 10 sq. km,5–19 persons per 10 sq. km,20–99 persons per 10 sq. km,100–399 persons per 10 sq. km,NA,NA,NA,Cobbinah,Baïnounk Gubëeher,Bainounk Gubeeher,gube1234,gube1234,Mandinka,Mandinka,mnk,mand1436,Bainounk Gubeeher - Mandinka,gube1234-mnk,gube1234-mand1436,African Savannah,EK
1.0.0,set11,set01,OS7,OS7,,6. What is the mean size of the [q2o1answer] speaking communities at the local level?,"From 400 to 1,000 persons","Baïnounk Gubëeher is spoken mainly in Djibonker, with less than a thousand inhabitants. Other villages and towns in Casamance have small communities of speakers who usually know each others and use the language in private communication. Same holds for certain boroughs of Dakar where Casamance emigre̒s cluster.",Alexander Cobbinah,OV,6,Types,Fewer than 50 persons,From 50 to 99 persons,From 100 to 199 persons,From 200 to 399 persons,"From 400 to 1,000 persons","More than 1,000 persons in the absence of indigenous urban aggregations","One or more indigenous towns of more than 5,000 inhabitants but none of more than 50,000",NA,Cobbinah,Baïnounk Gubëeher,Bainounk Gubeeher,gube1234,gube1234,Mandinka,Mandinka,mnk,mand1436,Bainounk Gubeeher - Mandinka,gube1234-mnk,gube1234-mand1436,African Savannah,EK
1.0.0,set11,set01,OS9,OS9,,7. How frequently do [q2o1answer] people generally interact with out-group people? ,Neither frequently nor infrequently,"Hard to tell, some people I know mostly stay within the village and interact mostly with their established in-groups, such as family, neighbours, friends etc. However, some of the villagers have jobs outside of the village (in Ziguinchor or seaside resorts 70km away) where they interact with persons in public, or they travel, frequent bars, festivities etc. Djibonker is connected to the seachore and close-by Ziguinchor, quite a large city, by a very smooth tarmac road with frequent public transport, so the community is not in any way isolated.",Alexander Cobbinah,OV,6,Scalar,Very Frequently,Frequently,Neither frequently nor infrequently,Infrequently,Very infrequently,NA,NA,NA,Cobbinah,Baïnounk Gubëeher,Bainounk Gubeeher,gube1234,gube1234,Mandinka,Mandinka,mnk,mand1436,Bainounk Gubeeher - Mandinka,gube1234-mnk,gube1234-mand1436,African Savannah,EK
1.0.0,set11,set01,OI1,OI1,OI1-1,"8. Is [q2o1answer] stated as an expression of identity of any of the following? Group centered around shared descent, such as clan, house, lineage group, kinship group",Yes,,Alexander Cobbinah,OV,6,Binary-YesNo,Yes,No,NA,NA,NA,NA,NA,NA,Cobbinah,Baïnounk Gubëeher,Bainounk Gubeeher,gube1234,gube1234,Mandinka,Mandinka,mnk,mand1436,Bainounk Gubeeher - Mandinka,gube1234-mnk,gube1234-mand1436,African Savannah,EK
1.0.0,set11,set01,OI1,OI1,OI1-2,"8. Is [q2o1answer] stated as an expression of identity of any of the following? Race, ethnicity, or some other similar grouping",Yes,,Alexander Cobbinah,OV,6,Binary-YesNo,Yes,No,NA,NA,NA,NA,NA,NA,Cobbinah,Baïnounk Gubëeher,Bainounk Gubeeher,gube1234,gube1234,Mandinka,Mandinka,mnk,mand1436,Bainounk Gubeeher - Mandinka,gube1234-mnk,gube1234-mand1436,African Savannah,EK
1.0.0,set11,set01,OI1,OI1,OI1-3,"8. Is [q2o1answer] stated as an expression of identity of any of the following? Micro-level (politico-)territorial group, including regional or areal groups, clans, bands, tribes",Yes,,Alexander Cobbinah,OV,6,Binary-YesNo,Yes,No,NA,NA,NA,NA,NA,NA,Cobbinah,Baïnounk Gubëeher,Bainounk Gubeeher,gube1234,gube1234,Mandinka,Mandinka,mnk,mand1436,Bainounk Gubeeher - Mandinka,gube1234-mnk,gube1234-mand1436,African Savannah,EK
1.0.0,set11,set01,OI1,OI1,OI1-4,"8. Is [q2o1answer] stated as an expression of identity of any of the following? Macro-level (politico-)territorial group, such as nation, tribe, state",Yes,,Alexander Cobbinah,OV,6,Binary-YesNo,Yes,No,NA,NA,NA,NA,NA,NA,Cobbinah,Baïnounk Gubëeher,Bainounk Gubeeher,gube1234,gube1234,Mandinka,Mandinka,mnk,mand1436,Bainounk Gubeeher - Mandinka,gube1234-mnk,gube1234-mand1436,African Savannah,EK
1.0.0,set11,set01,OI1,OI1,OI1-5,"8. Is [q2o1answer] stated as an expression of identity of any of the following? Formal or informal relationships between non-kin, such as alliances, sodality membership, ad-hoc relationships between families or individuals",Yes,,Alexander Cobbinah,OV,6,Binary-YesNo,Yes,No,NA,NA,NA,NA,NA,NA,Cobbinah,Baïnounk Gubëeher,Bainounk Gubeeher,gube1234,gube1234,Mandinka,Mandinka,mnk,mand1436,Bainounk Gubeeher - Mandinka,gube1234-mnk,gube1234-mand1436,African Savannah,EK
1.0.0,set11,set01,OI3,OI3,,9. Is there a codified standard variety for [q2o1answer]?,No,"There have been attempts to codify the orthography of Baïnounk Gubëeher, but not to much success",Alexander Cobbinah,OV,6,Binary-YesNo,Yes,No,NA,NA,NA,NA,NA,NA,Cobbinah,Baïnounk Gubëeher,Bainounk Gubeeher,gube1234,gube1234,Mandinka,Mandinka,mnk,mand1436,Bainounk Gubeeher - Mandinka,gube1234-mnk,gube1234-mand1436,African Savannah,EK
1.0.0,set11,set01,OI6,OI6,,"10. What are the [q2o1answer] speakers' attitudes towards linguistic transfers from [q2o2answer], such as lexical or grammatical borrowing?",Very negative,"Influence from Mandinka is highly stigmatized and considered as damaging and polluting (see answer to questionnaire 'cultural knowledge').
 However, the following rather frequent items are clearly of Mandinka origin, although speakers of Gubeeher might not know this, as they are probably quite old loans that have lost any Mandinka connotation:
 
 daŋka - curse
 jaŋkadiŋ - bastard child
 jila - buy
 julaba - resell
 koloŋ - well
 kontiŋ - type of string instrument
 saaho - sheep
 wuli - thousand",Alexander Cobbinah,OV,6,Scalar,Very positive,Positive,Neither positive nor negative,Negative,Very negative,NA,NA,NA,Cobbinah,Baïnounk Gubëeher,Bainounk Gubeeher,gube1234,gube1234,Mandinka,Mandinka,mnk,mand1436,Bainounk Gubeeher - Mandinka,gube1234-mnk,gube1234-mand1436,African Savannah,EK
1.0.0,set11,set01,OI7,OI7,,"11. What are the [q2o1answer] speakers' general attitudes towards linguistic transfer, such as lexical or grammatical borrowing, from any other language than [q2o2answer]?",Neither positive nor negative,"This is ambivalent, as the ability to adapt and shift between languages is a central aspect of using language in Djibonker. Multilingualism is clearly the norm, and speakers are very comfortable to have multilingual conversations and actively pride themselves on their ability to do so. 
 (For an in-depth study of multilingual language use in Djibonker consult Weidl, M.M., 2021. The role of Wolof in multilingual conversations in the Casamance: Fluidity of linguistic repertoires. Köppe, R. - based on the phd thesis with the same title)
 When asked about the issue, many speakers of Baïnounk Gubëeher profess an overt aversion towards code-switching and mixing and state that too many loans make the language less pure, but in practice the same persons most certainly practice extensive code-switching and borrowing without any qualms only moments later (or even while badmouthing linguistic transfer). I suspect that these essentialist attitudes serve political purposes and are part of a certain set of ideologies that are part of the colonial and post-colonial perspective propagated in the media, government publications and the education system, but which have little to do with people's experiences of their linguistic (and cultural) surroundings and behaviours. The attitudes reflect what people think ought to be the case, but they happily engage in practices contrary to these assumptions that ar actually necessary for society to function.
 The integration of material from French is very common and not usually sanctioned. The switching between Baïnounk Gubëeher and Wolof, or the use of Wolof vocabulary is more frowned upon, as Wolof is considred by conservative speakers as a foreign and potentially hostile element, usually blamed for perceived language shift in young people and alleged loss of competence in Baïnounk Gubëeher. Contact with Joola languages accounts for the heaviest manifestations of contact induced language change, from phonology, to verbal morphology (person/number, TAM), noun class system and pragmatic structures. These phenomena are not generally registered as foreign, neither as polluting the language, only occasionally someone would remark that such and such item is 'actually' Joola, and make a show of replacing it with some more supposedly authentic Bainounk word. The numerous - probably centuries-old - lexical transfers from Portuguese-based Casamance Creole are also generally considered as authentically Bainounk.
 Obvious Mandinka transfers into Baïnounk Gubëeher would not be socially acceptable. and definitely judged as inappropriate. Speakers of other Bainounk lects or languages are often ridiculed for having incorporated Mandinka vocabulary and consequently their Bainounkness is put into doubt. This supposedly heavy Mandinguization is more often than not based on cliche̒s. I have heard people call varieties as Mandinguized, which they know almost nothing about, but whose speakers they consider as less Bainounk than them. In these cases any perceived difference in terms of language and culture from themselves was attributed to outside pollution and blamed on Mandinka, regardless of any linguistic or historical facts. Speakers with these attitudes also systematically ignore or downplay the transfers and contacts that have shaped their own language and culture (which is in turn highlighted by speakers of the other Bainounk varieties, who in turn consider themselves as bastions of linguistic and ethnic purity and all the others as mixed and diluted).",Alexander Cobbinah,OV,6,Scalar,Very positive,Positive,Neither positive nor negative,Negative,Very negative,NA,NA,NA,Cobbinah,Baïnounk Gubëeher,Bainounk Gubeeher,gube1234,gube1234,Mandinka,Mandinka,mnk,mand1436,Bainounk Gubeeher - Mandinka,gube1234-mnk,gube1234-mand1436,African Savannah,EK
1.0.0,set11,set01,OI9,OI9,,12. What are the [q2o1answer] speakers' attitudes towards lectal differences within [q2o1answer]?,Neither positive nor negative,"There is very little regular variation within the language due to the small size of the community. On the other hand, the lack of a codified standard allows for quite some personal variation, with ensuing disputes about which form is 'correct' and whose Baïnounk Gubëeher is better or purer than someone else's (of course everyone insists it is certainly theirs). Speech styles of young people are sometimes dismissed as sloppy or degenerate by older or more conservative speakers, who question their linguistic skills and consider them as corrupted by modernity or urban styles. These styles involve lexical transfers, including conjunctions and frequent expressions, from French and Wolof. Generally, avoidance of obvious loans is considered as mark of proficiency, at least the ability to do so in situations when this is required (e.g. public speeches, religious discourses). 
 Perceived difference between Baïnounk Gubëeher and other Baïnounk languages is usualy dismissed as corruption through contact with other populations considered as foreign, assimilating or undesirable, usually Joola Fogny and Mandinka.",Alexander Cobbinah,OV,6,Scalar,Very positive,Positive,Neither positive nor negative,Negative,Very negative,NA,NA,NA,Cobbinah,Baïnounk Gubëeher,Bainounk Gubeeher,gube1234,gube1234,Mandinka,Mandinka,mnk,mand1436,Bainounk Gubeeher - Mandinka,gube1234-mnk,gube1234-mand1436,African Savannah,EK
1.0.0,set11,set01,OI8,OI8,,13. How significant is language as part of group identity for the speakers of [q2o1answer]?,Significant,"Language is an important factor for defining in-groups. Knowledge of Baïnounk Gubëeher changes attitudes towards the speaker significantly, conveying trust and belonging. I have observed that speakers of Baïnounk Gubëeher use the language when in public to strengthen group cohesion, i.e. by excluding others from the conversation, or gossiping in their presence, which in turn strengthens the cohesion between those who do understand. The language is generally considered as very difficult and hard to learn for outsiders by its speakers.",Alexander Cobbinah,OV,6,Scalar,Very significant,Significant,Neither significant nor insignificant,Insignificant,Very insignificant,NA,NA,NA,Cobbinah,Baïnounk Gubëeher,Bainounk Gubeeher,gube1234,gube1234,Mandinka,Mandinka,mnk,mand1436,Bainounk Gubeeher - Mandinka,gube1234-mnk,gube1234-mand1436,African Savannah,EK
1.0.0,set11,set01,OB1,OB1,,14. There is an emic conception of [q2o1answer] as “a language” or some other categorical or objective thing?,Yes,"The terms Gubëeher or simply Baïnounk are used to refer to the language emically. The language is perceived as different from the surrounding Joola languages, and also from the related other Bainounk languages, for which there are emic terms as well. The concept of Bainounkness which ties the people of Djibonker to other populations speaking related languages is somewhat artificial (based on scientific, mostly linguistic, criteria) and mostly used by political activists. 'Bainounk' is not an emic category, there is no umbrella term for ethnic Bainounkness in Gubëeher.",Alexander Cobbinah,OV,6,Binary-YesNo,Yes,No,NA,NA,NA,NA,NA,NA,Cobbinah,Baïnounk Gubëeher,Bainounk Gubeeher,gube1234,gube1234,Mandinka,Mandinka,mnk,mand1436,Bainounk Gubeeher - Mandinka,gube1234-mnk,gube1234-mand1436,African Savannah,EK
1.0.0,set11,set01,O10,O10,,[q2o1answer] peoples’ language loyalty towards [q2o1answer] can be characterised as:,High,"I have the general impression that people in Djibonker take pride in their language and find it important to transmit it to their children. The general opinion seems to be that Gubëeher is a difficult and rich language. 
 It is also the language of the ancestors, as one informant states, you cannot address your ancestors in prayer in a foreign language (quoted in Cobbinah 2020), so language maintenance is also a ritual duty.",Alexander Cobbinah,OV,6,Scalar,Very high,High,Neither low nor high,Low,Very low,NA,NA,NA,Cobbinah,Baïnounk Gubëeher,Bainounk Gubeeher,gube1234,gube1234,Mandinka,Mandinka,mnk,mand1436,Bainounk Gubeeher - Mandinka,gube1234-mnk,gube1234-mand1436,African Savannah,EK
1.0.0,set11,set01,OL3,OL3,,15. Do the [q2o1answer] speaking people use some orthography in writing their language?,"No, the Focus Group language is not written","Few people write Gubëeher and if ever (such as in text messages or social media) then in a grassroots form partly derived form French conventions, partly improvised. The official orthography, officially codified, is hardly known by anyone.",Alexander Cobbinah,OV,6,Types,"Yes, in a non-standardised way","Yes, in a standardised way","No, the Focus Group language is not written",NA,NA,NA,NA,NA,Cobbinah,Baïnounk Gubëeher,Bainounk Gubeeher,gube1234,gube1234,Mandinka,Mandinka,mnk,mand1436,Bainounk Gubeeher - Mandinka,gube1234-mnk,gube1234-mand1436,African Savannah,EK
1.0.0,set11,set01,OL1,OL1,,16. What is the approximate rate of formal literacy in the [q2o1answer] speaking community?,Fairly high,Most of the residents of Djibonker have had some amount of schooling and are literate. Especially among older ladies literacy can be quite low. Currently 100% of school age children are enrolled in the local school.,Alexander Cobbinah,OV,6,Scalar,High,Fairly high,Intermediate,Fairly low,Low,NA,NA,NA,Cobbinah,Baïnounk Gubëeher,Bainounk Gubeeher,gube1234,gube1234,Mandinka,Mandinka,mnk,mand1436,Bainounk Gubeeher - Mandinka,gube1234-mnk,gube1234-mand1436,African Savannah,EK
1.0.0,set11,set01,OL2,OL2,OL2-1,"17. Restrictions in access to literacy in terms of social categories. Is the ability to read and write restricted, in practice, to people of certain hierarchy groups associated with profession or wealth (such as class and caste)?",No,,Alexander Cobbinah,OV,6,Binary-YesNo,Yes,No,NA,NA,NA,NA,NA,NA,Cobbinah,Baïnounk Gubëeher,Bainounk Gubeeher,gube1234,gube1234,Mandinka,Mandinka,mnk,mand1436,Bainounk Gubeeher - Mandinka,gube1234-mnk,gube1234-mand1436,African Savannah,EK
1.0.0,set11,set01,OL2,OL2,OL2-2,"17. Restrictions in access to literacy in terms of social categories. Is the ability to read and write restricted, in practice, to people of certain magico-religiously sanctioned groups (such as religious denomination)?",No,,Alexander Cobbinah,OV,6,Binary-YesNo,Yes,No,NA,NA,NA,NA,NA,NA,Cobbinah,Baïnounk Gubëeher,Bainounk Gubeeher,gube1234,gube1234,Mandinka,Mandinka,mnk,mand1436,Bainounk Gubeeher - Mandinka,gube1234-mnk,gube1234-mand1436,African Savannah,EK
1.0.0,set11,set01,OL2,OL2,OL2-3,"17. Restrictions in access to literacy in terms of social categories. Is the ability to read and write restricted, in practice, to people of certain descent groups, such as clan, house, lineage group, kinship group)?",No,,Alexander Cobbinah,OV,6,Binary-YesNo,Yes,No,NA,NA,NA,NA,NA,NA,Cobbinah,Baïnounk Gubëeher,Bainounk Gubeeher,gube1234,gube1234,Mandinka,Mandinka,mnk,mand1436,Bainounk Gubeeher - Mandinka,gube1234-mnk,gube1234-mand1436,African Savannah,EK
1.0.0,set11,set01,OL2,OL2,OL2-4,"17. Restrictions in access to literacy in terms of social categories. Is the ability to read and write restricted, in practice, to people of certain races, ethnicities, or some other similar grouping?",No,,Alexander Cobbinah,OV,6,Binary-YesNo,Yes,No,NA,NA,NA,NA,NA,NA,Cobbinah,Baïnounk Gubëeher,Bainounk Gubeeher,gube1234,gube1234,Mandinka,Mandinka,mnk,mand1436,Bainounk Gubeeher - Mandinka,gube1234-mnk,gube1234-mand1436,African Savannah,EK
1.0.0,set11,set01,OL2,OL2,OL2-5,"17. Restrictions in access to literacy in terms of social categories. Is the ability to read and write restricted, in practice, to people of certain age cohorts or life stages?",No,,Alexander Cobbinah,OV,6,Binary-YesNo,Yes,No,NA,NA,NA,NA,NA,NA,Cobbinah,Baïnounk Gubëeher,Bainounk Gubeeher,gube1234,gube1234,Mandinka,Mandinka,mnk,mand1436,Bainounk Gubeeher - Mandinka,gube1234-mnk,gube1234-mand1436,African Savannah,EK
1.0.0,set11,set01,OL2,OL2,OL2-6,"17. Restrictions in access to literacy in terms of social categories. Is the ability to read and write restricted, in practice, to a certain sex or genders?",Yes,,Alexander Cobbinah,OV,6,Binary-YesNo,Yes,No,NA,NA,NA,NA,NA,NA,Cobbinah,Baïnounk Gubëeher,Bainounk Gubeeher,gube1234,gube1234,Mandinka,Mandinka,mnk,mand1436,Bainounk Gubeeher - Mandinka,gube1234-mnk,gube1234-mand1436,African Savannah,EK
1.0.0,set11,set01,OL2,OL2,OL2-7,"17. Restrictions in access to literacy in terms of social categories. Is the ability to read and write restricted, in practice, to other communities of practice not mentioned above?",No,,Alexander Cobbinah,OV,6,Binary-YesNo,Yes,No,NA,NA,NA,NA,NA,NA,Cobbinah,Baïnounk Gubëeher,Bainounk Gubeeher,gube1234,gube1234,Mandinka,Mandinka,mnk,mand1436,Bainounk Gubeeher - Mandinka,gube1234-mnk,gube1234-mand1436,African Savannah,EK
1.0.0,set11,set01,OS1,OS1,,"18. Typically, how many levels of jurisdictional hierarchy are there in the [q2o1answer] speaking society, beyond the local community?",No levels,"I dont know how to quantify this. Political organization in Djibonker is based on avoiding concentration of power and based on kin-groups, geographic subdivisions and social groups. 
 Important decisions are made bottom up, with intricate systems of reunions and councils. Some issues are dealt with on family level, some involve the neighborhood, some the clan, some the whole village. In theory everybody has an equal voice and the right to speak.",Alexander Cobbinah,OV,6,Scalar,Four levels,Three levels,Two levels,One level,No levels,NA,NA,NA,Cobbinah,Baïnounk Gubëeher,Bainounk Gubeeher,gube1234,gube1234,Mandinka,Mandinka,mnk,mand1436,Bainounk Gubeeher - Mandinka,gube1234-mnk,gube1234-mand1436,African Savannah,EK
